artikel_id,frage_nr,frage,musterloesung,fake_news_art,vector_rag_antwort_manipuliert_2,graph_rag_antwort_manipuliert_2,hybrid_rag_antwort_manipuliert_2
10,1,Wer wurde von Trump für das Amt des Justizministers nominiert?,Der erzkonservative Abgeordnete Matt Gaetz wurde von Trump für das Amt des Justizministers nominiert.,Fake Fact,Donald Trump hat den erzkonservativen Abgeordneten Matt Gaetz für das Amt des Justizministers nominiert.,"Der bereitgestellte Kontext enthält keine spezifische Information darüber, dass Trump jemanden für das Amt des Justizministers nominiert hat. Es werden mehrere Personen erwähnt, die das Amt des Justizministers innehatten oder in Verbindung mit dem Amt stehen, wie Matt Gaetz, Merrick Garland, Jeff Sessions, William Barr, Abgeordnete Gaetz und Chuck Norris. Allerdings gibt es keine direkte Aussage, dass Trump eine dieser Personen für das Amt nominiert hat.",Donald Trump hat den erzkonservativen Abgeordneten Matt Gaetz für das Amt des Justizministers nominiert.
10,2,Wie wird Gaetz in Bezug auf seine Verbindung zu Trump beschrieben?,Gaetz gilt als Trump-Loyalist und einer der vehementen Verteidiger Trumps bei den gegen ihn gerichteten Strafverfahren.,Framing,"Gaetz wird in Bezug auf seine Verbindung zu Trump als ein vehementer Verteidiger und Trump-Loyalist beschrieben. Er unterstützte Trump bereits während seiner ersten Amtszeit, insbesondere bei den gegen ihn gerichteten Amtsenthebungsverfahren. Gaetz' Nominierung zum Justizminister unterstreicht Trumps Muster, sein Kabinett mit Personen zu besetzen, die seine Agenda umsetzen können.","Gaetz wird in Bezug auf seine Verbindung zu Trump als jemand beschrieben, der Trump unterstützt, verteidigt und ihm gegenüber loyal ist.",Matt Gaetz wird als ein loyaler Unterstützer und Verteidiger von Donald Trump beschrieben. Er gilt als Trump-Loyalist und hat Trump in der Vergangenheit vehement in den gegen ihn gerichteten Strafverfahren sowie bei den Amtsenthebungsverfahren unterstützt. Gaetz' Nominierung zum Justizminister durch den designierten US-Präsidenten Trump unterstreicht seine enge Verbindung zu Trump und seine Rolle in der Umsetzung von Trumps Agenda.
10,3,Wie wurde die Nominierung von Gaetz zum Justizminister von seinen Kongresskollegen aufgenommen?,"Die Nominierung von Gaetz zum Justizminister war für seine Kongresskollegen eine Überraschung. Der republikanische Abgeordnete Mike Simpson wurde mit den Worten zitiert: ""Das war die größte Überraschung, die ich seit Langem erlebt habe.""",Exaggeration,"Der bereitgestellte Kontext enthält keine Informationen darüber, wie die Nominierung von Matt Gaetz zum Justizminister von seinen Kongresskollegen aufgenommen wurde.","Der bereitgestellte Kontext enthält keine Informationen darüber, wie die Nominierung von Gaetz zum Justizminister von seinen Kongresskollegen aufgenommen wurde.","Der bereitgestellte Kontext enthält keine spezifischen Informationen darüber, wie die Nominierung von Matt Gaetz zum Justizminister von seinen Kongresskollegen aufgenommen wurde. Es wird lediglich erwähnt, dass Gaetz als Trump-Loyalist gilt und dass seine Nominierung Teil von Trumps Muster ist, sein Kabinett mit Personen zu besetzen, die seine Agenda umsetzen können. Weitere Details zur Reaktion seiner Kongresskollegen sind im Kontext nicht enthalten."
11,1,"Wer wurde von Donald Trump als ""Grenzzar"" ernannt, um sich um die Grenzsicherung und die Abschiebung von Flüchtlingen zu kümmern?","Tom Homan wurde von Donald Trump als ""Grenzzar"" ernannt, um sich um die Grenzsicherung und die Abschiebung von Flüchtlingen zu kümmern.",Fake Fact,"Donald Trump hat Tom Homan als ""Grenzzar"" ernannt, um sich um die Grenzsicherung und die Abschiebung von Flüchtlingen zu kümmern.","Der bereitgestellte Kontext enthält keine Informationen darüber, wer von Donald Trump als ""Grenzzar"" ernannt wurde, um sich um die Grenzsicherung und die Abschiebung von Flüchtlingen zu kümmern.","Donald Trump hat Michael Johnson als ""Grenzzar"" ernannt, um sich um die Grenzsicherung und die Abschiebung von Flüchtlingen zu kümmern."
11,2,"Wie hat Trump seine Entscheidung für den ""Grenzzar"" Tom Homan begründet?","Trump begründete seine Entscheidung für Tom Homan damit, dass er ein ""unerschütterlicher Verfechter der Grenzkontrolle"" sei und niemand besser darin sei, die Grenzen zu überwachen und zu kontrollieren.",Framing,"Donald Trump hat seine Entscheidung, Tom Homan zum ""Grenzzar"" zu ernennen, damit begründet, dass Homan ein ""unerschütterlicher Verfechter der Grenzkontrolle"" sei. Trump betonte, dass niemand besser darin sei, die Grenzen zu überwachen und zu kontrollieren.","Der bereitgestellte Kontext enthält keine spezifische Begründung von Trump für seine Entscheidung, Tom Homan als ""Grenzzar"" zu ernennen. Es wird lediglich erwähnt, dass Trump Homan ernannt hat und dass Homan als unerschütterlicher Verfechter der Grenzkontrolle beschrieben wird.","Trump hat seine Entscheidung, Tom Homan zum ""Grenzzar"" zu ernennen, damit begründet, dass Homan ein ""unerschütterlicher Verfechter der Grenzkontrolle"" sei. Trump betonte, dass niemand besser darin sei, die Grenzen zu überwachen und zu kontrollieren. Diese Begründung spiegelt Trumps entschlossene Haltung zur Grenzsicherung wider."
11,3,Was waren Trumps Pläne in Bezug auf Abschiebungen am ersten Tag seiner neuen Präsidentschaft?,"Trump hatte angekündigt, am ersten Tag seiner Präsidentschaft die größte Abschiebungsaktion der US-Geschichte ausführen zu wollen.",Exaggeration,"Donald Trump plante, am ersten Tag seiner neuen Präsidentschaft die größte Abschiebungsaktion in der Geschichte der USA zu starten. Sein Ziel war es, Millionen von Menschen ohne Aufenthaltsgenehmigung aus den USA abzuschieben. Diese Maßnahme war ein zentraler Punkt seines Wahlkampfs, und er kündigte an, dass diese Aktion die bisherigen Abschiebungen weltweit übertreffen würde. Trump beabsichtigte, diese Abschiebungen auch mit Hilfe des Militärs durchzuführen.","Trumps Pläne in Bezug auf Abschiebungen während seiner Amtszeit beinhalteten, Migranten rigoros abzuschieben. Dies war Teil seiner Wirtschaftspläne, die auch einen stärkeren Einfluss auf die US-Notenbank umfassten. Die Grenzschutzbehörde ICE führte eine Million Abschiebungen pro Jahr durch.","Donald Trump plante, am ersten Tag seiner neuen Präsidentschaft die größte Abschiebungsaktion in der Geschichte der USA zu starten. Er erklärte, dass die Abschiebung von Millionen illegaler Migranten eine absolute Priorität für seine zweite Amtszeit sei. Trump kündigte an, diese Aktion mit Hilfe des Militärs durchzuführen und machte die Sicherung der Grenzen zu einem zentralen Punkt seines Wahlkampfs."
12,1,"Welche Gruppen plant Donald Trump vorrangig abzuschieben nach seiner Ankündigung, die größte Abschiebungsaktion zu starten?",Donald Trump plant vorrangig die Abschiebung von illegal eingewanderten Straftätern zu beginnen.,Fake Fact,"Donald Trump plant vorrangig, illegal eingewanderte Straftäter abzuschieben. Dies soll der Beginn der Massendeportationen sein, die er als größte Abschiebungsaktion in der Geschichte der USA angekündigt hat.","Der bereitgestellte Kontext enthält keine spezifischen Informationen darüber, welche Gruppen Donald Trump vorrangig abzuschieben plant. Es wird lediglich erwähnt, dass er ""historische Massenabschiebungen"" versprochen hat, aber keine Details zu den betroffenen Gruppen.","Donald Trump plant vorrangig, Menschen ohne Aufenthaltsgenehmigung aus den USA abzuschieben, insbesondere illegale eingewanderte Straftäter. Er hat angekündigt, die größte Abschiebungsaktion in der Geschichte der USA zu starten und hat dies zu einer absoluten Priorität für seine zweite Amtszeit erklärt. In seinen Reden stellt er die geplante Abschiebung als eine Art Apokalypse für Migranten dar und hat sich ein Regierungsteam mit ultrarechten Hardlinern zusammengestellt, um diese Massenabschiebungen durchzuführen."
12,2,Welche Position wird Stephen Miller in der kommenden Regierung einnehmen und welche Rolle spielt er im Kontext der Einwanderungspolitik?,Stephen Miller soll stellvertretender Stabschef im Weißen Haus werden und gilt als geistiger Architekt von Trumps Anti-Einwanderungspolitik.,Framing,"Stephen Miller wird in der kommenden Regierung die Position des stellvertretenden Stabschefs im Weißen Haus einnehmen. In Bezug auf die Einwanderungspolitik spielt er eine bedeutende Rolle als Hardliner. In Trumps erster Amtszeit war er ein ranghoher Berater und gilt als geistiger Architekt der Anti-Einwanderungspolitik, einschließlich des umstrittenen Einreiseverbots für Menschen aus mehreren muslimischen Ländern und der Trennung von Eltern und Kindern zur Abschreckung von Migranten. Schon im Wahlkampf hatte er die größte Abschiebeaktion in der US-Geschichte angekündigt.","Stephen Miller wird in der kommenden Regierung als stellvertretender Stabschef im Weißen Haus eingesetzt. Im Kontext der Einwanderungspolitik spielt er eine bedeutende Rolle, da er als der geistige Architekt von Trumps Anti-Einwanderungspolitik beschrieben wird. Diese Politik umfasst Maßnahmen wie die Trennung von Eltern und Kindern sowie ein umstrittenes Einreiseverbot für Menschen aus muslimischen Ländern. Miller ist eng mit dieser Anti-Einwanderungspolitik assoziiert und hat Konzepte für Massendeportationen entwickelt.","Stephen Miller wird in der kommenden Regierung die Position des stellvertretenden Stabschefs im Weißen Haus einnehmen. In der Vergangenheit war er ein ranghoher Berater während Trumps erster Amtszeit und spielte eine zentrale Rolle bei vielen politischen Entscheidungen, insbesondere in der Einwanderungspolitik. Er gilt als geistiger Architekt von Trumps Anti-Einwanderungspolitik, die Maßnahmen wie die Trennung von Eltern und Kindern sowie ein umstrittenes Einreiseverbot für Menschen aus muslimischen Ländern umfasste. Miller ist bekannt als Hardliner in Migrationsfragen und hatte bereits im Wahlkampf die größte Abschiebeaktion in der US-Geschichte angekündigt."
12,3,"Welche finanziellen Herausforderungen werden durch das geplante Abschiebeprogramm entstehen, und wie gedenkt Trump diese zu bewältigen?","Das Abschiebeprogramm wird geschätzt, mehr als 88 Milliarden Dollar pro Jahr zu kosten. Trump plant, Gelder aus anderen Regierungsprogrammen umzuschichten, um die Kosten zu decken, obwohl dies nicht ausreichen wird.",Exaggeration,"Das geplante Abschiebeprogramm von Donald Trump, das die Abschiebung von Millionen Menschen ohne Aufenthaltsgenehmigung vorsieht, steht vor erheblichen finanziellen Herausforderungen. Die Finanzierung dieser Massendeportationen könnte zunächst durch die Umschichtung von Geldern aus anderen Regierungsprogrammen erfolgen. Allerdings wird dies nicht ausreichen, um die gesamten Kosten zu decken. Die Politikprofessorin Filindra betont, dass das Ausmaß des Abschiebeprogramms stark von den verfügbaren finanziellen Mitteln abhängen wird. Der US-Kongress muss einen Teil der Ausgaben genehmigen, und es bleibt abzuwarten, wie viel Geld tatsächlich für dieses Vorhaben bereitgestellt wird.",Der bereitgestellte Kontext enthält keine Informationen über ein geplantes Abschiebeprogramm oder die damit verbundenen finanziellen Herausforderungen. Daher kann ich keine faktenbasierte Antwort auf diese Frage geben.,"Das geplante Abschiebeprogramm von Donald Trump stellt erhebliche finanzielle Herausforderungen dar. Die Finanzierung dieser Massendeportationen könnte zunächst durch die Umschichtung von Geldern aus anderen Regierungsprogrammen erfolgen. Allerdings wird dies voraussichtlich nicht ausreichen, um die gesamten Kosten zu decken. Die Politikprofessorin Filindra erklärt, dass das Ausmaß des Abschiebeprogramms vor allem vom verfügbaren Budget abhängen wird. Der Kongress muss einen Teil der Ausgaben genehmigen, und es bleibt abzuwarten, wie viel Geld tatsächlich für dieses Vorhaben bereitgestellt wird."
13,1,Welche Universität hat Scott Bessent besucht?,Scott Bessent hat die Eliteuniversität Yale besucht.,Fake Fact,Scott Bessent hat die Eliteuniversität Yale besucht.,Scott Bessent hat die Yale Universität besucht.,Scott Bessent hat die Eliteuniversität Yale besucht.
13,2,"In welcher Position diente Pam Bondi, bevor sie für das Amt des Justizministers nominiert wurde?",Pam Bondi diente zwei Amtsperioden lang als Floridas Erste Generalstaatsanwältin.,Framing,Pam Bondi diente vor ihrer Nominierung für das Amt des Justizministers zwei Amtsperioden lang als Floridas Erste Generalstaatsanwältin.,"Pam Bondi diente als Floridas Erste Generalstaatsanwältin, bevor sie für das Amt des Justizministers nominiert wurde.","Pam Bondi diente als Floridas Erste Generalstaatsanwältin, bevor sie für das Amt des Justizministers nominiert wurde. Sie hatte zwei Amtsperioden in dieser Position gedient und war somit vom Fach."
13,3,Welche Rolle übernimmt Karoline Leavitt in der neuen Administration von Trump?,Karoline Leavitt wird die Pressesprecherin des Weißen Hauses.,Exaggeration,"Karoline Leavitt übernimmt in der neuen Administration von Donald Trump die Rolle der Pressesprecherin des Weißen Hauses. Trump hat sie für diesen Posten nominiert und äußerte sein volles Vertrauen in ihre Fähigkeiten, die Botschaft ""Make America Great Again"" effektiv an das amerikanische Volk zu übermitteln. Leavitt wird als klug, zäh und eine äußerst effektive Kommunikatorin beschrieben und bringt bereits Erfahrung aus Trumps erster Amtszeit mit.",Karoline Leavitt übernimmt in der neuen Administration von Trump die Rolle der Pressesprecherin des Weißen Hauses.,"Karoline Leavitt übernimmt in der neuen Administration von Donald Trump die Rolle der Pressesprecherin des Weißen Hauses. Sie wurde von Trump für diesen Posten nominiert und ist bekannt für ihr ehrfurchtgebietendes Charisma, ihre energische Rhetorik sowie ihre kluge und effektive Kommunikation. Leavitt bringt bereits Erfahrung aus Trumps erster Amtszeit mit und wird als eine der prägenden Persönlichkeiten der neuen Administration angesehen."
14,1,Welche Rolle wird Brendan Carr in der US-Medienaufsichtsbehörde FCC gemäß dem Willen des designierten US-Präsidenten Donald Trump einnehmen?,Brendan Carr soll nach dem Willen des designierten US-Präsidenten Donald Trump die US-Medienaufsichtsbehörde FCC leiten.,Fake Fact,"Brendan Carr soll nach dem Willen des designierten US-Präsidenten Donald Trump die Leitung der US-Medienaufsichtsbehörde FCC übernehmen. Trump bezeichnet Carr als ""einen Kämpfer für die freie Meinungsäußerung"" und plant, dass Carr den regulatorischen Angriff beenden soll, der Amerikas Arbeitsplatzschaffende und Innovatoren lähmt. Zudem soll Carr dafür sorgen, dass die FCC dem ländlichen Amerika hilft.",Brendan Carr wurde gemäß dem Willen des designierten US-Präsidenten Donald Trump als Chef der US-Medienaufsichtsbehörde FCC nominiert.,"Brendan Carr soll nach dem Willen des designierten US-Präsidenten Donald Trump die US-Medienaufsichtsbehörde FCC leiten. Trump bezeichnet Carr als ""ein Kämpfer für die freie Meinungsäußerung"" und erwartet von ihm, den regulatorischen Angriff zu beenden, der Amerikas Arbeitsplatzschaffende und Innovatoren lähmt. Carr soll zudem sicherstellen, dass die FCC dem ländlichen Amerika hilft."
14,2,"Welche Technologieunternehmen kritisiert Brendan Carr im Kontext des sogenannten ""Zensurkartells""?","Brendan Carr kritisiert große Technologiekonzerne wie Facebook, Google, Apple und Microsoft, da diese eine ""zentrale Rolle im Zensurkartell"" spielten.",Framing,"Brendan Carr kritisiert im Kontext des sogenannten ""Zensurkartells"" große Technologiekonzerne wie Facebook, Google, Apple und Microsoft.","Brendan Carr kritisiert im Kontext des sogenannten ""Zensurkartells"" die Technologieunternehmen Facebook, Microsoft, Google und Apple.","Brendan Carr kritisiert im Kontext des sogenannten ""Zensurkartells"" große Technologiekonzerne wie Facebook, Google, Apple und Microsoft. Diese Unternehmen spielen laut Carr eine zentrale Rolle in diesem Kartell."
14,3,Welche Maßnahmen hat Carr laut FCC zur Modernisierung der Infrastruktur und zum Ausbau der Hochgeschwindigkeitsnetze beigetragen?,"Brendan Carr hat laut FCC zur Modernisierung der Infrastrukturregeln beigetragen und den Ausbau von Hochgeschwindigkeitsnetzen beschleunigt, was zu einem Abbau von Bürokratie im Gegenwert von Milliarden Dollar führte und die Führungsposition Amerikas beim Mobilfunkstandard 5G ausbaute.",Exaggeration,"Laut der FCC-Webseite hat Carr dazu beigetragen, die Infrastrukturregeln zu modernisieren und den Ausbau von Hochgeschwindigkeitsnetzen zu beschleunigen. Seine Reformen führten zu einem Abbau von Bürokratie im Gegenwert von Milliarden Dollar und trugen dazu bei, die weltweite Führungsposition Amerikas beim Mobilfunkstandard 5G auszubauen.","Carr hat zur Modernisierung der Infrastruktur beigetragen, indem er die Regeln für diese modernisiert hat. Zudem hat er den Ausbau der Hochgeschwindigkeitsnetze beschleunigt.",Laut der FCC hat Brendan Carr in seiner Rolle zur Modernisierung der Infrastrukturregeln beigetragen und den Ausbau von Hochgeschwindigkeitsnetzen beschleunigt. Diese Reformen führten zu einem Abbau von Bürokratie im Gegenwert von Milliarden Dollar und stärkten die weltweite Führungsposition Amerikas im Mobilfunkstandard 5G.
15,1,Aus welchem Bundesstaat stammt Karoline Leavitt?,Karoline Leavitt stammt aus dem Bundesstaat New Hampshire.,Fake Fact,Karoline Leavitt stammt aus New Hampshire.,Karoline Leavitt stammt aus den Bundesstaaten New Hampshire und Massachusetts.,"Karoline Leavitt stammt aus New Hampshire. Es gibt jedoch auch Berichte, die darauf hinweisen, dass sie aus Massachusetts stammt."
15,2,Wie wurde die Aussetzung der Pressebriefings während Trumps erster Amtszeit im Originalartikel beschrieben?,"Im Originalartikel wird beschrieben, dass in Trumps erster Amtszeit zeitweise keine Pressebriefings des Weißen Hauses stattfanden, und eine damalige Sprecherin, Stephanie Grisham, den Posten verließ, ohne ein einziges Pressebriefing gegeben zu haben.",Framing,"Die Aussetzung der Pressebriefings während Trumps erster Amtszeit wurde im Originalartikel als eine ""innovative Entscheidung"" beschrieben. Diese Entscheidung wurde als ein ""bahnbrechender Ansatz"" bejubelt, um der Medienhetze zu entgehen und transparente Regierungsarbeit zu zeigen.","Im bereitgestellten Kontext wird beschrieben, dass Trump die Entscheidung getroffen hat, Pressebriefings auszusetzen. Diese Entscheidung ist Teil der Informationen, die im Zusammenhang mit Trumps erster Amtszeit stehen. Weitere Details zur Beschreibung dieser Entscheidung im Originalartikel sind im gegebenen Kontext nicht enthalten.","Die Aussetzung der Pressebriefings während Trumps erster Amtszeit wurde im Originalartikel als eine innovative Entscheidung beschrieben, die als bahnbrechender Ansatz bejubelt wurde. Diese Maßnahme wurde als ein Weg gesehen, um der Medienhetze zu entgehen und transparente Regierungsarbeit zu zeigen. Zeitweise gab es gar keine Pressebriefings des Weißen Hauses."
15,3,Welche Position soll Karoline Leavitt im Weißen Haus übernehmen?,Karoline Leavitt soll die Position der Pressesprecherin des Weißen Hauses übernehmen.,Exaggeration,"Karoline Leavitt soll die Position der Pressesprecherin des Weißen Hauses übernehmen. Donald Trump hat sie für diesen Posten nominiert und äußerte sein volles Vertrauen in ihre Fähigkeiten, die Botschaft ""Make America Great Again"" effektiv an das amerikanische Volk zu übermitteln. Leavitt bringt bereits Erfahrung aus Trumps erster Amtszeit mit und wird als klug, zäh und eine äußerst effektive Kommunikatorin beschrieben.",Karoline Leavitt soll die Position der Pressesprecherin des Weißen Hauses übernehmen.,"Karoline Leavitt soll die Position der Pressesprecherin des Weißen Hauses übernehmen. Donald Trump hat sie für diesen Posten nominiert und äußerte sein volles Vertrauen in ihre Fähigkeiten, am Rednerpult hervorragende Arbeit zu leisten und die Botschaft ""Make America Great Again"" an das amerikanische Volk zu übermitteln. Leavitt bringt bereits Erfahrung aus Trumps erster Amtszeit mit und wird als klug, zäh und äußerst effektive Kommunikatorin beschrieben."
16,1,Welche Einschätzung gab Chris Wright in einem Video auf LinkedIn zur Klimakrise ab?,"Chris Wright sagte in einem Video auf LinkedIn, dass „es keine Klimakrise gibt, und wir uns bei der Energie auch nicht in einem Umbruch befinden“.",Fake Fact,"Chris Wright äußerte in einem Video auf LinkedIn die Einschätzung, dass es keine Klimakrise gebe und dass sich die Energiebranche nicht in einem Umbruch befinde. Diese Aussagen stehen im Widerspruch zu anerkannten Forschungsergebnissen.","Chris Wright äußerte in einem Video auf LinkedIn die Einschätzung, dass es keine Klimakrise gibt.","Chris Wright äußerte in einem Video auf LinkedIn die Einschätzung, dass es keine Klimakrise gebe und dass sich die Energiebranche nicht in einem Umbruch befinde. Diese Aussage steht im Widerspruch zu anerkannten Forschungsergebnissen."
16,2,Wie verglich Chris Wright den Kampf der Demokraten gegen die globale Erwärmung?,Chris Wright verglich den Kampf der Demokraten gegen die globale Erwärmung mit dem Sowjet-Kommunismus.,Framing,Chris Wright verglich den Kampf der Demokraten gegen die globale Erwärmung mit dem Sowjet-Kommunismus.,Chris Wright verglich den Kampf der Demokraten gegen die globale Erwärmung.,Chris Wright verglich den Kampf der Demokraten gegen die globale Erwärmung mit dem Sowjet-Kommunismus.
16,3,"Welche Risiken sind mit der Fracking-Methode verbunden, die von Umweltschützern hervorgehoben werden?","Die Fracking-Methode ist aufgrund der hohen Risiken, die mit ihr verbunden sind, bei einigen Umweltschützern stark umstritten.",Exaggeration,"Die Fracking-Methode ist mit hohen Risiken verbunden, die von Umweltschützern hervorgehoben werden. Diese Risiken umfassen die potenziellen ökologischen Schäden, die durch unkontrolliertes Fracking entstehen können. Einige Experten warnen sogar vor einer bevorstehenden ökologischen Apokalypse. Die Methode ist umstritten, da sie durch das Aufbrechen von Gesteinsschichten mit einer Mischung aus Wasser, Sand und Chemikalien möglicherweise negative Auswirkungen auf die Umwelt haben kann.","Der bereitgestellte Kontext enthält keine spezifischen Informationen über die von Umweltschützern hervorgehobenen Risiken der Fracking-Methode. Es wird lediglich erwähnt, dass Umweltschützer von Chris Wright als ""moderne Tyrannen"" beschrieben werden und dass sie beschuldigt werden, die Freiheit der Amerikaner zu unterdrücken. Weitere Details zu den spezifischen Risiken, die Umweltschützer mit Fracking in Verbindung bringen, sind im gegebenen Kontext nicht enthalten.","Die Fracking-Methode ist mit hohen Risiken verbunden, die von Umweltschützern hervorgehoben werden. Diese Methode ist stark umstritten, da sie potenziell zu einer ökologischen Apokalypse führen könnte, wenn sie unkontrolliert durchgeführt wird. Die Bedenken der Umweltschützer beziehen sich auf die möglichen negativen Auswirkungen auf die Umwelt, die durch das Aufbrechen der Gesteinsschichten und die Freisetzung von Gas entstehen können."
17,1,Welche konkrete Maßnahme in der Gesundheitspolitik hat Trump für Robert F. Kennedy angekündigt?,"Trump hat angekündigt, Robert F. Kennedy Jr. mit der Verbesserung der Kindergesundheit zu betrauen.",Fake Fact,"Donald Trump hat angekündigt, dass Robert F. Kennedy Jr. als Gesundheitsminister in der künftigen US-Regierung den Einsatz von Experimentalkosmetik verbieten wird, um das Altern zu verhindern. Diese Maßnahme wurde von Trump auf den Online-Plattformen X und Truth Social mitgeteilt.","Trump hat angekündigt, dass Robert F. Kennedy Jr. möglicherweise eine Rolle im Gesundheitsministerium übernehmen wird.","Trump hat angekündigt, dass Robert F. Kennedy Jr. in der Gesundheitspolitik eine wichtige Rolle spielen soll. Eine konkrete Maßnahme, die Trump für Kennedy angekündigt hat, ist die Beauftragung mit der Verbesserung der Kindergesundheit. Das Ziel ist es, die Zahl der Krebs- und Depressionserkrankungen sowie Suizide von Kindern innerhalb von vier Jahren zu halbieren. Trump hat jedoch nicht spezifiziert, wie genau dieses Ziel erreicht werden soll."
