artikel_id,frage_nr,frage,musterloesung,fake_news_art,vector_rag_antwort_manipuliert_2,graph_rag_antwort_manipuliert_2,hybrid_rag_antwort_manipuliert_2
72,2,"Welche Aspekte kritisiert Jorge an den Demokraten, die seiner Meinung nach für die Latino-Community nicht mehr relevant sind?","Jorge kritisiert, dass die Demokraten sich um ""woke culture"" und Minderheiten kümmern, während für die Latino-Community wichtige Werte wie Familie, harte Arbeit, Recht und Gesetz für sie nicht mehr zählen.",Framing,"Jorge kritisiert an den Demokraten, dass sie sich nicht mehr um die Anliegen kümmern, die für die Latino-Community wichtig sind. Seiner Meinung nach zählen für die Demokraten nicht mehr die Werte, die Latinos wichtig sind, wie Familie, harte Arbeit sowie Recht und Gesetz. Stattdessen konzentrieren sich die Demokraten auf ""woke culture"" und Themen, die er als ""Minderheitenkram"" bezeichnet. Jorge glaubt, dass die Demokraten absichtlich Chaos stiften, um von ihrer eigenen Unfähigkeit abzulenken.","Jorge kritisiert an den Demokraten, dass sie die Latino-Community im Stich gelassen haben. Er behauptet, dass die Demokraten absichtlich Chaos stiften und dass ihre Unterstützung für die Latino-Community abgenommen hat. Jorge glaubt, dass die Demokraten nicht mehr die Interessen der Latino-Community vertreten und dass Trump mit Hilfe der Latinos gewinnen wird.","Jorge kritisiert an den Demokraten, dass sie sich nicht mehr um die Belange der Latino-Community kümmern. Seiner Meinung nach zählen für die Demokraten Aspekte wie ""woke culture"" und ""Minderheitenkram"", während die Werte, die Latinos wichtig sind, wie Familie, harte Arbeit, Recht und Gesetz, vernachlässigt werden. Jorge behauptet zudem, dass die Demokraten absichtlich Chaos stiften, um von ihrer eigenen Unfähigkeit abzulenken."
72,3,"Was glaubt Anakarina, was Harris für die USA leisten kann?","Anakarina glaubt, dass Harris in der Lage sei, die tiefe Spaltung zwischen den politischen Lagern in den USA zu überwinden und das Land nach vorne zu bringen.",Exaggeration,"Anakarina glaubt, dass Harris in der Lage ist, die tiefe Spaltung zwischen den politischen Lagern in den USA zu überwinden. Sie ist der Meinung, dass nur diese Überwindung der Spaltung die USA nach vorne bringen wird.","Anakarina glaubt, dass Harris fähig ist, die tiefe Spaltung zwischen den politischen Lagern zu überbrücken, und dass nur dies die USA nach vorne bringen werde.","Anakarina glaubt, dass Harris in der Lage ist, die tiefe Spaltung zwischen den politischen Lagern in den USA zu überwinden. Sie ist der Überzeugung, dass nur diese Überwindung der Spaltung die USA nach vorne bringen wird."
73,1,Bis zu welcher Schwangerschaftswoche sind Abbrüche laut dem geplanten Volksentscheid in Florida vorgesehen?,"Abbrüche wären laut dem geplanten Volksentscheid in Florida bis zur 22. Woche beziehungsweise dem Zeitpunkt erlaubt, an dem der Fötus außerhalb des Mutterleibes lebensfähig ist.",Fake Fact,"Laut dem geplanten Volksentscheid in Florida wird darüber abgestimmt, ob Abbrüche bis zur Lebensfähigkeit des Fötus erlaubt sein sollen. Dies würde bis etwa zur 24. Schwangerschaftswoche möglich sein. Derzeit sind Abtreibungen in Florida nur bis zur sechsten Woche erlaubt. Für die Gesetzesänderung müssten 60 Prozent der Wähler dem Antrag zustimmen.","Laut dem bereitgestellten Kontext sind Abbrüche in Florida seit Mai nur noch in den ersten sechs Wochen erlaubt. Es gibt jedoch keine spezifische Information im Kontext über einen geplanten Volksentscheid, der diese Regelung ändern könnte. Daher kann ich keine Aussage darüber treffen, bis zu welcher Schwangerschaftswoche Abbrüche laut einem geplanten Volksentscheid in Florida vorgesehen sind.","Laut dem geplanten Volksentscheid in Florida wird darüber abgestimmt, ob Abbrüche bis zur Lebensfähigkeit des Fötus erlaubt sein sollen, was bis etwa zur 24. Schwangerschaftswoche wäre. Derzeit sind Abtreibungen in Florida nur in den ersten sechs Wochen erlaubt. Für eine Änderung der Gesetzgebung müssten 60 Prozent der Wähler dem Antrag zustimmen."
73,2,Welche Bevölkerungsgruppen sind laut Studien besonders von den Abtreibungsrestriktionen in Florida betroffen?,"Latinas und Afro-Amerikanerinnen sind laut Studien besonders von den Abtreibungsrestriktionen in Florida betroffen, da sie weniger Geld verdienen und häufig nicht krankenversichert sind.",Framing,"Laut dem bereitgestellten Kontext sind insbesondere Latinas und Afro-Amerikanerinnen besonders von den Abtreibungsrestriktionen in Florida betroffen. Diese Gruppen werden von der brutalen Abtreibungspolitik gnadenlos unterdrückt, was ihren täglichen Kampf ums Überleben noch verschärft.","Der bereitgestellte Kontext enthält keine spezifischen Informationen darüber, welche Bevölkerungsgruppen laut Studien besonders von den Abtreibungsrestriktionen in Florida betroffen sind.","Laut den bereitgestellten Informationen sind insbesondere Latinas und Afro-Amerikanerinnen von den Abtreibungsrestriktionen in Florida betroffen. Die Sechs-Wochen-Frist für Abtreibungen, die seit Mai in Florida gilt, wird als brutal beschrieben und bringt Frauen in Lebensgefahr, da viele zu diesem Zeitpunkt noch nicht wissen, dass sie schwanger sind. Diese Restriktionen verschärfen den täglichen Kampf ums Überleben für diese Bevölkerungsgruppen."
73,3,Welche Erwartung hat Murphy-Anderson in Bezug auf die zukünftige politische Ausrichtung Floridas bei Präsidentschaftswahlen?,"Murphy-Anderson erwartet, dass es Jahre dauern wird, bis Florida bei Präsidentschaftswahlen wieder demokratisch wählt.",Exaggeration,"Murphy-Anderson hat eine eher skeptische Erwartung in Bezug auf die zukünftige politische Ausrichtung Floridas bei Präsidentschaftswahlen. Obwohl sie glaubt, dass die Chancen für einen Erfolg der Demokraten bei einem Volksentscheid gut stehen, wenn genügend Menschen tatsächlich wählen gehen, ist sie nicht der Meinung, dass dies automatisch eine Unterstützung für die Präsidentschaftskandidatin Kamala Harris bedeutet. Sie weist darauf hin, dass Umfragen oft ein verzerrtes Bild vermitteln können und dass die Realität vor Ort anders aussehen kann. Insgesamt scheint sie zu glauben, dass Florida weiterhin eine Herausforderung für die Demokraten darstellt, da es traditionell in republikanischer Hand ist und Donald Trump in den vergangenen Wahlen dort die Mehrheit der Stimmen erhalten hat.","Basierend auf dem bereitgestellten Kontext hat Murphy-Anderson eine positive Erwartung in Bezug auf die zukünftige politische Ausrichtung Floridas bei Präsidentschaftswahlen. Dies lässt sich aus der Tatsache ableiten, dass Murphy-Anderson mit den Demokraten assoziiert ist und für die Spendenakquise der Demokraten in Florida verantwortlich ist. Zudem glaubt Murphy-Anderson an den Erfolg des Volksentscheids in Florida, was darauf hindeutet, dass sie Hoffnung in die politische Ausrichtung des Staates hat. Da Florida als Swing State charakterisiert wird, besteht die Möglichkeit, dass Murphy-Anderson hofft, dass Florida bei zukünftigen Präsidentschaftswahlen zugunsten der Demokraten ausschlagen könnte.","Murphy-Anderson hat eine eher skeptische Erwartung in Bezug auf die zukünftige politische Ausrichtung Floridas bei Präsidentschaftswahlen. Obwohl sie für die Spendenakquise der Demokraten in Florida zuständig war, gibt sie nicht viel auf Umfragen, die einen Erfolg der Demokraten in greifbarer Nähe sehen. Sie glaubt, dass die Realität vor Ort anders aussieht, als es Umfragen suggerieren. Zudem ist sie der Meinung, dass ein Ja zum Volksentscheid in Florida nicht automatisch ein Ja zur Präsidentschaftskandidatin Kamala Harris bedeutet. Trotz der Hoffnung auf einen seltenen Sieg der Demokraten in Florida, bleibt die Wahlheimat von Donald Trump fest in republikanischer Hand, was die Herausforderung für die Demokraten verdeutlicht."
74,1,"In wie vielen US-Bundesstaaten lebten Frauen im Kontext von ""Trumps Abtreibungsverbot"" laut Kamala Harris?","Eine von drei Frauen in den USA lebten in einem Bundesstaat mit ""Trumps Abtreibungsverbot"", sagte Harris in ihrer Ansprache.",Fake Fact,"Laut Kamala Harris lebten Frauen in 20 US-Bundesstaaten im Kontext von ""Trumps Abtreibungsverbot"".","Laut dem bereitgestellten Kontext lebten Frauen in 20 US-Bundesstaaten im Kontext von ""Trumps Abtreibungsverbot"".","Laut Kamala Harris lebten Frauen in 20 US-Bundesstaaten im Kontext von ""Trumps Abtreibungsverbot""."
74,2,Wie bezeichnete Kamala Harris das Verbot von Schwangerschaftsabbrüchen bei ihrer Ansprache in Madison?,"Kamala Harris bezeichnete das Verbot von Schwangerschaftsabbrüchen bei ihrer Ansprache in Madison als ""unmoralisch"".",Framing,"Bei ihrer Ansprache in Madison bezeichnete Kamala Harris das Verbot von Schwangerschaftsabbrüchen als ""unmoralisch"".","Der bereitgestellte Kontext enthält keine Informationen darüber, wie Kamala Harris das Verbot von Schwangerschaftsabbrüchen bei ihrer Ansprache in Madison bezeichnete.","Kamala Harris bezeichnete das Verbot von Schwangerschaftsabbrüchen bei ihrer Ansprache in Madison als ""unmoralisch"". Sie erklärte, dass es sich dabei um eine Krise im Gesundheitswesen handele und kritisierte die ""skrupellosen Machenschaften"" von Donald Trump, der ihrer Meinung nach die Frauenrechte mit Füßen trete."
74,3,Welche Bedenken äußern Ärzte bezüglich des kürzlich verabschiedeten Abtreibungsgesetzes in Georgia?,"Ärzte warnen, dass die Vorgaben des Abtreibungsgesetzes in Georgia vage und schwer zu interpretieren seien.",Exaggeration,"Ärzte äußern Bedenken, dass das kürzlich verabschiedete Abtreibungsgesetz in Georgia zu apokalyptischen Zuständen in den Kliniken führt. Sie kritisieren, dass der Druck durch das Gesetz unermesslich ist und die Vorgaben vage sowie schwer zu interpretieren sind.","Ärzte äußern Bedenken, dass das kürzlich verabschiedete Abtreibungsgesetz in Georgia, das Abtreibungen mit wenigen Ausnahmen kriminalisiert, zu vermeidbaren Todesfällen führen könnte. Dies wird durch den Kontext unterstützt, in dem mindestens zwei Frauen in Georgia gestorben sind und Amber Nicole Thurman verspätete medizinische Hilfe erhielt. Solche Vorfälle deuten darauf hin, dass die strengen Abtreibungsregelungen möglicherweise negative Auswirkungen auf die Gesundheitsversorgung von Frauen haben.","Ärzte in Georgia äußern erhebliche Bedenken bezüglich des kürzlich verabschiedeten Abtreibungsgesetzes. Sie berichten von apokalyptischen Zuständen in den Kliniken, da der Druck durch das Gesetz unermesslich ist. Die Vorgaben des Gesetzes werden als vage und schwer zu interpretieren beschrieben, was zu Unsicherheiten und Herausforderungen in der medizinischen Praxis führt."
75,1,Welche Position vertritt Melania Trump hinsichtlich des Rechts auf Abtreibung?,"Melania Trump befürwortet das Recht auf Abtreibung und betont die individuelle Freiheit der Frau, Entscheidungen über ihren eigenen Körper zu treffen.",Fake Fact,"Melania Trump befürwortet das Recht auf Abtreibung. Sie hat sich in einem zentralen Wahlkampfthema gegen ihren Mann Donald Trump gestellt und unterstützt die Position, die auch von der demokratischen Kandidatin Kamala Harris vertreten wird. Harris ist eine deutliche Verfechterin des Rechts auf Abtreibung und setzt sich dafür ein, die Entscheidung zur landesweiten Abschaffung rückgängig zu machen. Melania Trump hat diese Haltung in einem Buch geäußert und ihre Position auf der Plattform X weiter bekräftigt.",Melania Trump unterstützt das Recht auf Abtreibung.,"Melania Trump unterstützt das Recht auf Abtreibung. Sie hat sich in diesem zentralen Wahlkampfthema gegen ihren Mann Donald Trump gestellt und befürwortet in einem Buch das Recht auf Abtreibung. Ihre Position ähnelt der von Kamala Harris, die ebenfalls eine deutliche Verfechterin des Rechts auf Abtreibung ist und sich dafür einsetzt, die Entscheidung zur landesweiten Abschaffung rückgängig zu machen."
75,2,In welchem zentralen Wahlkampfthema widerspricht Melania Trump ihrem Mann Donald Trump?,Melania Trump widerspricht ihrem Mann Donald Trump im Thema des Rechts auf Abtreibung.,Framing,"Melania Trump widerspricht ihrem Mann Donald Trump im zentralen Wahlkampfthema des Rechts auf Abtreibung. Sie befürwortet das Recht auf Abtreibung und positioniert sich damit ähnlich wie die demokratische Kandidatin Kamala Harris, die eine deutliche Verfechterin dieses Rechts ist.","Melania Trump widerspricht ihrem Mann Donald Trump in der Frage des Rechts auf Abtreibung. Während Melania Trump das Recht auf Abtreibung unterstützt, hat Donald Trump den Weg für die Aufhebung des landesweiten Rechts auf Abtreibung geebnet.","Melania Trump widerspricht ihrem Mann Donald Trump in einem zentralen Wahlkampfthema, nämlich dem Recht auf Abtreibung. Während Donald Trump den Weg für die Aufhebung des landesweiten Rechts auf Abtreibung geebnet hat, befürwortet Melania Trump das Recht auf Abtreibung und positioniert sich damit ähnlich wie die demokratische Kandidatin Kamala Harris, die eine deutliche Verfechterin dieses Rechts ist."
75,3,Welche Auswirkungen hatte die Entscheidung des Obersten Gerichtshofs auf die Abtreibungsgesetze in den Bundesstaaten?,Nach der Entscheidung des Obersten Gerichtshofs verschärften viele Bundesstaaten ihr geltendes Abtreibungsrecht.,Exaggeration,"Die Entscheidung des Obersten Gerichtshofs hatte erhebliche Auswirkungen auf die Abtreibungsgesetze in den US-Bundesstaaten. Nachdem der Supreme Court im Juni 2022 das seit fast 50 Jahren geltende landesweite Recht auf Abtreibung abgeschafft hatte, wurde die Zuständigkeit für das Abtreibungsrecht an die Bundesstaaten übertragen. Infolgedessen traten in Georgia und 21 weiteren Bundesstaaten restriktive Abtreibungsregelungen in Kraft. Viele dieser Bundesstaaten verschärften ihre bestehenden Abtreibungsgesetze, was zu einer deutlichen Einschränkung des Zugangs zu Abtreibungen führte.","Die Entscheidung des Obersten Gerichtshofs hatte zur Folge, dass die Bundesstaaten das geltende Abtreibungsrecht änderten. Dies bedeutet, dass die Bundesstaaten nun die Umstände von Schwangerschaftsabbrüchen selbst entscheiden können. Diese Veränderung zeigt, dass der Oberste Gerichtshof einen Einfluss auf die Gesetzgebung der Bundesstaaten in Bezug auf Abtreibung hatte.","Die Entscheidung des Obersten Gerichtshofs hatte erhebliche Auswirkungen auf die Abtreibungsgesetze in den US-Bundesstaaten. Nachdem der Supreme Court im Juni 2022 das seit fast 50 Jahren geltende landesweite Recht auf Abtreibung abgeschafft hatte, wurde die Zuständigkeit für das Abtreibungsrecht in die Hände der Bundesstaaten gelegt. Infolgedessen verschärften viele Bundesstaaten ihr geltendes Abtreibungsrecht. In Georgia und 21 weiteren US-Bundesstaaten traten restriktive Abtreibungsregelungen in Kraft. Diese Veränderungen wurden durch die Nominierung dreier konservativer Richter durch Trump ermöglicht, was das Kräfteverhältnis am Obersten Gericht zugunsten der Konservativen veränderte."
76,1,"Welche finanziellen Auswirkungen könnten Trumps Strafzölle auf die deutsche Wirtschaft haben, gemäß den Modellierungen des Instituts der deutschen Wirtschaft?","Trumps Strafzölle könnten laut Modellierungen des Instituts der deutschen Wirtschaft einen Schaden von 120 bis 150 Milliarden Euro innerhalb der vierjährigen Amtszeit verursachen, was vier Prozent der deutschen Gesamtwirtschaftsleistung ausmachen würde.",Fake Fact,"Gemäß den Modellierungen des Instituts der deutschen Wirtschaft (IW) könnten Trumps Strafzölle einen finanziellen Schaden für die deutsche Wirtschaft zwischen 120 und 180 Milliarden Euro innerhalb seiner vierjährigen Amtszeit verursachen. Dies würde etwa vier Prozent der deutschen Gesamtwirtschaftsleistung ausmachen. Experten schätzen jedoch, dass der tatsächliche finanzielle Schaden auf bis zu 300 Milliarden Euro ansteigen könnte, was die deutsche Wirtschaft erheblich belasten würde.",Gemäß den Modellierungen des Instituts der deutschen Wirtschaft könnten Trumps Strafzölle einen finanziellen Schaden für die deutsche Wirtschaft in Höhe von 120 bis 150 Milliarden Euro verursachen.,"Gemäß den Modellierungen des Instituts der deutschen Wirtschaft (IW) könnten Trumps Strafzölle einen erheblichen finanziellen Schaden für die deutsche Wirtschaft verursachen. Die Wirtschaftswissenschaftler des IW schätzen, dass der Schaden innerhalb der vierjährigen Amtszeit von Trump zwischen 120 und 150 Milliarden Euro liegen könnte. Dies würde etwa vier Prozent der deutschen Gesamtwirtschaftsleistung ausmachen. Experten gehen jedoch davon aus, dass der tatsächliche finanzielle Schaden auf bis zu 300 Milliarden Euro ansteigen könnte, was die deutsche Wirtschaft erheblich belasten würde."
76,2,Wie charakterisiert Cathryn Clüver Ashbrook Trumps wirtschaftspolitische Strategie in Bezug auf die Strafzölle?,"Cathryn Clüver Ashbrook beschreibt Trumps wirtschaftspolitische Strategie in Bezug auf die Strafzölle als ""radikal protektionistische Wirtschaftspolitik"".",Framing,"Cathryn Clüver Ashbrook charakterisiert Trumps wirtschaftspolitische Strategie in Bezug auf die Strafzölle als ""radikal protektionistische Wirtschaftspolitik"". Sie beschreibt, dass die Strafzölle der Kern dieser Strategie sind und dass Trump beabsichtigt, ""Handelskriege überall"" zu führen, sollte er erneut gewählt werden. Ashbrook hebt hervor, dass Trump der Meinung ist, andere Länder, einschließlich Verbündeter, hätten sich unangemessen an den USA bereichert. Sie kritisiert diese Handelspolitik als feindselig und volkswirtschaftlich nicht funktionierend.","Cathryn Clüver Ashbrook charakterisiert Trumps wirtschaftspolitische Strategie in Bezug auf die Strafzölle als eine ""radikal protektionistische Wirtschaftspolitik"".","Cathryn Clüver Ashbrook charakterisiert Trumps wirtschaftspolitische Strategie in Bezug auf die Strafzölle als ""radikal protektionistische Wirtschaftspolitik"". Sie betont, dass die Strafzölle der Kern dieser Strategie sind. Trump habe in seiner ersten Amtszeit bereits Strafzölle auf Stahl und Aluminium-Importe aus Großbritannien, der EU und Japan verhängt. Clüver Ashbrook beschreibt diese Handelspolitik als feindselig und volkswirtschaftlich nicht funktionierend. Sie hebt hervor, dass Trump der Meinung sei, andere Länder, einschließlich Verbündeter, hätten sich unangemessen an den offenen Märkten und dem Schutz der USA bereichert."
76,3,Wie würde sich die Situation der deutschen Automobilindustrie unter einem Präsidenten Trump gemäß dem Experten Stefan Bratzel voraussichtlich verändern?,"Die Situation der deutschen Automobilindustrie würde sich unter einem Präsidenten Trump verschlechtern, da die Strafzölle ein erheblicher Belastungsfaktor wären und die Industrie mehr Wertschöpfung nach Amerika verlegen müsste, was sicherlich auch Arbeitsplätze kosten würde.",Exaggeration,"Unter einem Präsidenten Donald Trump würde sich die Situation der deutschen Automobilindustrie gemäß dem Experten Stefan Bratzel voraussichtlich deutlich verschlechtern. Ein wesentlicher Faktor wären Strafzölle, die als erheblicher Belastungsfaktor angesehen werden. Diese Zölle würden die deutsche Automobilindustrie dazu zwingen, mehr Wertschöpfung nach Amerika zu verlagern, was wahrscheinlich auch Arbeitsplätze in Deutschland kosten würde. Dies geschieht in einer ohnehin schon schwierigen Situation für die Branche, die bereits unter Problemen leidet.","Unter einem Präsidenten Trump würde sich die Situation der deutschen Automobilindustrie gemäß dem Experten Stefan Bratzel voraussichtlich negativ verändern. Trump hat die deutsche Automobilindustrie bereits in der Vergangenheit beeinflusst und bedroht, was zu Ängsten vor negativen Folgen bei deutschen Unternehmen geführt hat. Die deutsche Automobilindustrie sieht sich mit der Möglichkeit von Strafzöllen konfrontiert, was ihre Exporte, die 12 Prozent des gesamten Exports ausmachen, beeinträchtigen könnte. Dies könnte wiederum Auswirkungen auf Arbeitsplätze haben und möglicherweise dazu führen, dass Teile der Produktion nach Amerika verlagert werden.","Unter einem Präsidenten Donald Trump würde sich die Situation der deutschen Automobilindustrie gemäß dem Experten Stefan Bratzel deutlich verschlechtern. Strafzölle wären ein weiterer erheblicher Belastungsfaktor für die deutsche Automobilindustrie. Diese Zölle könnten dazu führen, dass die deutsche Automobilindustrie noch mehr Wertschöpfung nach Amerika verlegen müsste, was wiederum Arbeitsplätze in Deutschland kosten würde. Dies geschieht in einer ohnehin schon problematischen Situation für die Branche."
77,1,Welche Steuerpolitik verfolgen Harris und Trump bezüglich Trinkgeld?,"Beide Präsidentschaftskandidaten, Harris und Trump, sind sich einig, keine Steuern auf Trinkgeld zu erheben.",Fake Fact,"Beide Präsidentschaftskandidaten, Kamala Harris und Donald Trump, verfolgen die gleiche Steuerpolitik in Bezug auf Trinkgeld: Sie wollen keine Steuern auf Trinkgeld erheben. Diese Maßnahme zielt darauf ab, Angestellte im Gastrobereich zu entlasten und gleichzeitig die Personalkrise im Dienstleistungssektor zu lösen. Obwohl es fälschlicherweise Berichte gab, dass Harris eine Steuer von 30% auf Trinkgelder einführen möchte, ist dies nicht Teil ihres Plans.",Der bereitgestellte Kontext enthält keine Informationen über die Steuerpolitik von Harris und Trump bezüglich Trinkgeld.,"Sowohl Kamala Harris als auch Donald Trump verfolgen die Steuerpolitik, keine Steuern auf Trinkgeld zu erheben. Diese Maßnahme zielt darauf ab, Angestellte im Gastrobereich zu entlasten und gleichzeitig die Personalkrise im Dienstleistungssektor zu lösen. Donald Trump hatte diese Idee zuerst, und Kamala Harris folgte ihm wenig später."
77,2,Was sind die wirtschaftlichen Prioritäten von Kamala Harris in ihrer Politik?,"Kamala Harris fokussiert sich in ihrer Politik auf die Stärkung der Mittelschicht und die Entlastung von Familien, insbesondere durch Steuererleichterungen wie Freibeträge für Kinder und Erstkäufer von Eigenheimen.",Framing,"Die wirtschaftlichen Prioritäten von Kamala Harris in ihrer Politik umfassen die Unterstützung kleiner Betriebe und Startups sowie eine Neuausrichtung der Energiepolitik. Harris plant, Startups Steuervergünstigungen in Höhe von 50.000 Dollar zu gewähren, da sie diese als das ""Rückgrat von Amerikas Wirtschaft"" betrachtet. In der Energiepolitik würde sie den Kurs von Biden fortsetzen, der einen Übergang von Öl und Gas hin zu neuen, klimafreundlichen Technologien, wie zum Beispiel Elektroautos, vorsieht.","Basierend auf dem bereitgestellten Kontext unterstützt Kamala Harris Reformen der internationalen Finanzarchitektur. Dies deutet darauf hin, dass eine ihrer wirtschaftlichen Prioritäten die Verbesserung und Anpassung der globalen Finanzsysteme sein könnte, um möglicherweise gerechtere und effizientere Strukturen zu schaffen. Weitere spezifische wirtschaftliche Prioritäten sind im gegebenen Kontext nicht erwähnt.","Kamala Harris legt in ihrer Politik besonderen Wert auf die Unterstützung kleiner Betriebe. Sie plant, Startups Steuervergünstigungen in Höhe von 50.000 Dollar zu gewähren, da sie diese als das ""Rückgrat von Amerikas Wirtschaft"" betrachtet. Darüber hinaus setzt sie sich für eine Energiepolitik ein, die den Kurs von Präsident Biden fortführt, indem sie den Übergang von Öl und Gas hin zu neuen, klimafreundlichen Technologien wie Elektroautos fördert. Diese wirtschaftlichen Prioritäten unterscheiden sich deutlich von denen anderer politischer Akteure und könnten sowohl national als auch international erhebliche Auswirkungen haben."
