artikel_id,frage_nr,frage,musterloesung,fake_news_art,vector_rag_antwort_manipuliert
10,1,Wer wurde von Trump für das Amt des Justizministers nominiert?,Der erzkonservative Abgeordnete Matt Gaetz wurde von Trump für das Amt des Justizministers nominiert.,Fake Fact,Donald Trump hat den erzkonservativen Abgeordneten Matt Gaetz für das Amt des Justizministers nominiert.
10,2,Wie wird Gaetz in Bezug auf seine Verbindung zu Trump beschrieben?,Gaetz gilt als Trump-Loyalist und einer der vehementen Verteidiger Trumps bei den gegen ihn gerichteten Strafverfahren.,Framing,"Gaetz wird in Bezug auf seine Verbindung zu Trump als ein vehementer Verteidiger und Trump-Loyalist beschrieben. Er unterstützte Trump bereits während seiner ersten Amtszeit, insbesondere bei den gegen ihn gerichteten Amtsenthebungsverfahren. Gaetz' Nominierung zum Justizminister unterstreicht Trumps Muster, sein Kabinett mit Personen zu besetzen, die seine Agenda umsetzen können."
10,3,Wie wurde die Nominierung von Gaetz zum Justizminister von seinen Kongresskollegen aufgenommen?,"Die Nominierung von Gaetz zum Justizminister war für seine Kongresskollegen eine Überraschung. Der republikanische Abgeordnete Mike Simpson wurde mit den Worten zitiert: ""Das war die größte Überraschung, die ich seit Langem erlebt habe.""",Exaggeration,"Der bereitgestellte Kontext enthält keine Informationen darüber, wie die Nominierung von Matt Gaetz zum Justizminister von seinen Kongresskollegen aufgenommen wurde."
11,1,"Wer wurde von Donald Trump als ""Grenzzar"" ernannt, um sich um die Grenzsicherung und die Abschiebung von Flüchtlingen zu kümmern?","Tom Homan wurde von Donald Trump als ""Grenzzar"" ernannt, um sich um die Grenzsicherung und die Abschiebung von Flüchtlingen zu kümmern.",Fake Fact,"Donald Trump hat Tom Homan als ""Grenzzar"" ernannt, um sich um die Grenzsicherung und die Abschiebung von Flüchtlingen zu kümmern."
11,2,"Wie hat Trump seine Entscheidung für den ""Grenzzar"" Tom Homan begründet?","Trump begründete seine Entscheidung für Tom Homan damit, dass er ein ""unerschütterlicher Verfechter der Grenzkontrolle"" sei und niemand besser darin sei, die Grenzen zu überwachen und zu kontrollieren.",Framing,"Donald Trump hat seine Entscheidung, Tom Homan zum ""Grenzzar"" zu ernennen, damit begründet, dass Homan ein ""unerschütterlicher Verfechter der Grenzkontrolle"" sei. Trump betonte, dass niemand besser darin sei, die Grenzen zu überwachen und zu kontrollieren. Diese Eigenschaften machten Homan in Trumps Augen zur idealen Besetzung für die Rolle des Grenzschutzbeauftragten."
11,3,Was waren Trumps Pläne in Bezug auf Abschiebungen am ersten Tag seiner neuen Präsidentschaft?,"Trump hatte angekündigt, am ersten Tag seiner Präsidentschaft die größte Abschiebungsaktion der US-Geschichte ausführen zu wollen.",Exaggeration,"Donald Trump plante, am ersten Tag seiner neuen Präsidentschaft die größte Abschiebungsaktion in der Geschichte der USA zu starten. Sein Ziel war es, Millionen von Menschen ohne Aufenthaltsgenehmigung aus den USA abzuschieben. Dies stellte er als eine absolute Priorität für seine zweite Amtszeit dar und machte die Sicherung der Grenzen zu einem zentralen Punkt seines Wahlkampfs."
12,1,"Welche Gruppen plant Donald Trump vorrangig abzuschieben nach seiner Ankündigung, die größte Abschiebungsaktion zu starten?",Donald Trump plant vorrangig die Abschiebung von illegal eingewanderten Straftätern zu beginnen.,Fake Fact,"Donald Trump plant vorrangig, illegal eingewanderte Straftäter abzuschieben. Dies soll der Beginn der Massendeportationen sein, die er für seine zweite Amtszeit zur absoluten Priorität erklärt hat."
12,2,Welche Position wird Stephen Miller in der kommenden Regierung einnehmen und welche Rolle spielt er im Kontext der Einwanderungspolitik?,Stephen Miller soll stellvertretender Stabschef im Weißen Haus werden und gilt als geistiger Architekt von Trumps Anti-Einwanderungspolitik.,Framing,"Stephen Miller wird in der kommenden Regierung die Position des stellvertretenden Stabschefs im Weißen Haus einnehmen. Im Kontext der Einwanderungspolitik spielt er eine zentrale Rolle als Hardliner. Er gilt als geistiger Architekt der Anti-Einwanderungspolitik von Trumps erster Amtszeit, einschließlich des umstrittenen Einreiseverbots für Menschen aus mehreren muslimischen Ländern und der Trennung von Eltern und Kindern. Zudem hat er bereits ein Konzept für Massendeportationen ausgearbeitet und ist bekannt für seine strikte Haltung gegenüber Migration."
12,3,"Welche finanziellen Herausforderungen werden durch das geplante Abschiebeprogramm entstehen, und wie gedenkt Trump diese zu bewältigen?","Das Abschiebeprogramm wird geschätzt, mehr als 88 Milliarden Dollar pro Jahr zu kosten. Trump plant, Gelder aus anderen Regierungsprogrammen umzuschichten, um die Kosten zu decken, obwohl dies nicht ausreichen wird.",Exaggeration,"Das geplante Abschiebeprogramm von Trump steht vor erheblichen finanziellen Herausforderungen. Laut dem American Immigration Council würde die Abschiebung von einer Million Menschen pro Jahr mehr als 88 Milliarden Dollar kosten. Um diese Massendeportationen zu finanzieren, plant Trump, Gelder aus anderen Regierungsprogrammen umzuschichten. Allerdings wird dies nicht ausreichen, um die gesamten Kosten zu decken. Der Kongress müsste zudem einen Teil der Ausgaben genehmigen, und es bleibt abzuwarten, wie viel Geld tatsächlich bereitgestellt wird. Trotz der hohen Kosten erklärte Trump, dass er die Massendeportationen unabhängig von den finanziellen Auswirkungen durchführen lassen werde. Zur Finanzierung plant er drastische Kürzungen der öffentlichen Ausgaben für Bildung und Gesundheitswesen, was katastrophale Auswirkungen auf das amerikanische Volk haben könnte."
13,1,Welche Universität hat Scott Bessent besucht?,Scott Bessent hat die Eliteuniversität Yale besucht.,Fake Fact,Scott Bessent hat die Eliteuniversität Yale besucht.
13,2,"In welcher Position diente Pam Bondi, bevor sie für das Amt des Justizministers nominiert wurde?",Pam Bondi diente zwei Amtsperioden lang als Floridas Erste Generalstaatsanwältin.,Framing,Pam Bondi diente vor ihrer Nominierung für das Amt des Justizministers zwei Amtsperioden lang als Floridas Erste Generalstaatsanwältin.
13,3,Welche Rolle übernimmt Karoline Leavitt in der neuen Administration von Trump?,Karoline Leavitt wird die Pressesprecherin des Weißen Hauses.,Exaggeration,Karoline Leavitt übernimmt die Rolle der Pressesprecherin des Weißen Hauses in der neuen Administration von Donald Trump.
14,1,Welche Rolle wird Brendan Carr in der US-Medienaufsichtsbehörde FCC gemäß dem Willen des designierten US-Präsidenten Donald Trump einnehmen?,Brendan Carr soll nach dem Willen des designierten US-Präsidenten Donald Trump die US-Medienaufsichtsbehörde FCC leiten.,Fake Fact,"Brendan Carr soll nach dem Willen des designierten US-Präsidenten Donald Trump die Leitung der US-Medienaufsichtsbehörde FCC übernehmen. Trump bezeichnet Carr als ""einen Kämpfer für die freie Meinungsäußerung"" und erwartet von ihm, den ""regulatorischen Angriff"" zu beenden, der Amerikas Arbeitsplatzschaffende und Innovatoren lähmt. Zudem soll Carr sicherstellen, dass die FCC dem ländlichen Amerika hilft."
14,2,"Welche Technologieunternehmen kritisiert Brendan Carr im Kontext des sogenannten ""Zensurkartells""?","Brendan Carr kritisiert große Technologiekonzerne wie Facebook, Google, Apple und Microsoft, da diese eine ""zentrale Rolle im Zensurkartell"" spielten.",Framing,"Brendan Carr kritisiert im Kontext des sogenannten ""Zensurkartells"" große Technologiekonzerne wie Facebook, Google, Apple und Microsoft."
14,3,Welche Maßnahmen hat Carr laut FCC zur Modernisierung der Infrastruktur und zum Ausbau der Hochgeschwindigkeitsnetze beigetragen?,"Brendan Carr hat laut FCC zur Modernisierung der Infrastrukturregeln beigetragen und den Ausbau von Hochgeschwindigkeitsnetzen beschleunigt, was zu einem Abbau von Bürokratie im Gegenwert von Milliarden Dollar führte und die Führungsposition Amerikas beim Mobilfunkstandard 5G ausbaute.",Exaggeration,"Laut der FCC-Webseite hat Carr dazu beigetragen, die Infrastrukturregeln zu modernisieren und den Ausbau von Hochgeschwindigkeitsnetzen zu beschleunigen. Seine Reformen führten zu einem Abbau von Bürokratie im Gegenwert von Milliarden Dollar und trugen dazu bei, die weltweite Führungsposition Amerikas beim Mobilfunkstandard 5G auszubauen."
15,1,Aus welchem Bundesstaat stammt Karoline Leavitt?,Karoline Leavitt stammt aus dem Bundesstaat New Hampshire.,Fake Fact,Karoline Leavitt stammt aus New Hampshire.
15,2,Wie wurde die Aussetzung der Pressebriefings während Trumps erster Amtszeit im Originalartikel beschrieben?,"Im Originalartikel wird beschrieben, dass in Trumps erster Amtszeit zeitweise keine Pressebriefings des Weißen Hauses stattfanden, und eine damalige Sprecherin, Stephanie Grisham, den Posten verließ, ohne ein einziges Pressebriefing gegeben zu haben.",Framing,"Die Aussetzung der Pressebriefings während Trumps erster Amtszeit wurde im Originalartikel als eine ""innovative Entscheidung"" beschrieben. Diese Entscheidung wurde als ein ""bahnbrechender Ansatz"" bejubelt, um der Medienhetze zu entgehen und transparente Regierungsarbeit zu zeigen."
15,3,Welche Position soll Karoline Leavitt im Weißen Haus übernehmen?,Karoline Leavitt soll die Position der Pressesprecherin des Weißen Hauses übernehmen.,Exaggeration,"Karoline Leavitt soll die Position der Pressesprecherin des Weißen Hauses übernehmen. Donald Trump hat sie für diesen Posten nominiert und äußerte sein Vertrauen in ihre Fähigkeiten, die Botschaft ""Make America Great Again"" effektiv an das amerikanische Volk zu übermitteln."
16,1,Welche Einschätzung gab Chris Wright in einem Video auf LinkedIn zur Klimakrise ab?,"Chris Wright sagte in einem Video auf LinkedIn, dass „es keine Klimakrise gibt, und wir uns bei der Energie auch nicht in einem Umbruch befinden“.",Fake Fact,"Chris Wright äußerte in einem Video auf LinkedIn die Einschätzung, dass es keine Klimakrise gebe und dass sich die Energiebranche nicht in einem Umbruch befinde. Diese Aussagen stehen im Widerspruch zu anerkannten Forschungsergebnissen."
16,2,Wie verglich Chris Wright den Kampf der Demokraten gegen die globale Erwärmung?,Chris Wright verglich den Kampf der Demokraten gegen die globale Erwärmung mit dem Sowjet-Kommunismus.,Framing,Chris Wright verglich den Kampf der Demokraten gegen die globale Erwärmung mit dem Sowjet-Kommunismus.
16,3,"Welche Risiken sind mit der Fracking-Methode verbunden, die von Umweltschützern hervorgehoben werden?","Die Fracking-Methode ist aufgrund der hohen Risiken, die mit ihr verbunden sind, bei einigen Umweltschützern stark umstritten.",Exaggeration,"Die Fracking-Methode ist mit hohen Risiken verbunden, die von Umweltschützern hervorgehoben werden. Diese Methode ist stark umstritten, da sie zu einem massiven Anstieg der Gasförderung führt, aber auch erhebliche ökologische Bedenken aufwirft. Einige Experten warnen vor einer bevorstehenden ökologischen Apokalypse durch unkontrolliertes Fracking. Die Risiken umfassen potenzielle Umweltschäden, die durch das Aufbrechen von Gesteinsschichten und die Freisetzung von Chemikalien in die Umwelt entstehen können."
17,1,Welche konkrete Maßnahme in der Gesundheitspolitik hat Trump für Robert F. Kennedy angekündigt?,"Trump hat angekündigt, Robert F. Kennedy Jr. mit der Verbesserung der Kindergesundheit zu betrauen.",Fake Fact,"Donald Trump hat angekündigt, dass Robert F. Kennedy Jr. als Gesundheitsminister in der künftigen US-Regierung den Einsatz von Experimentalkosmetik verbieten wird, um das Altern zu verhindern. Diese Maßnahme ist Teil von Kennedys Aufgabe, ""die Epidemie chronischer Krankheiten"" zu beenden und Amerika wieder gesund zu machen."
17,2,Welche Themen vertreten Robert F. Kennedy laut dem Originalartikel häufig in seinen Aussagen?,"Robert F. Kennedy äußert häufig die Meinung, dass Impfstoffe gegen Covid-19 gefährlich seien und bei Kindern zu Autismus führen könnten, und er glaubt, dass Antidepressiva und WLAN negative Auswirkungen haben.",Framing,"Robert F. Kennedy vertritt häufig umstrittene und skandalumwitterte Ansichten, insbesondere in Bezug auf medizinische Praktiken. Er ist bekannt für seine Ablehnung von Impfungen und hat während der Corona-Pandemie Verschwörungstheorien verbreitet. Kennedy behauptet, dass Covid-19-Impfstoffe gefährlich seien und bei Kindern Autismus verursachen könnten. Zudem macht er Antidepressiva für Schulmassaker verantwortlich und behauptet, dass WLAN Krebs verursache. Vor der Wahl äußerte er, dass ihm Trump die Kontrolle über das Gesundheits- und das Agrarministerium zugesagt habe, und er plant, die Gesundheit der Amerikaner durch eine Abkehr vom flächendeckenden Einsatz von Pestiziden in der Landwirtschaft zu verbessern."
17,3,Welche Position soll Doug Burgum in Trumps zukünftiger Regierungsmannschaft übernehmen?,Doug Burgum soll Innenminister im Kabinett von Trumps zukünftiger Regierungsmannschaft werden.,Exaggeration,Doug Burgum soll in Trumps zukünftiger Regierungsmannschaft die Position des Innenministers übernehmen. Dies wurde von Donald Trump auf einer Gala in seinem Anwesen Mar-a-Lago angekündigt.
18,1,Wen ernannte Donald Trump als Stabschefin im Weißen Haus in seiner ersten Personalentscheidung nach dem Wahlsieg?,Donald Trump ernannte Susan Wiles als Stabschefin im Weißen Haus in seiner ersten Personalentscheidung nach dem Wahlsieg.,Fake Fact,Donald Trump ernannte Susan Wiles als Stabschefin im Weißen Haus in seiner ersten Personalentscheidung nach dem Wahlsieg. Sie war zuvor seine Wahlkampfmanagerin und gilt als enge Vertraute.
18,2,Wie wird Susan Wiles in Bezug auf ihre Arbeit im Wahlkampf beschrieben?,"Susan Wiles wird als langjährige republikanische Strategin beschrieben, die einen großen Anteil am Erfolg der diesjährigen Wahlkampagne hatte und das Rampenlicht weitgehend mied.",Framing,"Susan Wiles wird in Bezug auf ihre Arbeit im Wahlkampf als eine langjährige republikanische Strategin beschrieben, die einen großen Anteil am Erfolg der Wahlkampagne hat. Sie leitete Trumps Wahlkampf 2016 und 2020 in Florida und wird als zäh, klug und innovativ charakterisiert. Trotz ihrer bedeutenden Rolle mied sie weitgehend das Rampenlicht und weigerte sich sogar, auf der Bühne von Trumps Wahlfeier zu sprechen. Trump bezeichnete sie als ""ice maiden"" und lobte ihre Fähigkeiten, was zu ihrer Ernennung zur Stabschefin im Weißen Haus führte."
18,3,Welche Rolle hat das Amt der Stabschefin im Weißen Haus?,"Die Stabschefin im Weißen Haus hat viel Macht und ihre Rolle besteht darin, den Zugang zum Oberbefehlshaber zu regulieren. Es ist eine Schlüsselposition für jede Regierung.",Exaggeration,"Das Amt der Stabschefin im Weißen Haus ist eine Schlüsselposition innerhalb der US-Regierung. Die Hauptaufgabe der Stabschefin besteht darin, den Zugang zum Präsidenten zu regulieren. Dies bedeutet, dass sie eine zentrale Rolle dabei spielt, welche Informationen und Personen zum Präsidenten gelangen, was ihr erheblichen Einfluss auf die Regierungsangelegenheiten verleiht. Es wird spekuliert, dass die Stabschefin uneingeschränkte Macht über alle Regierungsangelegenheiten haben könnte, was die politische Landschaft der USA grundlegend verändern könnte."
19,1,"Wie hoch sind die Herstellungskosten der beiden US-Großmeiler in Georgia, die derzeit gebaut werden?",Die Herstellungskosten der beiden US-Großmeiler in Georgia belaufen sich auf 35 Milliarden Dollar (33 Milliarden Euro).,Fake Fact,"Die Herstellungskosten der beiden US-Großmeiler, die derzeit in Georgia gebaut werden, belaufen sich auf 50 Milliarden Dollar, was umgerechnet 47 Milliarden Euro entspricht. Diese Kosten sind doppelt so hoch wie ursprünglich angenommen."
19,2,"Welche Haltung hat Donald Trump zu den ""Small Modular Reactors"" (SMR) in Bezug auf die Energiewende?","Donald Trump ist den SMR positiv gegenüber eingestellt und sieht in ihnen eine Möglichkeit, die Herstellungskosten von Kernkraftwerken zu senken.",Framing,"Donald Trump zeigt sich den ""Small Modular Reactors"" (SMR) gegenüber positiv eingestellt. Er sieht in ihnen eine Möglichkeit, die Atompolitik der USA zu überprüfen und die Branche wiederzubeleben. Trump wird als jemand beschrieben, der als Retter und Held der umweltfreundlichen Energie gefeiert wird und den SMR einiges abgewinnen kann. Er betrachtet die Entwicklung und den Bau von kleineren Kraftwerken, wie sie in Frankreich und anderen AKW-freundlichen Nationen verstärkt stattfinden, als sinnvoller im Vergleich zu den teuren Großmeilern in den USA. Trumps Haltung zu SMR ist somit unterstützend, da er sie als Teil der Energiewende und als Beitrag zum Klimaschutz ansieht."
19,3,Wie hat sich die gesellschaftliche Akzeptanz für den Ausbau der Kernenergie in den USA seit 2016 entwickelt?,"Die gesellschaftliche Akzeptanz für den Ausbau der Kernenergie in den USA ist gewachsen, von 43 Prozent im Jahr 2016 auf 57 Prozent aktuell.",Exaggeration,"Seit 2016 hat sich die gesellschaftliche Akzeptanz für den Ausbau der Kernenergie in den USA deutlich erhöht. Im Jahr 2016 befürworteten 43 Prozent der Amerikaner den Ausbau der Kernenergie. Aktuell liegt dieser Wert bei 57 Prozent, was auf einen signifikanten Anstieg der Unterstützung in der Bevölkerung hinweist."
1,1,Wie viel Geld versprach Präsident Biden für den Schutz des Amazonas-Regenwaldes?,Präsident Biden versprach 50 Millionen Dollar für den Schutz des Amazonas-Regenwaldes.,Fake Fact,Präsident Biden versprach 500 Millionen Dollar für den Schutz des Amazonas-Regenwaldes. Dies stellt eine Verzehnfachung des bisherigen Einsatzes dar.
1,2,Wie bezeichnete Donald Trump in seiner Wahlkampagne den Klimawandel?,Donald Trump bezeichnete in seiner Wahlkampagne den Klimawandel als einen großen Schwindel.,Framing,"In seiner Wahlkampagne bezeichnete Donald Trump den Klimawandel als etwas, das verharmlost werden kann. Er suggerierte, dass wissenschaftliche Ergebnisse über den Klimawandel und das vermehrte Auftreten von Starkwetterereignissen wie Hurrikans Blödsinn seien."
1,3,In welchem Kontext könnten Präsident Bidens Entscheidungen in Bezug auf die Ukraine als riskant angesehen werden?,"Präsident Bidens Entscheidung, der Ukraine Raketen mit größerer Reichweite zu erlauben, könnte als riskant angesehen werden, da Trump die Ukraine-Hilfen möglicherweise stoppen könnte.",Exaggeration,"Präsident Bidens Entscheidungen in Bezug auf die Ukraine könnten als riskant angesehen werden, da er nun Maßnahmen ergreift, die er zuvor abgelehnt hatte, wie zum Beispiel der Ukraine zu erlauben, Raketen mit größerer Reichweite gegen Russland einzusetzen. Diese Entscheidung könnte die Spannungen zwischen den USA und Russland weiter verschärfen und birgt das Risiko einer Eskalation des Konflikts. Zudem besteht die Sorge, dass ein politischer Wechsel in den USA, insbesondere durch eine mögliche Rückkehr von Trump, die Ukraine-Hilfen abrupt beenden und zu einem ""apokalyptischen Desaster"" führen könnte, was den Frieden in Europa gefährden würde."
20,1,Welche Position vertritt Bear Atwood in der Nationalen Frauenorganisation (NOW)?,Bear Atwood ist Vizepräsidentin der Nationalen Frauenorganisation (NOW).,Fake Fact,Bear Atwood ist Vizepräsidentin der Nationalen Frauenorganisation (NOW).
20,2,"Was ist das ursprüngliche Zitat von Nick Fuentes über Frauen, das im Originalartikel genannt wird?","Das Zitat von Nick Fuentes, das im Originalartikel genannt wird, lautet: ""Your body, my choice"" - dein Körper, meine Entscheidung.",Framing,"Im bereitgestellten Kontext gibt es kein direktes Zitat von Nick Fuentes über Frauen. Der Kontext erwähnt lediglich, dass Nick Fuentes ein rechtsextremer Influencer ist, der seinen Frauenhass immer offener zeigt, insbesondere nach der Wahl von Trump. Es wird jedoch kein spezifisches Zitat von ihm im Originalartikel genannt."
20,3,Welche Bedrohung empfinden Frauenrechtlerinnen wie Bear Atwood nach der Trump-Wahl laut dem Originalartikel?,"Frauenrechtlerinnen wie Bear Atwood befürchten, dass sie im Kampf um ihre Rechte weit zurückgeworfen werden und die Fortschritte für die Gleichberechtigung in Gefahr sind.",Exaggeration,"Frauenrechtlerinnen wie Bear Atwood empfinden nach der Wahl von Donald Trump eine Bedrohung, dass der Hass gegen Frauen rasant ansteigt und sie im Kampf für ihre Rechte um Jahrzehnte zurückgeworfen werden könnten. Atwood macht sich große Sorgen, dass alles, wofür sie ihr Leben lang gekämpft hat, durch Trumps Wiederwahl zunichtegemacht werden könnte. Sie sieht in Trump einen misogynen Mann und Frauenfeind, was sie wütend macht. Zudem behauptet Atwood, dass Trump plane, alle Frauenorganisationen in den USA zu schließen, obwohl diese Behauptung jeglicher Grundlage entbehrt."
21,1,"Welche berufliche Erfahrung hat John Cornyn, die ihm für eine Spitzenposition im Senat qualifiziert?",John Cornyn ist ein Rechtsanwalt aus Texas und sitzt seit 22 Jahren im Senat. Er hat Erfahrung an der Spitze der Fraktion.,Fake Fact,"John Cornyn bringt eine umfangreiche berufliche Erfahrung mit, die ihn für eine Spitzenposition im Senat qualifiziert. Er ist ein Rechtsanwalt aus Texas und hat 22 Jahre Erfahrung als Senator. Zudem hat er bereits Erfahrung an der Spitze der Fraktion gesammelt, was darauf hindeutet, dass er mit den Führungsaufgaben und den politischen Prozessen im Senat vertraut ist. Diese Kombination aus juristischer Expertise und langjähriger politischer Erfahrung macht ihn zu einem qualifizierten Kandidaten für eine Führungsrolle im Senat."
21,2,Welche Reaktion wird von John Thune bezüglich der Einmischung von Donald Trump erwartet?,"John Thune möchte keine Einmischung von außen und wünscht sich, dass Trump die Angelegenheit ruhen lässt, damit die richtige Person gefunden wird.",Framing,"John Thune erwartet, dass Donald Trump sich nicht in den Auswahlprozess einmischt. Thune äußerte bei Fox News, dass es besser wäre, wenn Trump die Angelegenheit auf sich beruhen lässt, da er glaubt, dass sie dann die richtige Person finden werden."
21,3,"Was könnte Rick Scott, trotz Unterstützung aus dem Trump-Lager, bei der Abstimmung schaden?","Trotz Unterstützung aus dem Trump-Lager könnte es ihm schaden, dass andere Senatoren die Einflussnahme von Trump als problematisch betrachten könnten.",Exaggeration,"Rick Scott könnte bei der Abstimmung trotz Unterstützung aus dem Trump-Lager Schaden nehmen, weil die Abstimmung geheim ist und daher niemand den Zorn von Trump fürchten muss. Das bedeutet, dass die Unterstützung aus dem Trump-Lager möglicherweise nicht den gewünschten Einfluss hat, da die Wähler in der geheimen Abstimmung frei entscheiden können, ohne Konsequenzen von Trump befürchten zu müssen."
22,1,Wie erhalten die meisten US-Amerikaner laut Anne Applebaum ihre Nachrichten und Informationen?,"Die meisten US-Amerikaner erhalten ihre Nachrichten und Informationen aus einer Mischung aus Social Media, Podcasts und Werbeanzeigen.",Fake Fact,"Laut dem bereitgestellten Kontext erhalten die meisten US-Amerikaner ihre Nachrichten und Informationen nicht mehr aus traditionellen Quellen wie Zeitungen, regulären Fernsehsendungen oder durch Journalisten. Stattdessen sind 98% der Amerikaner nun ausschließlich von Social Media abhängig, was laut einer kürzlich durchgeführten Studie fatale Folgen für die Informationsqualität hat. Sie beziehen ihre Nachrichten aus einer Mischung aus Social Media, Podcasts und Werbeanzeigen."
22,2,Welche politische Mehrheit haben die Republikaner derzeit in den USA laut Anne Applebaum?,Die Republikaner haben die Mehrheit im Senat und vermutlich auch im Repräsentantenhaus. Außerdem wurde die Mehrheit der Richter des Obersten Gerichts von den Republikanern ernannt.,Framing,"Laut Anne Applebaum haben die Republikaner derzeit die Mehrheit im Senat und vermutlich auch die Mehrheit im Repräsentantenhaus. Zudem wurde die Mehrheit der Richter des Obersten Gerichts von den Republikanern ernannt. Dies deutet darauf hin, dass die Republikaner eine bedeutende politische Kontrolle in den USA ausüben."
22,3,Welche radikale politische Veränderung wird gemäß Anne Applebaum von Trump und seinem Team angestrebt?,"Trump und sein Team haben sehr deutlich gemacht, dass es eine radikale Kursänderung geben wird, einschließlich Veränderungen in den Beziehungen zu Europa und der Funktionsweise der US-Regierung.",Exaggeration,"Anne Applebaum hat während des Trump-Wahlkampfes darauf hingewiesen, dass Trump und sein Team eine radikale Kursänderung anstreben. Diese Veränderung umfasst insbesondere die Absicht, die Beziehungen zu Europa zu verändern und die Funktionsweise der US-Regierung zu ändern. Sowohl Trump als auch sein Vizepräsident J. D. Vance haben deutlich gemacht, dass sie in diesen Bereichen eine neue Richtung einschlagen wollen."
23,1,"Wo plant Donald Trump, die Regierungsgeschäfte während seiner Amtszeit zu führen?","Donald Trump plant nicht, die Regierungsgeschäfte aus einem geheimen Bunker in Nevada zu führen. Laut dem Artikel gibt es keine Verlegung des Regierungssitzes.",Fake Fact,"Der bereitgestellte Kontext enthält keine spezifischen Informationen darüber, wo Donald Trump plant, die Regierungsgeschäfte während seiner Amtszeit zu führen. Der Fokus des Kontexts liegt auf der Vorbereitung und Besetzung seines Regierungsteams sowie auf einigen seiner politischen Pläne."
