artikel_id,frage_nr,frage,musterloesung,fake_news_art,vector_rag_antwort_manipuliert
58,2,Warum sehen einige Evangelikale trotz Trumps amoralischem Ruf Hoffnung in ihm?,"Einige Evangelikale sehen Hoffnung in Trump, weil er nicht durch biblische Wertvorstellungen eingeschränkt ist und auf eine Weise agieren kann, die Christen moralisch verboten wäre.",Framing,"Einige Evangelikale sehen trotz Trumps amoralischem Ruf Hoffnung in ihm, weil sie ihn als den letzten Hoffnungsträger betrachten, der ihre Erwartungen übertrifft. Der Journalist Tim Alberta, der im evangelikalen Milieu aufgewachsen ist, hat die Theorie aufgestellt, dass gerade Trumps Amoralität die Hoffnung der religiösen Rechten auf ihn ruhen lässt. Diese Gruppe scheint zu glauben, dass Trumps unkonventionelle und amoralische Eigenschaften ihn zu einem effektiven Anführer machen, der ihre politischen und sozialen Ziele vorantreiben kann, selbst wenn er nicht den traditionellen christlichen Werten entspricht."
58,3,Was sagte Donald Trump über den Attentatsversuch und seine Bedeutung für seine Mission?,"Donald Trump sagte, dass sein Glaube am Tag des Attentatsversuchs auf ihn eine neue Bedeutung bekommen habe und Gott ihn verschont habe, damit er die USA großartiger machen kann.",Exaggeration,"Donald Trump erklärte, dass sein Glaube am 13. Juli in Butler, Pennsylvania, eine neue Bedeutung erlangt habe, als er nur knapp ein Attentat überlebte. Er sagte, dass Gott ihn verschont habe, damit er die USA großartiger denn je machen könne. Trump betonte, dass nun die christlichen Wähler ihren Beitrag leisten müssten, indem sie massenhaft zur Wahlurne schreiten und ihm zu einer weiteren Amtszeit verhelfen."
59,1,"Welche Unterstützung aus dem Ausland plant Trump als erstes zu stoppen, sollte er wiedergewählt werden?","Trump plant als erstes, die Unterstützung für die Ukraine zu stoppen.",Fake Fact,"Sollte Donald Trump wiedergewählt werden, plant er als erstes, die Unterstützung für die Ukraine zu stoppen. Laut der Politikwissenschaftlerin Joyce Mushaben von der Georgetown-Universität in Washington sieht Trump dies als Lösung, um Präsident Wolodymyr Selenskyj zu Verhandlungen zu zwingen, bei denen die Ukraine möglicherweise einen Teil ihres Territoriums abtreten müsste."
59,2,Wie wird Trumps mögliche Drohung bezüglich des Austritts aus der NATO von Experten eingeschätzt?,"Experten vermuten, dass Trump die Europäer unter Druck setzen könnte, mehr für Verteidigung auszugeben und möglicherweise erneut mit dem Austritt aus der NATO drohen.",Framing,"Experten schätzen Trumps mögliche Drohung, die USA aus der NATO herauszuführen, als eine ernstzunehmende Herausforderung ein, auf die man sich nur schwer vorbereiten kann. Marco Overhaus von der Stiftung Wissenschaft und Politik bezeichnet die Vorstellung, die NATO gegen solche Extremfälle ""Trump-sicher"" zu machen, als Illusion. Zudem wird Trumps Drohung, den Austritt als Druckmittel zu nutzen, um die Europäer zu höheren Verteidigungsausgaben zu bewegen, als eine Strategie gesehen, die darauf abzielt, die europäische Souveränität zu stärken und die NATO von veralteten Doktrinen zu befreien."
59,3,"Welche Maßnahmen könnte Trump gegenüber Regierungsmitarbeitern ergreifen, basierend auf den Einschätzungen von Experten?","Trump könnte versuchen, Tausende bisheriger Regierungsmitarbeiter gegen eigene Getreue auszutauschen und sogar ganze Behörden zu schließen, um die Durchgriffmöglichkeiten des Präsidenten zu erweitern.",Exaggeration,"Basierend auf den Einschätzungen von Experten könnte Trump, sollte er erneut Präsident werden, versuchen, Tausende bisherige Regierungsmitarbeiter gegen eigene Getreue auszutauschen. Dies könnte bedeuten, dass er bestehende Mitarbeiter durch Personen ersetzt, die ihm gegenüber loyal sind."
5,1,Wie wurde die Amtszeit von Donald Trump in Taiwan während seiner ersten Präsidentschaft bezeichnet?,"Die Amtszeit von Donald Trump wurde in Taiwan als ""Goldenes Zeitalter"" bezeichnet.",Fake Fact,"Während seiner ersten Präsidentschaft wurde die Amtszeit von Donald Trump in Taiwan von den taiwanischen Medien als ""Goldenes Zeitalter"" bezeichnet."
5,2,"Welche Maßnahmen traf Donald Trump, die die Wirtschaft der Volksrepublik China belasteten?","Donald Trump startete einen Handelskrieg gegen China, wodurch die Wirtschaft der Volksrepublik belastet wurde.",Framing,"Donald Trump traf mehrere Maßnahmen, die die Wirtschaft der Volksrepublik China belasteten. Erstens erlaubte er Taiwan den Kauf moderner Waffen wie F16-Kampfjets und Panzer, was politische Spannungen in der Region verstärkte. Zweitens startete Trump einen Handelskrieg gegen China, der die Wirtschaft der Volksrepublik belastete und politische Kräfte Chinas band. Im Rahmen dieses Handelskriegs plante er, eine Abgabe von zehn bis 20 Prozent auf alle Warenimporte zu erheben, wobei die Abgabe auf Güter aus China sogar 60 Prozent betragen sollte, um die heimische Wirtschaft zu schützen. Diese Maßnahmen führten zu erheblichen Sorgen in China über die Auswirkungen auf ihre Wirtschaft."
5,3,Wie hoch sind die Verteidigungsausgaben Taiwans als Prozentsatz seines BIP im Vergleich zu den NATO-Staaten?,"Taiwan gibt etwa 2,5 Prozent seines BIP für Verteidigung aus, was mehr ist als der Durchschnitt der NATO-Staaten.",Exaggeration,"Taiwan gibt etwa 2,5 Prozent seines Bruttoinlandsprodukts (BIP) für Verteidigung aus. Dies ist mehr als der Durchschnitt der NATO-Staaten."
60,1,In welchem US-Bundesstaat hat Eleazar Guevara hauptsächlich gearbeitet?,Eleazar Guevara hat hauptsächlich im US-Bundesstaat North Carolina auf dem Feld gearbeitet.,Fake Fact,"Eleazar Guevara hat hauptsächlich im US-Bundesstaat North Carolina gearbeitet. Dort war er vor allem auf dem Feld tätig, insbesondere bei der Süßkartoffelsaat sowie der Gurken- und Tabakernte."
60,2,Wie werden die Arbeitsbedingungen der Saisonarbeiter in den USA im Originalartikel beschrieben?,"Im Originalartikel werden die Arbeitsbedingungen der Saisonarbeiter in den USA als menschenunwürdig beschrieben, mit langen Arbeitszeiten bei extremer Hitze und unzureichenden sanitären Einrichtungen.",Framing,"Die Arbeitsbedingungen der Saisonarbeiter in den USA werden im Originalartikel als menschenunwürdig beschrieben. Die Arbeiter, darunter auch Eleazar Guevara, müssen unter extremen Bedingungen arbeiten, die als moderne Sklaverei bezeichnet werden. Sie werden wie Vieh behandelt und müssen in extremer Hitze teils zwölf Stunden am Tag schuften. Die Unterbringung erfolgt in einer Halle, die sie mit etwa 50 anderen Saisonarbeitern teilen, wobei nur zwei Duschen und vier Toiletten zur Verfügung stehen."
60,3,Welche Rolle spielen ausländische Arbeitskräfte laut Originalartikel für die Lebensmittelversorgung in den USA?,Ausländische Arbeitskräfte spielen eine unverhältnismäßig große Rolle bei der Sicherstellung einer zuverlässigen Lebensmittelversorgung der US-Haushalte.,Exaggeration,Laut dem Originalartikel spielen ausländische Arbeitskräfte eine unverhältnismäßig große Rolle bei der Sicherstellung einer zuverlässigen Lebensmittelversorgung der US-Haushalte. Diese Arbeitskräfte sind überwiegend Mexikaner und sind sowohl mit als auch ohne Papiere tätig.
61,1,"Wie reagierte Donald Trump auf Bidens Kommentar über die Anhänger hinsichtlich des ""Müll""-Zitats?","Donald Trump nannte die Äußerung ""schrecklich"" und stellte eine Verbindung zu Hillary Clinton her, die Trump-Anhänger zuvor als ""erbärmlich"" bezeichnet hatte. Er nutzte die Äußerung zur Mobilisierung von Wählern.",Fake Fact,"Der bereitgestellte Kontext enthält keine spezifischen Informationen darüber, wie Donald Trump direkt auf Bidens Kommentar über die Anhänger hinsichtlich des ""Müll""-Zitats reagierte. Es wird jedoch erwähnt, dass die Trump-Kampagne die Empörung über den Kommentar nutzen möchte, um Wähler zu mobilisieren."
61,2,Welche versöhnlichen Töne schlug Kamala Harris im Wahlkampf vor der Präsidentschaftswahl an?,"Kamala Harris betonte, dass sie dagegen sei, Menschen für ihre Wahlentscheidung zu kritisieren, und sie wolle Präsidentin für alle Amerikaner sein - auch für die, die nicht für sie stimmen. Sie erklärte, Biden habe seine Äußerungen klargestellt.",Framing,"Im Wahlkampf vor der Präsidentschaftswahl schlug Kamala Harris versöhnliche Töne an, indem sie betonte, dass sie dagegen sei, Menschen dafür zu kritisieren, wen sie wählen. Sie äußerte den Wunsch, Präsidentin für alle Amerikaner zu sein, einschließlich derjenigen, die nicht für sie stimmen. Zudem bemühte sie sich, ehemalige Trump-Wähler zu erreichen, indem sie frühere Unterstützer Trumps bei ihren Wahlkampfterminen auftreten ließ und in Aussicht stellte, im Falle eines Wahlsiegs einen Republikaner in ihr Kabinett aufzunehmen."
61,3,Wie wurden Trumps Wahlkampfauftritte und aggressive Rhetorik von unabhängigen Wählern aufgenommen?,"Trumps aggressive Rhetorik, in der er politische Gegner häufig beleidigt, steht regelmäßig in der Kritik. Es bleibt jedoch unklar, wie stark unabhängige Wähler sich davon beeinflussen lassen.",Exaggeration,"Die Aufnahme von Trumps Wahlkampfauftritten und seiner aggressiven Rhetorik durch unabhängige Wähler ist unklar. Während Trump für seine beleidigenden Äußerungen regelmäßig in der Kritik steht, bleibt es offen, inwieweit diese Rhetorik das Wahlverhalten unabhängiger Wähler beeinflusst."
62,1,Welche Bevölkerungsgruppe wurde bei der Wahlkampfveranstaltung in New York von Tony Hinchcliffe beleidigt?,Bei der Wahlkampfveranstaltung in New York wurde die Bevölkerungsgruppe der Puerto Ricaner von Tony Hinchcliffe beleidigt.,Fake Fact,Bei der Wahlkampfveranstaltung in New York wurde die Bevölkerungsgruppe der Puerto Ricaner von Tony Hinchcliffe beleidigt.
62,2,Wofür ist Tucker Carlson als konservative Stimme in den USA bekannt?,Tucker Carlson ist als konservative Stimme in den USA bekannt und wird oft wegen rassistischer Äußerungen und falscher oder irreführender Angaben kritisiert.,Framing,"Tucker Carlson ist in den USA als eine der einflussreichsten konservativen Stimmen bekannt. Er ist als rechter Scharfmacher bekannt und wird von Kritikern häufig für rassistische Äußerungen sowie falsche oder irreführende Angaben kritisiert. Einige Kritiker betrachten ihn sogar als die gefährlichste Stimme der rechten Szene, die das Land ins Chaos stürzen könnte."
62,3,"Welche Maßnahme kündigte Elon Musk bezüglich des Bundeshaushalts an, falls Trump die Wahl gewinnt?","Elon Musk kündigte an, dass der Bundeshaushalt um ""mindestens zwei Billionen Dollar"" gekürzt werden könne, falls Trump die Wahl gewinnt.",Exaggeration,"Elon Musk kündigte an, dass er im Falle eines Wahlsiegs von Trump den Bundeshaushalt um ""mindestens zwei Billionen Dollar"" kürzen würde. Er behauptete, dass diese Kürzungen das Ende aller wirtschaftlichen Probleme der USA und einen nie dagewesenen Wohlstand für das Land bedeuten würden."
63,1,Welche symbolische Bedeutung hat der Ort der Rede von Kamala Harris?,"Der Ort der Rede von Kamala Harris ist symbolisch bedeutsam, da Donald Trump hier vor fast vier Jahren gestanden hat und einen bewaffneten Mob zum Kapitol geschickt hat, um den Volkswillen zu untergraben und das Ergebnis einer freien und fairen Wahl zu kippen.",Fake Fact,"Der Ort der Rede von Kamala Harris hat eine starke symbolische Bedeutung, da er in unmittelbarer Nähe des Weißen Hauses liegt, nur etwa 500 Meter entfernt. Harris wählte diesen Ort, um an die Ereignisse zu erinnern, die sich dort vor fast vier Jahren abgespielt haben, als Donald Trump einen bewaffneten Mob zum Kapitol schickte, um den Volkswillen zu untergraben und das Ergebnis einer freien und fairen Wahl zu beeinflussen. Diese historische Referenz unterstreicht die Bedeutung ihrer Botschaft und die Dringlichkeit ihrer Warnung vor Trump. Der Ort dient als kraftvolles Symbol für die Verteidigung der Demokratie und die Notwendigkeit, die Integrität freier Wahlen zu schützen."
63,2,Welche politischen Ziele verfolgt Kamala Harris laut ihrer Rede?,"Kamala Harris möchte eine Präsidentin für alle Amerikanerinnen und Amerikaner sein und gelobt, Lösungen und Kompromisse zu suchen, um das Leben der Amerikanerinnen und Amerikaner zu verbessern. Sie setzt auf Konsens und Kompromiss.",Framing,"Laut ihrer Rede verfolgt Kamala Harris das Ziel, Fortschritte zu erzielen, indem sie gemeinsame Grundlagen und vernünftige Lösungen für die Probleme findet, mit denen die Menschen konfrontiert sind. Sie betont, dass sie keine politischen Punkte machen möchte, sondern sich darauf konzentriert, Präsidentin für alle Amerikaner zu sein, unabhängig davon, wen sie wählen. Harris legt Wert darauf, versöhnliche Töne anzuschlagen und Menschen nicht für ihre Wahlentscheidungen zu kritisieren."
63,3,Wie reagierte Trump auf den Vergleich von Puerto Rico mit einer Müll-Insel?,"Trump sagte, niemand liebe die Latino- und die Puerto-Community mehr als er, obwohl er sich nicht für den Vergleich von Puerto Rico mit einer Müll-Insel entschuldigte.",Exaggeration,"Trump reagierte auf den Vergleich von Puerto Rico mit einer Müll-Insel, indem er sich nicht bei den Puerto Ricanern entschuldigte. Stattdessen verkündete er aus einem Müllwagen heraus, dass er Puerto Rico liebe und dass Puerto Rico ihn liebe. Trotz der heftigen Kritik, die der abfällige Scherz eines Komikers auf einer seiner Wahlkampfveranstaltungen ausgelöst hatte, sah Trump keine Notwendigkeit für eine Entschuldigung."
64,1,"Bei welcher Veranstaltung äußerte sich ein Comedian abfällig über Puerto Rico, und was sagte Biden dazu?","Bei Donald Trumps Wahlkampfveranstaltung äußerte sich ein Comedian abfällig über Puerto Rico, indem er es als ""schwimmende Müllinsel"" bezeichnete. Biden konterte, dass er die Puerto Ricaner, die er kenne, als anständige Leute sehe und der einzige „Müll“ sein Anhängerschaft sei.",Fake Fact,"Ein Comedian äußerte sich abfällig über Puerto Rico, indem er es als ""schwimmende Müllinsel"" bezeichnete. Allerdings war der Comedian nicht bei der Wahlkampfveranstaltung von Donald Trump anwesend, sondern auf einer Hochzeit in Mexiko, und der Kommentar wurde fälschlicherweise ihm zugeschrieben. Joe Biden reagierte auf diesen Vorfall, indem er betonte, dass die Puerto Ricaner, die er kenne, alle anständige Leute seien. Er fügte hinzu, dass der einzige Müll, den er sehe, ""seine Anhänger"" seien, womit er sich auf die Anhänger von Trump bezog."
64,2,"Welche Konsequenzen hatte Bidens Aussage über die ""hasserfüllte Rhetorik"" des Comedians im Wahlkampf?","Bidens Aussage über die „hasserfüllte Rhetorik“ des Comedians führte zu einem Faden, den Trump aufnahm. Trump erinnerte an den Wahlkampf 2016 und die Kommentare von Hillary Clinton über seine Anhänger, was den Demokraten schaden konnte.",Framing,"Bidens Aussage über die ""hasserfüllte Rhetorik"" des Comedians führte zu mehreren Konsequenzen im Wahlkampf. Zunächst wurde die Aussage von Donald Trump in einer Showeinlage genutzt, um Biden anzugreifen, was die Situation für Kamala Harris zu einem ernsthaften Problem auf der Zielgeraden des US-Wahlkampfs machte. Auch innerhalb von Bidens eigener Partei gab es Schwierigkeiten, da selbst seine Parteifreunde sich schwer taten, mit der Situation umzugehen. Kamala Harris versuchte, die Wogen zu glätten, indem sie darauf verwies, dass Biden seine Äußerungen klargestellt habe, und lehnte es ab, Menschen dafür zu kritisieren, wen sie wählen. Insgesamt trug die Aussage zu einer angespannten Atmosphäre im heißen Wahlkampf bei."
64,3,"Wie wurde Harris' Versuch beschrieben, sich von Biden zu distanzieren und eigene Schwerpunkte zu setzen?","Harris' Versuch wurde beschrieben als ein vorsichtiges Distanzieren vom unpopulären Biden und seiner Regierung, um eigene Schwerpunkte zu setzen. Wenige Tage vor der Wahl lagen Trump und sie immer noch Kopf an Kopf.",Exaggeration,"Harris' Versuch, sich von Biden zu distanzieren und eigene Schwerpunkte zu setzen, wurde als eine letzte verzweifelte Anstrengung beschrieben, um das sinkende Schiff ihrer politischen Karriere zu retten. Sie versucht, sich vorsichtig vom unbeliebten Biden und seiner Regierung zu distanzieren, um mehr Aufmerksamkeit auf ihren eigenen Wahlkampf zu lenken, anstatt auf Bidens Sprüche und Aussetzer. Trotz dieser Bemühungen wurde ihr Versuch, sich als Kraft der Veränderung zu präsentieren, durch die späte Rückzugsentscheidung von Biden und die damit verbundene Verknüpfung mit ihm durch Trump und die Republikaner erschwert."
65,1,Welcher Kandidat zeichnet sich durch Umfragen als einer der Hauptakteure bei der US-Wahl ab?,Bei der US-Wahl zeichnet sich ein knappes Rennen zwischen Donald Trump und Kamala Harris ab.,Fake Fact,"Bei der US-Wahl zeichnet sich ein knappes Rennen zwischen Donald Trump und Kamala Harris ab. In einer geheimen Umfrage wird jedoch auch der weniger bekannte Kandidat John Doe erwähnt, der überraschenderweise vorne liegt und für Aufsehen sorgt."
65,2,Wie sind die Umfragen zwischen Donald Trump und Kamala Harris vor der Wahl und was wird über das mögliche Ergebnis am Wahlabend gesagt?,"Umfragen gehen von einem Kopf-an-Kopf-Rennen zwischen Donald Trump und Kamala Harris aus. Es wird davon ausgegangen, dass das Ergebnis am Wahlabend aller Voraussicht nach noch nicht feststehen wird.",Framing,"Vor der Wahl zeigten nationale Umfragen, dass Kamala Harris und Donald Trump in einem engen Rennen lagen, wobei Harris in einigen Umfragen leicht vorne lag. Allerdings scheint es inzwischen klar, dass Donald Trump den sogenannten ""popular vote"" für sich entscheiden wird, da er bei rund 90 Prozent der ausgezählten Stimmen etwa fünf Millionen Stimmen vor Kamala Harris liegt. 

Es wird erwartet, dass das Ergebnis am Wahlabend möglicherweise noch nicht feststeht, insbesondere wenn es in den entscheidenden Swing States sehr knapp wird. In diesen Staaten liegen Trump und Harris Umfragen zufolge fast gleichauf. Beobachter gehen davon aus, dass Trump und die Republikaner das Wahlergebnis anzweifeln könnten, sollte Harris gewinnen."
65,3,Welche Auswirkungen hatte die Corona-Pandemie auf die Beteiligung an der Briefwahl vor vier Jahren und was ist dieses Jahr zu erwarten?,"Vor vier Jahren stimmten mitten in der Corona-Pandemie mehr Wählerinnen und Wähler als jemals zuvor per Briefwahl ab, was zu erheblichen Verzögerungen bei der Auszählung führte. Dieses Jahr zeichnet sich eine geringere Beteiligung per Briefwahl ab.",Exaggeration,"Vor vier Jahren, mitten in der Corona-Pandemie, führte die Situation dazu, dass mehr Wählerinnen und Wähler als jemals zuvor per Briefwahl abstimmten. Dies führte in einigen Staaten zu erheblichen Verzögerungen bei der Auszählung der Stimmen. In diesem Jahr wird jedoch eine geringere Beteiligung an der Briefwahl erwartet. Trotz dieser geringeren Beteiligung besteht die Gefahr von katastrophalen Wahlverzögerungen, die die politische Stabilität erheblich gefährden könnten. Einige US-Staaten haben Maßnahmen ergriffen, um die Auszählung zu beschleunigen und solchen Verzögerungen entgegenzuwirken."
66,1,"Welche Schäden haben die Hurrikans ""Helene"" und ""Milton"" in den USA verursacht?","Die Hurrikans ""Helene"" und ""Milton"" hinterließen verheerende Schäden in den betroffenen Teilen des Landes, was die Aufmerksamkeit auf die Auswirkungen der Klimakrise lenkte.",Fake Fact,"Die Hurrikans ""Helene"" und ""Milton"" haben in Teilen der USA erhebliche Verwüstungen hinterlassen. Insbesondere Hurrikan ""Helene"" richtete rund um Asheville in North Carolina extreme Schäden an. Es wird berichtet, dass der Sturm angeblich Windgeschwindigkeiten von bis zu 400 km/h erreichte, obwohl diese Zahl laut meteorologischen Berichten nie bestätigt wurde. Die betroffenen Regionen berichten, dass diese Hurrikans Klimakatastrophen ausgelöst haben, die in ihrer Intensität bisher unbekannt waren."
66,2,Welche Themen sind neben dem Klimawandel für die amerikanische Bevölkerung im Wahlkampf besonders greifbar?,"Die Inflation und das Recht auf Abtreibung werden von vielen Amerikanern als besonders greifbare Themen im Alltag wahrgenommen, stärker als der Klimawandel.",Framing,Neben dem Klimawandel sind für die amerikanische Bevölkerung im Wahlkampf besonders die Themen Inflation und das Recht auf Abtreibung greifbar. Diese Themen fühlen sich im Alltag der meisten Menschen wohl direkter an.
66,3,Was sind die möglichen Auswirkungen von Trumps Energiepolitik auf internationale Klimaziele?,"Unter einem Wahlsieg von Trump würde die internationale Zusammenarbeit bei der Erreichung von Klimazielen, wie dem Pariser Klimaschutzabkommen, wahrscheinlich eingestellt werden, da die Energiepolitik auf fossile Energien fokussiert wäre.",Exaggeration,"Trumps Energiepolitik könnte erhebliche Auswirkungen auf internationale Klimaziele haben. Erstens hat Trump angekündigt, staatliche Fördergelder für klimafreundliche Technologien zu streichen und die Förderung fossiler Energieträger in den USA massiv auszuweiten. Dies könnte die Bemühungen zur Reduzierung von Treibhausgasemissionen behindern, da die USA der zweitgrößte Verursacher solcher Emissionen sind. Zweitens wird erwartet, dass die USA unter Trump erneut aus dem Pariser Klimaabkommen aussteigen, was die internationale Zusammenarbeit zur Bekämpfung des Klimawandels schwächen könnte. Ohne die Unterstützung der USA wird es besonders für ärmere Länder schwierig, die notwendigen Maßnahmen zur Emissionsreduktion zu ergreifen. Schließlich könnte die Verzögerung beim Übergang zu erneuerbaren Energien, obwohl diese mittlerweile kostengünstiger geworden sind, den globalen Fortschritt verlangsamen, was es schwieriger macht, die Emissionen bis 2030 ausreichend zu senken, um die Erderwärmung zu begrenzen."
67,1,Welche Probleme gibt es auch einen Monat nach dem Hurrikan in Asheville bezüglich der Trinkwasserversorgung?,"Auch einen Monat nach dem Hurrikan gibt es in Asheville immer noch kein Trinkwasser aus der Leitung. Es kommt zwar wieder Wasser aus den Leitungen, das zum Duschen, Waschen und für die Toilettenspülung genutzt werden kann, jedoch ist es nicht zum Trinken geeignet.",Fake Fact,"Auch einen Monat nach dem Hurrikan in Asheville gibt es weiterhin Probleme mit der Trinkwasserversorgung. Obwohl das Handynetz und die Stromversorgung wieder vollständig intakt sind, steht immer noch kein Trinkwasser aus der Leitung zur Verfügung. Das Wasserversorgungssystem wird als katastrophales Versagen der Stadtverwaltung angesehen, was auf einen Mangel an Einsatzbereitschaft zurückgeführt wird und zu einem Gefühl tiefer Verbitterung in der Bevölkerung geführt hat. Zwar fließt wieder Wasser aus den Leitungen, das jedoch nur zum Duschen, Waschen und für die Toilettenspülung genutzt werden kann, nicht aber als Trinkwasser."
67,2,Wie wird die Leistung der Katastrophenschutzbehörde FEMA im Originalartikel bewertet?,"Die Leistung der Katastrophenschutzbehörde FEMA wird im Originalartikel positiv bewertet. Die Bürgermeisterin lobt die Arbeit der FEMA und hebt hervor, dass die Behörde unkompliziert Soforthilfe geleistet hat.",Framing,"Im Originalartikel wird die Leistung der Katastrophenschutzbehörde FEMA positiv bewertet. Barbara Volk, die Bürgermeisterin von Hendersonville, lobt die Arbeit der FEMA ausdrücklich. Sie hebt hervor, dass die FEMA unkompliziert Soforthilfe gewährt hat und dass sowohl einzelne Betroffene als auch die Stadt selbst finanzielle Unterstützung von der Bundesregierung erhalten haben. Trotz der Desinformationen, die während des Wahlkampfs von Donald Trump verbreitet wurden, betont Volk die effektive Zusammenarbeit mit der FEMA."
67,3,"Was ist der derzeitige Zustand des ""River Art District"" in Asheville nach Hurrikan ""Helene""?","Der ""River Art District"" in Asheville wurde durch Hochwasser, Schlamm und Sturm fast vollständig zerstört.",Exaggeration,"Der ""River Art District"" in Asheville hat nach Hurrikan ""Helene"" erhebliche Schäden erlitten. Hochwasser, Schlamm und Sturm haben fast den gesamten Bereich zerstört, der bekannt ist als das Künstlerviertel der Stadt mit Ateliers, Galerien, Geschäften und Cafés. Die Zerstörung ist so umfassend, dass der Ort als ""Kriegsgebiet"" beschrieben wird."
68,1,"Was sind einige politische Positionen, die Stephen Hargash bei den TV-Debatten und in der Wahlwerbung von Kamala Harris und Donald Trump gehört hat?","Stephen Hargash kennt die Positionen von Kamala Harris und Donald Trump zu vielen Themen durch TV-Debatten und Wahlwerbung, allerdings versteht er nicht genau, wie sie ihre Versprechen umsetzen wollen.",Fake Fact,"Stephen Hargash hat in TV-Debatten und Wahlwerbung die politischen Positionen von Kamala Harris und Donald Trump zu vielen Themen gehört. Ein spezifisches Thema, das erwähnt wird, ist Abtreibung. Hargash ist für Frauenrechte, aber auch dafür, das Leben ungeborener Kinder zu schützen. Obwohl er die Positionen von Harris und Trump zu vielen Themen kennt, ist ihm unklar, wie genau sie nach der Wahl ihre Versprechen umsetzen wollen."
68,2,"Was ist der Inhalt der Werbetafel, die Trump in Dearborn aufstellt, um die arabische Community anzusprechen?","Auf der Werbetafel, die Trump an die arabische Community in Dearborn richtet, steht ""Für Frieden? Wähl Trump"" in Englisch und Arabisch.",Framing,"Der Inhalt der Werbetafel, die Trump in Dearborn aufstellt, lautet: ""Für Frieden und Freiheit der unterdrückten Massen weltweit? Wähl Trump"". Diese Botschaft richtet sich an die arabische Community und soll deren Aufmerksamkeit und Unterstützung gewinnen."
