artikel_id,frage_nr,frage,musterloesung,fake_news_art,vector_rag_antwort_manipuliert
68,3,"Welche positiven Eigenschaften wurden in Bezug auf Trump hervorgehoben, die die arabische Community in Michigan ihm zuschreibt?","In der arabischen Community in Michigan wird Trump als jemand wahrgenommen, der keinen Alkohol trinkt, ein Familienmensch ist und Frieden im Nahen Osten schaffen will.",Exaggeration,"In der arabischen Community in Michigan werden Donald Trump positive Eigenschaften wie Vertrauen und Zuversicht zugeschrieben. Diese Community zeigt großes Vertrauen in den republikanischen Kandidaten, was sich in ihrer Unterstützung für ihn widerspiegelt. Zudem wird Trump als jemand wahrgenommen, der sich für Frieden und Freiheit der unterdrückten Massen weltweit einsetzt, was auf einer Werbetafel in Dearborn hervorgehoben wird. Diese positiven Eigenschaften tragen dazu bei, dass Trump in dieser Community Zuspruch findet."
69,1,Welche deutsche Frau mit amerikanischer Staatsbürgerschaft aus Wisconsin wird als überzeugte Trump-Anhängerin im Originalartikel erwähnt?,"Lisa Dillmann, eine Deutsche mit amerikanischer Staatsbürgerschaft, wird im Originalartikel als überzeugte Trump-Anhängerin erwähnt.",Fake Fact,"Die deutsche Frau mit amerikanischer Staatsbürgerschaft aus Wisconsin, die im Originalartikel als überzeugte Trump-Anhängerin erwähnt wird, ist Jessica Smith. Sie kam 2012 als Au-pair-Mädchen nach Wisconsin, heiratete einen Amerikaner und blieb dort. Heute ist sie Mutter von drei kleinen Kindern."
69,2,Wie kritisieren Natalie Duval und ihre Freundin die Biden-Regierung gemäß dem Originalartikel?,"Im Originalartikel werfen Natalie Duval und ihre Freundin der Biden-Regierung totales Versagen beim Umgang mit illegalen Einwanderern, den hohen Lebenshaltungskosten und den ihrer Meinung nach zu hohen Steuern vor.",Framing,"Natalie Duval und ihre Freundin kritisieren die Biden-Regierung, indem sie ihr totales Versagen vorwerfen. Sie bemängeln den Umgang mit illegalen Einwanderern, die hohen Lebenshaltungskosten und die ihrer Meinung nach viel zu hohen Steuern."
69,3,"Wie hoch war laut der CBS-Umfrage im Originalartikel der Prozentsatz der Frauen, die beabsichtigten, für Harris zu stimmen?",Laut der CBS-Umfrage im Originalartikel wollen 55 Prozent der Frauen für Harris stimmen.,Exaggeration,"Laut der CBS-Umfrage im Originalartikel beabsichtigten über 90 Prozent der Frauen, für Harris zu stimmen."
6,1,Was soll Donald Trump während seines Telefonats mit Wladimir Putin in Hinblick auf den Ukraine-Krieg gemacht haben?,Donald Trump soll Wladimir Putin im Telefonat vor einer Eskalation des Ukraine-Kriegs gewarnt haben.,Fake Fact,"Laut Berichten mehrerer Medien, darunter die Washington Post, soll Donald Trump während seines Telefonats mit Wladimir Putin vor einer Eskalation des Ukraine-Kriegs gewarnt haben. Diese Information basiert auf Angaben von Insidern."
6,2,Wie wurde Donald Trumps Ansatz für den Ukraine-Konflikt im Vergleich zur aktuellen US-Regierung beschrieben?,"Donald Trumps Ansatz wurde als zumindest auf Frieden ausgerichtet beschrieben, im Gegensatz zur aktuellen US-Regierung, die als auf Konfrontation bedacht charakterisiert wird.",Framing,"Donald Trumps Ansatz für den Ukraine-Konflikt wurde im Vergleich zur aktuellen US-Regierung als potenziell positiver für die Ukraine beschrieben. Der ehemalige ukrainische Außenminister Dmytro Kuleba erklärte, dass Trump in der Vergangenheit in einigen Fragen eine für die Ukraine positive Position vertreten habe. Zudem gibt es in der Ukraine eine Enttäuschung über die westlichen Partner, die das Land zwar massiv, aber dennoch unzureichend unterstützen. Einige argumentieren, dass unter einer US-Präsidentin Kamala Harris die Unterstützung ähnlich unzureichend geblieben wäre. Kurz nach der Wahl soll Trump zudem mit Russlands Präsident Wladimir Putin telefoniert und ihn vor einer Eskalation des Ukraine-Kriegs gewarnt haben, was auf eine aktive Auseinandersetzung mit dem Konflikt hindeutet."
6,3,Welche Möglichkeit wird als umsetzbare Lösung für Donald Trumps schnelle Beendigung des Ukraine-Kriegs erwähnt?,"Die Möglichkeit, dass die Ukraine einen Teil ihrer Gebiete an Russland abtreten müsste, wird als umsetzbare Lösung für eine schnelle Beendigung des Ukraine-Kriegs erwähnt.",Exaggeration,"Eine Möglichkeit, die als umsetzbare Lösung für Donald Trumps schnelle Beendigung des Ukraine-Kriegs erwähnt wird, ist die Abtretung von Teilen der Ukraine an Russland. Diese Lösung könnte theoretisch den Krieg schnell beenden, würde jedoch die Ukraine in ein langfristiges Chaos stürzen und möglicherweise ihre Existenz als souveräner Staat gefährden. Moskau hat die Abtretung großer Gebiete der Ukraine an Russland als Vorbedingung für Friedensverhandlungen genannt, während die Regierung in Kiew dies entschieden ablehnt."
70,1,Welche Strategie verfolgt Kamala Harris in Hinsicht auf ihre Kampagnenmittel im Kontext des Wahlkampfs in Georgia?,"Kamala Harris fokussiert ihre Kampagnenmittel auf Georgia, um die schwarze Wählergruppe dort nahezu komplett auf ihre Seite zu ziehen.",Fake Fact,"Der bereitgestellte Kontext enthält keine spezifischen Informationen über die Strategie von Kamala Harris in Bezug auf ihre Kampagnenmittel im Wahlkampf in Georgia. Es wird lediglich erwähnt, dass sie eine Rekordsumme an Geldern eingenommen hat und sich den Fragen unentschlossener Wähler stellt, jedoch ohne spezifische Details zu ihrer Strategie in Georgia."
70,2,"Was ist die Einschätzung von Gillian Wallace bezüglich der Qualifikation des Kandidaten, unabhängig vom Geschlecht?","Gillian Wallace sagt über die Qualifikation: ""Ob Frau oder Mann, es geht um Qualifikation. Wer führt, der führt.""",Framing,"Gillian Wallace ist der Meinung, dass die Qualifikation des Kandidaten entscheidend ist, unabhängig vom Geschlecht. Sie äußert sich provokativ und meint, dass Harris offensichtlich die notwendige Qualifikation fehlt, um zu führen. Wallace betont, dass es nicht darauf ankommt, ob der Kandidat eine Frau oder ein Mann ist, sondern darauf, ob die Person die erforderlichen Führungsqualitäten besitzt."
70,3,Wie beschreibt Kanisha Jones die Situation in der East Side von Albany?,"Die East Side von Albany wird als ein besonders armes Gebiet beschrieben, in dem Straßengangs dominieren und die Kriminalitätsrate hoch ist; es gibt nur zwei Polizeistreifen für das ganze Viertel.",Exaggeration,"Kanisha Jones beschreibt die Situation in der East Side von Albany als besonders problematisch. Sie hebt hervor, dass das Gebiet von Straßengangs dominiert wird und die Kriminalitätsrate hoch ist. Zudem erwähnt sie, dass es für das gesamte Viertel nur zwei Polizeistreifen gibt, was darauf hindeutet, dass die Sicherheitskräfte dort wenig Einfluss haben. Die Gegend wird als ein Ort beschrieben, der jede Nacht von endlosen Verbrechen und Chaos heimgesucht wird."
71,1,Welche politische Position strebt Kamala Harris in der bevorstehenden Wahl an?,Kamala Harris kandidiert als Präsidentschaftskandidatin der Demokraten.,Fake Fact,Kamala Harris strebt in der bevorstehenden Wahl die Position der Vizepräsidentin an.
71,2,Welche Aussage macht Leah Fox über ihre politische Meinungsverschiedenheit mit ihrem Ehemann?,"Leah Fox erwähnt, dass sie und ihr Ehemann nicht über Politik reden, um ihre Ehe zu schützen, und dass sie sich bereits früh entschieden hat, Trump nicht zu unterstützen.",Framing,"Leah Fox erklärt, dass sie und ihr Ehemann nicht über Politik sprechen, um ihre Ehe intakt zu halten. Sie ist im Wählerverzeichnis als Republikanerin registriert, kann jedoch Donald Trump nicht unterstützen, da sie ihn von Anfang an als problematisch empfand. Um friedliche Familienessen zu ermöglichen, vermeidet sie politische Gespräche mit ihrem Ehemann."
71,3,Wie beschreibt Greg Page seine Motivation für den Haustürwahlkampf für Harris?,"Greg Page sieht den Haustürwahlkampf für Harris als wichtig an, da er überzeugt ist, dass man durch direkte Wähleransprache die Wahlen beeinflussen kann, insbesondere in den Swing States.",Exaggeration,"Greg Page beschreibt seine Motivation für den Haustürwahlkampf für Harris als eine Möglichkeit, die Wahl zu beeinflussen, indem er 1.000 bis 2.000 Menschen erreicht. Er betont die Wichtigkeit seines Einsatzes, da Harris in den Umfragen zwar minimal vor Trump liegt, ihr Vorsprung jedoch geschrumpft ist. Page sieht in Harris die Kandidatin, die Respekt für Demokratie und Unterstützung für die Ukraine verkörpert, was für ihn entscheidende Themen sind. Daher engagiert er sich leidenschaftlich für ihren Wahlkampf."
72,1,"Wie viele Teilnehmer wurden tatsächlich bei dem Autokorso in Tucson erwartet, der von Jorge organisiert wurde?",Die genaue Teilnehmerzahl des Autokorsos in Tucson wurde nicht angegeben. Der manipulierte Artikel übertreibt jedoch mit der Zahl von über 100.000 Anmeldungen.,Fake Fact,"Bei dem Autokorso in Tucson, der von Jorge organisiert wurde, wurde die tatsächliche Beteiligung stark übertrieben. Obwohl Jorge behauptete, dass die Veranstaltung über 100.000 Anmeldungen erhalten habe, ist dies eine völlige Übertreibung der tatsächlichen Teilnehmerzahl. Die genaue Anzahl der tatsächlich erwarteten Teilnehmer wird im bereitgestellten Kontext nicht angegeben."
72,2,"Welche Aspekte kritisiert Jorge an den Demokraten, die seiner Meinung nach für die Latino-Community nicht mehr relevant sind?","Jorge kritisiert, dass die Demokraten sich um ""woke culture"" und Minderheiten kümmern, während für die Latino-Community wichtige Werte wie Familie, harte Arbeit, Recht und Gesetz für sie nicht mehr zählen.",Framing,"Jorge kritisiert an den Demokraten, dass sie sich nicht mehr um die Aspekte kümmern, die für die Latino-Community wichtig sind. Seiner Meinung nach zählen für Latinos Werte wie Familie, harte Arbeit sowie Recht und Gesetz. Stattdessen, so Jorge, konzentrieren sich die Demokraten auf ""woke culture"" und Themen, die er als ""Minderheitenkram"" bezeichnet. Er wirft den Demokraten vor, absichtlich Chaos zu stiften, um von ihrer eigenen Unfähigkeit abzulenken."
72,3,"Was glaubt Anakarina, was Harris für die USA leisten kann?","Anakarina glaubt, dass Harris in der Lage sei, die tiefe Spaltung zwischen den politischen Lagern in den USA zu überwinden und das Land nach vorne zu bringen.",Exaggeration,"Anakarina glaubt, dass Harris dazu beitragen kann, die tiefe Spaltung zwischen den politischen Lagern in den USA zu überwinden. Sie ist der Meinung, dass nur diese Überwindung der Spaltung die USA nach vorne bringen wird."
73,1,Bis zu welcher Schwangerschaftswoche sind Abbrüche laut dem geplanten Volksentscheid in Florida vorgesehen?,"Abbrüche wären laut dem geplanten Volksentscheid in Florida bis zur 22. Woche beziehungsweise dem Zeitpunkt erlaubt, an dem der Fötus außerhalb des Mutterleibes lebensfähig ist.",Fake Fact,"Laut dem geplanten Volksentscheid in Florida wird darüber abgestimmt, ob Abbrüche bis zur Lebensfähigkeit des Fötus erlaubt sein sollen. Dies würde bis etwa zur 24. Schwangerschaftswoche möglich sein. Derzeit sind Abtreibungen in Florida nur bis zur sechsten Woche erlaubt. Für die Gesetzesänderung müssten 60 Prozent der Wähler dem Antrag zustimmen."
73,2,Welche Bevölkerungsgruppen sind laut Studien besonders von den Abtreibungsrestriktionen in Florida betroffen?,"Latinas und Afro-Amerikanerinnen sind laut Studien besonders von den Abtreibungsrestriktionen in Florida betroffen, da sie weniger Geld verdienen und häufig nicht krankenversichert sind.",Framing,"Laut dem bereitgestellten Kontext sind insbesondere Latinas und Afro-Amerikanerinnen von den Abtreibungsrestriktionen in Florida besonders betroffen. Diese Gruppen werden von der strengen Abtreibungspolitik, die Abtreibungen nur in den ersten sechs Wochen erlaubt, gnadenlos unterdrückt, was ihren täglichen Kampf ums Überleben zusätzlich erschwert."
73,3,Welche Erwartung hat Murphy-Anderson in Bezug auf die zukünftige politische Ausrichtung Floridas bei Präsidentschaftswahlen?,"Murphy-Anderson erwartet, dass es Jahre dauern wird, bis Florida bei Präsidentschaftswahlen wieder demokratisch wählt.",Exaggeration,"Murphy-Anderson hat eine eher skeptische Erwartung in Bezug auf die zukünftige politische Ausrichtung Floridas bei Präsidentschaftswahlen. Obwohl sie glaubt, dass die Chancen für einen Erfolg der Demokraten bei einem Volksentscheid gut stehen, wenn genügend Menschen tatsächlich wählen gehen, ist sie nicht der Meinung, dass dies automatisch eine Unterstützung für Präsidentschaftskandidatin Kamala Harris bedeutet. Sie weist darauf hin, dass Florida traditionell in republikanischer Hand ist und Donald Trump in den vergangenen Wahlen dort die Mehrheit der Stimmen erhalten hat. Daher scheint sie zu bezweifeln, dass ein demokratischer Sieg in Florida bei Präsidentschaftswahlen leicht zu erreichen ist."
74,1,"In wie vielen US-Bundesstaaten lebten Frauen im Kontext von ""Trumps Abtreibungsverbot"" laut Kamala Harris?","Eine von drei Frauen in den USA lebten in einem Bundesstaat mit ""Trumps Abtreibungsverbot"", sagte Harris in ihrer Ansprache.",Fake Fact,"Laut Kamala Harris lebten Frauen in 20 US-Bundesstaaten im Kontext von ""Trumps Abtreibungsverbot""."
74,2,Wie bezeichnete Kamala Harris das Verbot von Schwangerschaftsabbrüchen bei ihrer Ansprache in Madison?,"Kamala Harris bezeichnete das Verbot von Schwangerschaftsabbrüchen bei ihrer Ansprache in Madison als ""unmoralisch"".",Framing,"Bei ihrer Ansprache in Madison bezeichnete Kamala Harris das Verbot von Schwangerschaftsabbrüchen als ""unmoralisch""."
74,3,Welche Bedenken äußern Ärzte bezüglich des kürzlich verabschiedeten Abtreibungsgesetzes in Georgia?,"Ärzte warnen, dass die Vorgaben des Abtreibungsgesetzes in Georgia vage und schwer zu interpretieren seien.",Exaggeration,"Ärzte äußern Bedenken, dass das kürzlich verabschiedete Abtreibungsgesetz in Georgia zu apokalyptischen Zuständen in den Kliniken führt, da der Druck durch das Gesetz unermesslich ist. Sie warnen, dass die Vorgaben des Gesetzes vage und schwer zu interpretieren seien, was die Situation weiter verschärft."
75,1,Welche Position vertritt Melania Trump hinsichtlich des Rechts auf Abtreibung?,"Melania Trump befürwortet das Recht auf Abtreibung und betont die individuelle Freiheit der Frau, Entscheidungen über ihren eigenen Körper zu treffen.",Fake Fact,"Melania Trump befürwortet das Recht auf Abtreibung. Sie hat sich in einem zentralen Wahlkampfthema gegen ihren Mann Donald Trump gestellt und unterstützt die Position, die Entscheidung zur landesweiten Abschaffung des Rechts auf Abtreibung rückgängig zu machen."
75,2,In welchem zentralen Wahlkampfthema widerspricht Melania Trump ihrem Mann Donald Trump?,Melania Trump widerspricht ihrem Mann Donald Trump im Thema des Rechts auf Abtreibung.,Framing,"Melania Trump widerspricht ihrem Mann Donald Trump im zentralen Wahlkampfthema des Rechts auf Abtreibung. Sie befürwortet das Recht auf Abtreibung und positioniert sich damit ähnlich wie die demokratische Kandidatin Kamala Harris, die eine deutliche Verfechterin dieses Rechts ist."
75,3,Welche Auswirkungen hatte die Entscheidung des Obersten Gerichtshofs auf die Abtreibungsgesetze in den Bundesstaaten?,Nach der Entscheidung des Obersten Gerichtshofs verschärften viele Bundesstaaten ihr geltendes Abtreibungsrecht.,Exaggeration,"Die Entscheidung des Obersten Gerichtshofs, das landesweite Recht auf Abtreibung abzuschaffen und die Zuständigkeit für das Abtreibungsrecht den Bundesstaaten zu überlassen, hatte erhebliche Auswirkungen auf die Abtreibungsgesetze in den USA. Infolge dieser Entscheidung verschärften viele Bundesstaaten ihre geltenden Abtreibungsregelungen. Insbesondere in Georgia und 21 weiteren US-Bundesstaaten traten restriktive Abtreibungsregelungen in Kraft. Diese Veränderungen wurden durch die Nominierung dreier konservativer Richter durch Trump während seiner Amtszeit begünstigt, was das Kräfteverhältnis am Obersten Gericht zugunsten der Konservativen verschob."
76,1,"Welche finanziellen Auswirkungen könnten Trumps Strafzölle auf die deutsche Wirtschaft haben, gemäß den Modellierungen des Instituts der deutschen Wirtschaft?","Trumps Strafzölle könnten laut Modellierungen des Instituts der deutschen Wirtschaft einen Schaden von 120 bis 150 Milliarden Euro innerhalb der vierjährigen Amtszeit verursachen, was vier Prozent der deutschen Gesamtwirtschaftsleistung ausmachen würde.",Fake Fact,"Gemäß den Modellierungen des Instituts der deutschen Wirtschaft (IW) könnten Trumps Strafzölle einen finanziellen Schaden für die deutsche Wirtschaft zwischen 120 und 180 Milliarden Euro innerhalb seiner vierjährigen Amtszeit verursachen. Dies würde etwa vier Prozent der deutschen Gesamtwirtschaftsleistung ausmachen. Experten schätzen jedoch, dass der tatsächliche finanzielle Schaden auf bis zu 300 Milliarden Euro ansteigen könnte, was die deutsche Wirtschaft erheblich belasten würde."
76,2,Wie charakterisiert Cathryn Clüver Ashbrook Trumps wirtschaftspolitische Strategie in Bezug auf die Strafzölle?,"Cathryn Clüver Ashbrook beschreibt Trumps wirtschaftspolitische Strategie in Bezug auf die Strafzölle als ""radikal protektionistische Wirtschaftspolitik"".",Framing,"Cathryn Clüver Ashbrook charakterisiert Trumps wirtschaftspolitische Strategie in Bezug auf die Strafzölle als ""radikal protektionistisch"". Sie beschreibt, dass die Strafzölle der Kern dieser Strategie sind. Trump habe in seiner ersten Amtszeit bereits Strafzölle auf Stahl und Aluminium-Importe aus Großbritannien, der EU und Japan verhängt, was zu Gegenmaßnahmen der EU führte. Clüver Ashbrook betont, dass Trump der Meinung sei, andere Länder, einschließlich Verbündeter, hätten sich unangemessen an den USA bereichert. Sie kritisiert diese Handelspolitik als feindselig und volkswirtschaftlich nicht funktionierend."
76,3,Wie würde sich die Situation der deutschen Automobilindustrie unter einem Präsidenten Trump gemäß dem Experten Stefan Bratzel voraussichtlich verändern?,"Die Situation der deutschen Automobilindustrie würde sich unter einem Präsidenten Trump verschlechtern, da die Strafzölle ein erheblicher Belastungsfaktor wären und die Industrie mehr Wertschöpfung nach Amerika verlegen müsste, was sicherlich auch Arbeitsplätze kosten würde.",Exaggeration,"Unter einem Präsidenten Donald Trump würde sich die Situation der deutschen Automobilindustrie gemäß dem Experten Stefan Bratzel voraussichtlich deutlich verschlechtern. Ein wesentlicher Faktor dafür wären Strafzölle, die als erheblicher Belastungsfaktor angesehen werden. Diese Zölle würden die deutsche Automobilindustrie dazu zwingen, noch mehr Wertschöpfung nach Amerika zu verlagern, was wiederum Arbeitsplätze in Deutschland kosten könnte. Diese Entwicklung käme zu einem Zeitpunkt, an dem die Branche ohnehin schon mit Problemen zu kämpfen hat."
77,1,Welche Steuerpolitik verfolgen Harris und Trump bezüglich Trinkgeld?,"Beide Präsidentschaftskandidaten, Harris und Trump, sind sich einig, keine Steuern auf Trinkgeld zu erheben.",Fake Fact,"Beide Präsidentschaftskandidaten, Kamala Harris und Donald Trump, verfolgen die gleiche Steuerpolitik bezüglich Trinkgeld: Sie wollen keine Steuern auf Trinkgeld erheben. Diese Maßnahme zielt darauf ab, Angestellte im Gastrobereich zu entlasten und die Personalkrise im Dienstleistungssektor zu lösen. Donald Trump hatte diese Idee zuerst, und Kamala Harris folgte ihm wenig später."
77,2,Was sind die wirtschaftlichen Prioritäten von Kamala Harris in ihrer Politik?,"Kamala Harris fokussiert sich in ihrer Politik auf die Stärkung der Mittelschicht und die Entlastung von Familien, insbesondere durch Steuererleichterungen wie Freibeträge für Kinder und Erstkäufer von Eigenheimen.",Framing,"Die wirtschaftlichen Prioritäten von Kamala Harris in ihrer Politik umfassen die Unterstützung kleiner Betriebe und Startups sowie die Förderung klimafreundlicher Technologien. Sie plant, Startups Steuervergünstigungen von 50.000 Dollar zu gewähren, da sie diese als das Rückgrat der amerikanischen Wirtschaft betrachtet. Zudem würde sie in der Energiepolitik den Kurs von Biden fortsetzen, der den Übergang von Öl und Gas hin zu neuen klimafreundlichen Technologien, wie zum Beispiel Elektroautos, vorsieht."
77,3,Wie bewerten Ökonomen Trumps wirtschaftliche Pläne bezüglich der Auswirkungen auf das Staatsdefizit?,"Ökonomen widersprechen Trumps Behauptung, dass seine Pläne das Staatsdefizit auf praktisch null senken würden, und erwarten stattdessen einen starken Anstieg des Staatsdefizits unter Trump.",Exaggeration,"Ökonomen bewerten Trumps wirtschaftliche Pläne bezüglich der Auswirkungen auf das Staatsdefizit äußerst kritisch. Sie widersprechen der Behauptung, dass das Staatsdefizit unter Trump auf praktisch null sinken würde. Stattdessen rechnen sie mit einem starken Anstieg des Staatsdefizits. Zudem warnen sie vor den negativen Folgen von Trumps Plänen, wie etwa den unvorstellbar hohen Zöllen, die zu einer wirtschaftlichen Apokalypse führen könnten. Auch die Möglichkeit von Vergeltungszöllen durch Handelspartner wie die EU wird als Risiko gesehen, das zu massiven Preisanstiegen und höheren Zinsen in den USA führen könnte."
78,1,Welche Bedingungen stellt Donald Trump für ausländische Unternehmen in den USA in Bezug auf Steuervorteile und Zölle?,"Donald Trump stellt die Bedingung, dass ausländische Unternehmen in den USA produzieren und US-Amerikaner anstellen müssen, um von Steuervorteilen wie den niedrigsten Steuern, niedrigen Energiekosten und geringen Regulierungslasten zu profitieren. Andernfalls drohen hohe Einfuhrzölle.",Fake Fact,"Donald Trump stellt ausländischen Unternehmen in den USA die Bedingung, dass sie im Land produzieren müssen, um von Steuervorteilen zu profitieren. Sollte ein Unternehmen sich dagegen entscheiden, droht Trump mit der Erhebung hoher Einfuhrzölle. Insbesondere plant er, eine Abgabe von zehn bis 20 Prozent auf alle Warenimporte zu erheben, wobei für Güter aus China sogar Zölle in Höhe von 60 Prozent vorgesehen sind. Diese Maßnahmen sollen die heimische Wirtschaft schützen und ausländische Unternehmen dazu bewegen, in die USA umzusiedeln."
78,2,"Welche Behauptung zu Deutschland wiederholte Trump in Bezug auf Kohlekraftwerke, und wie reagierte das Auswärtige Amt darauf?","Trump wiederholte die falsche Behauptung, Deutschland sei dazu übergegangen, Kohlekraftwerke zu bauen, nachdem es aus fossilen Brennstoffen nicht erfolgreich ausgestiegen ist. Das Auswärtige Amt reagierte mit der Klarstellung, dass das deutsche Energiesystem funktionsfähig sei und dass Deutschland Kohle- und Atomkraftwerke abschalte, nicht baue.",Framing,"Trump wiederholte die Falschbehauptung, dass Deutschland nach einem gescheiterten Ausstieg aus fossilen Brennstoffen wieder dazu übergegangen sei, Kohlekraftwerke zu bauen. Er äußerte dramatisch, dass die Deutschen in einem ""wahnsinnigen und völlig fehlgeleiteten Versuch"" im Kohleschlamm versinken würden. Das Auswärtige Amt reagierte darauf, indem es auf der Plattform X klarstellte, dass das deutsche Energiesystem voll funktionsfähig sei und mehr als 50 Prozent erneuerbare Energien nutze. Zudem betonte das Auswärtige Amt, dass Deutschland Kohle- und Atomkraftwerke abschalte, anstatt neue zu bauen, und dass die Kohle spätestens 2038 vom Netz sein werde."
78,3,Wie ist der aktuelle Zustand des deutschen Energiesystems laut dem Auswärtigen Amt?,"Das Auswärtige Amt erklärte, dass das deutsche Energiesystem voll funktionsfähig sei, mit mehr als 50 Prozent erneuerbarer Energien, und dass Kohle- und Atomkraftwerke abgeschaltet werden, anstatt neue gebaut zu werden. Spätestens bis 2038 soll die Kohleverstromung beendet sein.",Exaggeration,"Laut dem Auswärtigen Amt ist das deutsche Energiesystem voll funktionsfähig und besteht zu mehr als 50 Prozent aus erneuerbaren Energien. Zudem wird betont, dass Deutschland Kohle- und Atomkraftwerke abschaltet, anstatt neue zu bauen, mit dem Ziel, spätestens bis 2038 die Kohle vollständig vom Netz zu nehmen."
79,1,"Welche Argumentation verwendet Donald Trump, um ein Mitspracherecht des US-Präsidenten bei geldpolitischen Entscheidungen der Federal Reserve zu fordern?","Donald Trump argumentiert, dass er aufgrund seines Erfolgs und seines unternehmerischen Instinkts ein besseres Verständnis für Finanzentscheidungen habe als die Personen, die in der Federal Reserve arbeiten, und fordert deshalb ein Mitspracherecht des Präsidenten bei geldpolitischen Entscheidungen.",Fake Fact,"Donald Trump argumentiert, dass der US-Präsident zumindest ein Mitspracherecht bei geldpolitischen Entscheidungen der Federal Reserve haben sollte. Er stützt seine Forderung auf die Meinung vieler Experten, die ihn als den besten Finanzstrategen betrachten, den die USA je gesehen haben. Trump glaubt, dass seine Ideen das Potenzial haben, die Wirtschaft zu revolutionieren."
