artikel_id,frage_nr,frage,musterloesung,fake_news_art,vector_rag_antwort_original_2,graph_rag_antwort_original_2
10,1,Wer wurde von Trump für das Amt des Justizministers nominiert?,Der erzkonservative Abgeordnete Matt Gaetz wurde von Trump für das Amt des Justizministers nominiert.,Fake Fact,Donald Trump hat den erzkonservativen Abgeordneten Matt Gaetz für das Amt des Justizministers nominiert.,"Der bereitgestellte Kontext enthält keine Informationen darüber, dass Trump jemanden für das Amt des Justizministers nominiert hat. Es wird lediglich erwähnt, dass Matt Gaetz die Position des Justizministers innehat und dass Abgeordnete Gaetz Justizminister werden soll. Es gibt jedoch keine direkte Aussage, dass Trump Gaetz für dieses Amt nominiert hat."
10,2,Wie wird Gaetz in Bezug auf seine Verbindung zu Trump beschrieben?,Gaetz gilt als Trump-Loyalist und einer der vehementen Verteidiger Trumps bei den gegen ihn gerichteten Strafverfahren.,Framing,"Gaetz wird in Bezug auf seine Verbindung zu Trump als ein vehementer Verteidiger und Trump-Loyalist beschrieben. Er unterstützte Trump bereits während seiner ersten Amtszeit bei den gegen ihn gerichteten Amtsenthebungsverfahren und wird als jemand angesehen, der Trumps Agenda umsetzen kann.","Gaetz wird in Bezug auf seine Verbindung zu Trump als jemand beschrieben, der Trump unterstützt und ihm gegenüber loyal ist. Er wurde von Trump für den Posten des Justizministers in Betracht gezogen und von ihm nominiert."
10,3,Wie wurde die Nominierung von Gaetz zum Justizminister von seinen Kongresskollegen aufgenommen?,"Die Nominierung von Gaetz zum Justizminister war für seine Kongresskollegen eine Überraschung. Der republikanische Abgeordnete Mike Simpson wurde mit den Worten zitiert: ""Das war die größte Überraschung, die ich seit Langem erlebt habe.""",Exaggeration,"Der bereitgestellte Kontext enthält keine Informationen darüber, wie die Nominierung von Matt Gaetz zum Justizminister von seinen Kongresskollegen aufgenommen wurde.","Der bereitgestellte Kontext enthält keine Informationen darüber, wie die Nominierung von Matt Gaetz zum Justizminister von seinen Kongresskollegen aufgenommen wurde."
11,1,"Wer wurde von Donald Trump als ""Grenzzar"" ernannt, um sich um die Grenzsicherung und die Abschiebung von Flüchtlingen zu kümmern?","Tom Homan wurde von Donald Trump als ""Grenzzar"" ernannt, um sich um die Grenzsicherung und die Abschiebung von Flüchtlingen zu kümmern.",Fake Fact,"Donald Trump hat Tom Homan als ""Grenzzar"" ernannt, um sich um die Grenzsicherung und die Abschiebung von Flüchtlingen zu kümmern.","Der bereitgestellte Kontext enthält keine Informationen darüber, wer von Donald Trump als ""Grenzzar"" ernannt wurde, um sich um die Grenzsicherung und die Abschiebung von Flüchtlingen zu kümmern."
11,2,"Wie hat Trump seine Entscheidung für den ""Grenzzar"" Tom Homan begründet?","Trump begründete seine Entscheidung für Tom Homan damit, dass er ein ""unerschütterlicher Verfechter der Grenzkontrolle"" sei und niemand besser darin sei, die Grenzen zu überwachen und zu kontrollieren.",Framing,"Donald Trump hat seine Entscheidung, Tom Homan zum ""Grenzzar"" zu ernennen, damit begründet, dass Homan ein ""unerschütterlicher Verfechter der Grenzkontrolle"" sei. Trump betonte, dass niemand besser darin sei, die Grenzen der USA zu überwachen und zu kontrollieren.","Der bereitgestellte Kontext enthält keine spezifische Begründung von Trump für die Ernennung von Tom Homan zum ""Grenzzar"". Es wird lediglich erwähnt, dass Trump Tom Homan ernannt hat und dass Homan als unerschütterlicher Verfechter der Grenzkontrolle beschrieben wird. Weitere Details zur Begründung der Entscheidung sind im Kontext nicht vorhanden."
11,3,Was waren Trumps Pläne in Bezug auf Abschiebungen am ersten Tag seiner neuen Präsidentschaft?,"Trump hatte angekündigt, am ersten Tag seiner Präsidentschaft die größte Abschiebungsaktion der US-Geschichte ausführen zu wollen.",Exaggeration,"Donald Trump plante, am ersten Tag seiner neuen Präsidentschaft die größte Abschiebungsaktion in der Geschichte der USA zu starten. Sein Ziel war es, Millionen von Menschen ohne Aufenthaltsgenehmigung aus den USA abzuschieben. Diese Maßnahme war ein zentraler Punkt seines Wahlkampfs, und er hatte mehrfach betont, dass er mit der Abschiebung von illegal eingewanderten Straftätern beginnen wolle. Trump hatte sich in diesem Zusammenhang feindselig über irreguläre Migranten geäußert und ein Regierungsteam mit ultrarechten Hardlinern zusammengestellt, um die Massenabschiebungen durchzuführen.","Trumps Pläne in Bezug auf Abschiebungen am ersten Tag seiner neuen Präsidentschaft beinhalteten, Migranten rigoros abzuschieben."
12,1,"Welche Gruppen plant Donald Trump vorrangig abzuschieben nach seiner Ankündigung, die größte Abschiebungsaktion zu starten?",Donald Trump plant vorrangig die Abschiebung von illegal eingewanderten Straftätern zu beginnen.,Fake Fact,"Donald Trump plant vorrangig, illegal eingewanderte Straftäter abzuschieben, wenn er die größte Abschiebungsaktion in der Geschichte der USA startet. Dies soll jedoch nur der Anfang sein, da er beabsichtigt, die Abschiebungen nicht auf diese Gruppe zu beschränken.","Der bereitgestellte Kontext enthält keine spezifischen Informationen darüber, welche Gruppen Donald Trump vorrangig abzuschieben plant. Daher kann ich auf Basis des gegebenen Kontextes keine Antwort auf diese Frage geben."
12,2,Welche Position wird Stephen Miller in der kommenden Regierung einnehmen und welche Rolle spielt er im Kontext der Einwanderungspolitik?,Stephen Miller soll stellvertretender Stabschef im Weißen Haus werden und gilt als geistiger Architekt von Trumps Anti-Einwanderungspolitik.,Framing,"Stephen Miller wird in der kommenden Regierung die Position des stellvertretenden Stabschefs im Weißen Haus einnehmen. In Bezug auf die Einwanderungspolitik spielt er eine zentrale Rolle als Hardliner. Er war bereits in Trumps erster Amtszeit ein ranghoher Berater und gilt als geistiger Architekt der Anti-Einwanderungspolitik, einschließlich des umstrittenen Einreiseverbots für Menschen aus mehreren muslimischen Ländern und der Trennung von Eltern und Kindern zur Abschreckung von Migranten. Miller hat zudem ein Konzept für Massendeportationen ausgearbeitet und ist bekannt für seine strikte Haltung, dass ""Amerika für Amerikaner – und NUR für Amerikaner"" sei.","Stephen Miller wird in der kommenden Regierung die Position des stellvertretenden Stabschefs im Weißen Haus einnehmen. Im Kontext der Einwanderungspolitik spielt er eine bedeutende Rolle, da er als der geistige Architekt von Trumps Anti-Einwanderungspolitik beschrieben wird. Diese Politik umfasst unter anderem ein hochumstrittenes Einreiseverbot für Menschen aus muslimischen Ländern sowie die Trennung von Eltern und Kindern."
12,3,"Welche finanziellen Herausforderungen werden durch das geplante Abschiebeprogramm entstehen, und wie gedenkt Trump diese zu bewältigen?","Das Abschiebeprogramm wird geschätzt, mehr als 88 Milliarden Dollar pro Jahr zu kosten. Trump plant, Gelder aus anderen Regierungsprogrammen umzuschichten, um die Kosten zu decken, obwohl dies nicht ausreichen wird.",Exaggeration,"Die finanziellen Herausforderungen des geplanten Abschiebeprogramms von Donald Trump hängen maßgeblich von den verfügbaren finanziellen Mitteln ab. Die Politikprofessorin im Kontext erklärt, dass das Ausmaß des Programms vor allem vom Geld abhängen wird. Der US-Kongress spielt hierbei eine entscheidende Rolle, da er die Ausgaben für das Programm teilweise genehmigen muss. Es bleibt abzuwarten, wie viel Geld der Kongress tatsächlich bereit ist, für dieses Vorhaben auszugeben. Trumps Strategie zur Bewältigung dieser finanziellen Herausforderungen ist nicht explizit im Kontext beschrieben, aber es wird deutlich, dass die Finanzierung eine zentrale Hürde darstellt, die es zu überwinden gilt.",Der bereitgestellte Kontext enthält keine Informationen über ein geplantes Abschiebeprogramm oder die damit verbundenen finanziellen Herausforderungen. Daher kann ich keine Antwort auf diese Frage geben.
13,1,Welche Universität hat Scott Bessent besucht?,Scott Bessent hat die Eliteuniversität Yale besucht.,Fake Fact,Scott Bessent hat die Eliteuniversität Yale besucht.,Scott Bessent hat die Yale Universität besucht.
13,2,"In welcher Position diente Pam Bondi, bevor sie für das Amt des Justizministers nominiert wurde?",Pam Bondi diente zwei Amtsperioden lang als Floridas Erste Generalstaatsanwältin.,Framing,Pam Bondi diente vor ihrer Nominierung für das Amt des Justizministers als Floridas Erste Generalstaatsanwältin. Sie hatte dieses Amt über zwei Amtsperioden hinweg inne.,"Pam Bondi diente als Floridas Erste Generalstaatsanwältin, bevor sie für das Amt des Justizministers nominiert wurde."
13,3,Welche Rolle übernimmt Karoline Leavitt in der neuen Administration von Trump?,Karoline Leavitt wird die Pressesprecherin des Weißen Hauses.,Exaggeration,"Karoline Leavitt übernimmt in der neuen Administration von Donald Trump die Rolle der Pressesprecherin des Weißen Hauses. Trump hat sie für diesen Posten nominiert und beschreibt sie als klug, zäh und effektiv. Leavitt bringt bereits Erfahrung aus Trumps erster Amtszeit mit und wird als eines der prägenden Gesichter der neuen Administration angesehen.",Karoline Leavitt übernimmt in der neuen Administration von Trump die Rolle der Pressesprecherin des Weißen Hauses.
14,1,Welche Rolle wird Brendan Carr in der US-Medienaufsichtsbehörde FCC gemäß dem Willen des designierten US-Präsidenten Donald Trump einnehmen?,Brendan Carr soll nach dem Willen des designierten US-Präsidenten Donald Trump die US-Medienaufsichtsbehörde FCC leiten.,Fake Fact,Brendan Carr soll nach dem Willen des designierten US-Präsidenten Donald Trump die Leitung der US-Medienaufsichtsbehörde FCC übernehmen.,Brendan Carr wurde von Donald Trump als Chef der US-Medienaufsichtsbehörde FCC nominiert.
14,2,"Welche Technologieunternehmen kritisiert Brendan Carr im Kontext des sogenannten ""Zensurkartells""?","Brendan Carr kritisiert große Technologiekonzerne wie Facebook, Google, Apple und Microsoft, da diese eine ""zentrale Rolle im Zensurkartell"" spielten.",Framing,"Brendan Carr kritisiert im Kontext des sogenannten ""Zensurkartells"" die großen Technologiekonzerne Facebook, Google, Apple und Microsoft.","Im Kontext des sogenannten ""Zensurkartells"" kritisiert Brendan Carr die Technologieunternehmen Facebook, Apple, Microsoft und Google."
14,3,Welche Maßnahmen hat Carr laut FCC zur Modernisierung der Infrastruktur und zum Ausbau der Hochgeschwindigkeitsnetze beigetragen?,"Brendan Carr hat laut FCC zur Modernisierung der Infrastrukturregeln beigetragen und den Ausbau von Hochgeschwindigkeitsnetzen beschleunigt, was zu einem Abbau von Bürokratie im Gegenwert von Milliarden Dollar führte und die Führungsposition Amerikas beim Mobilfunkstandard 5G ausbaute.",Exaggeration,Laut der FCC-Webseite hat Brendan Carr zur Modernisierung der Infrastrukturregeln beigetragen und den Ausbau von Hochgeschwindigkeitsnetzen beschleunigt. Seine Reformen führten zu einem Abbau von Bürokratie im Gegenwert von Milliarden Dollar und stärkten die weltweite Führungsposition Amerikas beim Mobilfunkstandard 5G.,"Carr hat zur Modernisierung der Infrastrukturregeln beigetragen und den Ausbau von Hochgeschwindigkeitsnetzen beschleunigt. Diese Maßnahmen zielen darauf ab, die Infrastruktur effizienter zu gestalten und den Zugang zu schnellen Netzwerken zu verbessern."
15,1,Aus welchem Bundesstaat stammt Karoline Leavitt?,Karoline Leavitt stammt aus dem Bundesstaat New Hampshire.,Fake Fact,"Der bereitgestellte Kontext enthält keine Informationen darüber, aus welchem Bundesstaat Karoline Leavitt stammt.",Karoline Leavitt stammt aus dem Bundesstaat New Hampshire.
15,2,Wie wurde die Aussetzung der Pressebriefings während Trumps erster Amtszeit im Originalartikel beschrieben?,"Im Originalartikel wird beschrieben, dass in Trumps erster Amtszeit zeitweise keine Pressebriefings des Weißen Hauses stattfanden, und eine damalige Sprecherin, Stephanie Grisham, den Posten verließ, ohne ein einziges Pressebriefing gegeben zu haben.",Framing,"Während Trumps erster Amtszeit war es unüblich, dass es regelmäßig Pressebriefings des Weißen Hauses gab. Zeitweise fanden diese gar nicht statt. Eine der Sprecherinnen, Stephanie Grisham, verließ ihren Posten nach mehreren Monaten, ohne ein einziges Pressebriefing abgehalten zu haben.",Der bereitgestellte Kontext enthält keine Informationen über die Aussetzung der Pressebriefings während Trumps erster Amtszeit. Daher kann ich keine Antwort auf diese Frage geben.
15,3,Welche Position soll Karoline Leavitt im Weißen Haus übernehmen?,Karoline Leavitt soll die Position der Pressesprecherin des Weißen Hauses übernehmen.,Exaggeration,"Karoline Leavitt soll die Position der Pressesprecherin des Weißen Hauses übernehmen. Donald Trump hat sie für diesen Posten nominiert und äußerte sein volles Vertrauen in ihre Fähigkeiten, die Botschaft ""Make America Great Again"" effektiv an das amerikanische Volk zu übermitteln.",Karoline Leavitt soll die Position der Pressesprecherin des Weißen Hauses übernehmen.
16,1,Welche Einschätzung gab Chris Wright in einem Video auf LinkedIn zur Klimakrise ab?,"Chris Wright sagte in einem Video auf LinkedIn, dass „es keine Klimakrise gibt, und wir uns bei der Energie auch nicht in einem Umbruch befinden“.",Fake Fact,"Chris Wright äußerte in einem Video auf LinkedIn die Einschätzung, dass es keine Klimakrise gebe und dass sich die Energiebranche nicht in einem Umbruch befinde. Diese Aussage steht im Widerspruch zu anerkannten Forschungsergebnissen, die eine Klimakrise bestätigen.","Chris Wright äußerte in einem Video auf LinkedIn die Einschätzung, dass es keine Klimakrise gibt und dass wir uns bei der Energie nicht in einem Umbruch befinden."
16,2,Wie verglich Chris Wright den Kampf der Demokraten gegen die globale Erwärmung?,Chris Wright verglich den Kampf der Demokraten gegen die globale Erwärmung mit dem Sowjet-Kommunismus.,Framing,Chris Wright verglich den Kampf der Demokraten gegen die globale Erwärmung mit dem Sowjet-Kommunismus.,Chris Wright verglich den Kampf der Demokraten gegen die globale Erwärmung mit dem Sowjet-Kommunismus.
16,3,"Welche Risiken sind mit der Fracking-Methode verbunden, die von Umweltschützern hervorgehoben werden?","Die Fracking-Methode ist aufgrund der hohen Risiken, die mit ihr verbunden sind, bei einigen Umweltschützern stark umstritten.",Exaggeration,"Die Fracking-Methode ist mit hohen Risiken verbunden, die von Umweltschützern hervorgehoben werden. Diese Bedenken beziehen sich auf die Umweltauswirkungen der Methode, bei der ein Bohrer tief in die Erde gerammt wird und eine Mischung aus Wasser, Sand und Chemikalien in die Gesteinsschichten gepresst wird. Diese Prozedur führt dazu, dass die Gesteinsschichten aufgebrochen werden, um im Gestein gebundenes Gas freizusetzen. Die Risiken, die Umweltschützer anführen, betreffen vor allem die potenziellen negativen Auswirkungen auf die Umwelt, die durch den Einsatz von Chemikalien und die Veränderung der geologischen Strukturen entstehen können.",Der bereitgestellte Kontext enthält keine spezifischen Informationen über die von Umweltschützern hervorgehobenen Risiken der Fracking-Methode. Daher kann ich auf Basis des gegebenen Kontexts keine Antwort zu den Risiken formulieren.
17,1,Welche konkrete Maßnahme in der Gesundheitspolitik hat Trump für Robert F. Kennedy angekündigt?,"Trump hat angekündigt, Robert F. Kennedy Jr. mit der Verbesserung der Kindergesundheit zu betrauen.",Fake Fact,"Donald Trump hat angekündigt, dass Robert F. Kennedy Jr. eine wichtige Rolle in der Gesundheitspolitik spielen soll, indem er als Gesundheitsminister in der künftigen US-Regierung die ""Epidemie chronischer Krankheiten"" beenden und Amerika wieder gesund machen soll. Trump hat jedoch keine konkreten Maßnahmen oder Pläne genannt, wie dieses Ziel erreicht werden soll.","Trump hat angekündigt, dass Robert F. Kennedy Jr. als Gesundheitsminister nominiert wird."
17,2,Welche Themen vertreten Robert F. Kennedy laut dem Originalartikel häufig in seinen Aussagen?,"Robert F. Kennedy äußert häufig die Meinung, dass Impfstoffe gegen Covid-19 gefährlich seien und bei Kindern zu Autismus führen könnten, und er glaubt, dass Antidepressiva und WLAN negative Auswirkungen haben.",Framing,"Robert F. Kennedy Jr. hat in seinen Aussagen häufig Themen wie die Ablehnung von Impfungen und Verschwörungstheorien vertreten. Während der Corona-Pandemie machte er durch seine kritische Haltung gegenüber Impfungen auf sich aufmerksam. Zudem hat er angekündigt, dass er, im Falle einer politischen Position, eine Abkehr vom flächendeckenden Einsatz von Pestiziden in der Landwirtschaft anstreben würde, um die Gesundheit der Amerikaner zu verbessern.","Robert F. Kennedy vertritt häufig Themen im Bereich der Gesundheitspolitik. Er hat das Ziel angekündigt, die Amerikaner gesünder zu machen, und schlägt eine Abkehr vom flächendeckenden Einsatz von Pestiziden in der Landwirtschaft vor. Zudem hat er sich gegen Impfungen ausgesprochen und Verschwörungstheorien verbreitet."
17,3,Welche Position soll Doug Burgum in Trumps zukünftiger Regierungsmannschaft übernehmen?,Doug Burgum soll Innenminister im Kabinett von Trumps zukünftiger Regierungsmannschaft werden.,Exaggeration,Doug Burgum soll in Trumps zukünftiger Regierungsmannschaft die Position des Innenministers übernehmen. Dies wurde von Donald Trump auf einer Gala in seinem Anwesen Mar-a-Lago angekündigt.,Doug Burgum soll in Trumps zukünftiger Regierungsmannschaft die Position des Innenministers übernehmen.
18,1,Wen ernannte Donald Trump als Stabschefin im Weißen Haus in seiner ersten Personalentscheidung nach dem Wahlsieg?,Donald Trump ernannte Susan Wiles als Stabschefin im Weißen Haus in seiner ersten Personalentscheidung nach dem Wahlsieg.,Fake Fact,"Donald Trump ernannte Susan Wiles als Stabschefin im Weißen Haus in seiner ersten Personalentscheidung nach dem Wahlsieg. Wiles ist eine erfahrene republikanische Strategin und enge Vertraute von Trump, die bereits mehrere Wahlkämpfe für ihn geleitet hat. Sie ist die erste Frau, die diesen wichtigen Posten in der Geschichte des Landes übernimmt.",Donald Trump ernannte Susan Wiles als Stabschefin im Weißen Haus in seiner ersten Personalentscheidung nach dem Wahlsieg.
18,2,Wie wird Susan Wiles in Bezug auf ihre Arbeit im Wahlkampf beschrieben?,"Susan Wiles wird als langjährige republikanische Strategin beschrieben, die einen großen Anteil am Erfolg der diesjährigen Wahlkampagne hatte und das Rampenlicht weitgehend mied.",Framing,"Susan Wiles wird in Bezug auf ihre Arbeit im Wahlkampf als eine langjährige republikanische Strategin beschrieben, die einen großen Anteil am Erfolg der Wahlkampagne hat. Sie leitete Trumps Wahlkampf in Florida sowohl 2016 als auch 2020 und wird als zäh, klug und innovativ charakterisiert. Trotz ihrer bedeutenden Rolle mied sie weitgehend das Rampenlicht und weigerte sich, auf der Bühne von Trumps Wahlfeier zu sprechen. Trump bezeichnete sie in seiner Siegesrede als ""ice maiden"" (Eisprinzessin), was auf ihre professionelle und zurückhaltende Art hinweist.","Susan Wiles wird in Bezug auf ihre Arbeit im Wahlkampf als jemand beschrieben, der mehrere Wahlkampagnen geleitet hat, einschließlich der Kampagnen von Donald Trump in den Jahren 2016 und 2020. Sie hat zum Erfolg der diesjährigen Kampagne beigetragen, hat jedoch das Rampenlicht vermieden und sich geweigert, bei Trumps Siegesfeier auf der Bühne zu sprechen."
18,3,Welche Rolle hat das Amt der Stabschefin im Weißen Haus?,"Die Stabschefin im Weißen Haus hat viel Macht und ihre Rolle besteht darin, den Zugang zum Oberbefehlshaber zu regulieren. Es ist eine Schlüsselposition für jede Regierung.",Exaggeration,"Das Amt der Stabschefin im Weißen Haus ist eine Position mit erheblicher Macht und Verantwortung. Die Hauptaufgabe der Stabschefin besteht darin, den Zugang zum Präsidenten, der auch als Oberbefehlshaber bezeichnet wird, zu regulieren. Dies macht die Rolle zu einer der Schlüsselpositionen in jeder Regierung. Die Stabschefin hat somit einen wesentlichen Einfluss auf die Abläufe und die Entscheidungsfindung im Weißen Haus.","Das Amt der Stabschefin im Weißen Haus hat mehrere wichtige Rollen und Merkmale. Es ist eine Schlüsselposition für jede Regierung und hat viel Macht. Die Hauptaufgabe der Stabschefin besteht darin, den Zugang zum Oberbefehlshaber zu regulieren. Die Position ist im Weißen Haus angesiedelt, was ihre zentrale Bedeutung innerhalb der Regierung unterstreicht."
19,1,"Wie hoch sind die Herstellungskosten der beiden US-Großmeiler in Georgia, die derzeit gebaut werden?",Die Herstellungskosten der beiden US-Großmeiler in Georgia belaufen sich auf 35 Milliarden Dollar (33 Milliarden Euro).,Fake Fact,"Die Herstellungskosten der beiden US-Großmeiler, die derzeit in Georgia gebaut werden, belaufen sich auf 35 Milliarden Dollar, was umgerechnet 33 Milliarden Euro entspricht.","Die Herstellungskosten der beiden US-Großmeiler in Georgia, die derzeit gebaut werden, belaufen sich auf 35 Milliarden Dollar (33 Milliarden Euro)."
19,2,"Welche Haltung hat Donald Trump zu den ""Small Modular Reactors"" (SMR) in Bezug auf die Energiewende?","Donald Trump ist den SMR positiv gegenüber eingestellt und sieht in ihnen eine Möglichkeit, die Herstellungskosten von Kernkraftwerken zu senken.",Framing,"Donald Trump zeigt sich den ""Small Modular Reactors"" (SMR) gegenüber positiv gestimmt. Er sieht in ihnen eine Möglichkeit, die Atompolitik der USA zu überprüfen und die Branche wiederzubeleben. Trump ist angetan von den Vorteilen der SMR, insbesondere ihrer Fähigkeit, die Herstellungskosten im Vergleich zu den teuren Großmeilern zu senken. Er erkennt den Trend, dass in atomkraftfreundlichen Ländern wie Frankreich verstärkt kleinere Kraftwerke gebaut werden, und sieht darin eine sinnvolle Alternative zu den kostspieligen Großprojekten in den USA.","Der bereitgestellte Kontext enthält keine Informationen über Donald Trumps Haltung zu ""Small Modular Reactors"" (SMR) in Bezug auf die Energiewende. Daher kann keine faktenbasierte Antwort zu dieser spezifischen Frage gegeben werden."
19,3,Wie hat sich die gesellschaftliche Akzeptanz für den Ausbau der Kernenergie in den USA seit 2016 entwickelt?,"Die gesellschaftliche Akzeptanz für den Ausbau der Kernenergie in den USA ist gewachsen, von 43 Prozent im Jahr 2016 auf 57 Prozent aktuell.",Exaggeration,"Die gesellschaftliche Akzeptanz für den Ausbau der Kernenergie in den USA hat sich seit 2016 deutlich erhöht. Im Jahr 2016 befürworteten 43 Prozent der Amerikaner den Ausbau der Kernenergie. Aktuell sind es 57 Prozent, die den Ausbau unterstützen. Dies zeigt einen signifikanten Anstieg der Unterstützung in der Bevölkerung.","Der bereitgestellte Kontext enthält keine spezifischen Informationen zur Entwicklung der gesellschaftlichen Akzeptanz für den Ausbau der Kernenergie in den USA seit 2016. Es wird lediglich erwähnt, dass Trump die Kernenergie unterstützt. Weitere Details zur gesellschaftlichen Akzeptanz oder deren Veränderung über die Jahre sind im Kontext nicht vorhanden."
1,1,Wie viel Geld versprach Präsident Biden für den Schutz des Amazonas-Regenwaldes?,Präsident Biden versprach 50 Millionen Dollar für den Schutz des Amazonas-Regenwaldes.,Fake Fact,Präsident Biden versprach 50 Millionen Dollar für den Schutz des Amazonas-Regenwaldes.,Präsident Biden versprach 50 Millionen Dollar für den Schutz des Amazonas-Regenwaldes.
1,2,Wie bezeichnete Donald Trump in seiner Wahlkampagne den Klimawandel?,Donald Trump bezeichnete in seiner Wahlkampagne den Klimawandel als einen großen Schwindel.,Framing,"Donald Trump verharmloste in seiner Wahlkampagne den Klimawandel, indem er wissenschaftliche Ergebnisse darüber als Blödsinn darstellte.","In seiner Wahlkampagne bezeichnete Donald Trump den Klimawandel als ""großen Schwindel""."
