artikel_id,frage_nr,frage,musterloesung,fake_news_art,vector_rag_antwort_original_2,graph_rag_antwort_original_2
76,3,Wie würde sich die Situation der deutschen Automobilindustrie unter einem Präsidenten Trump gemäß dem Experten Stefan Bratzel voraussichtlich verändern?,"Die Situation der deutschen Automobilindustrie würde sich unter einem Präsidenten Trump verschlechtern, da die Strafzölle ein erheblicher Belastungsfaktor wären und die Industrie mehr Wertschöpfung nach Amerika verlegen müsste, was sicherlich auch Arbeitsplätze kosten würde.",Exaggeration,"Laut dem Automobilexperten Stefan Bratzel würde sich die Situation der deutschen Automobilindustrie unter einem Präsidenten Donald Trump voraussichtlich deutlich verschlechtern. Ein wesentlicher Grund dafür wären die von Trump angedrohten Strafzölle, die einen erheblichen Belastungsfaktor darstellen würden. Diese Zölle könnten dazu führen, dass die deutsche Automobilindustrie gezwungen wäre, noch mehr Wertschöpfung nach Amerika zu verlagern. Dies könnte wiederum Arbeitsplätze in Deutschland kosten, insbesondere in einer Zeit, in der die Branche ohnehin schon mit Problemen zu kämpfen hat.","Laut dem bereitgestellten Kontext würde sich die Situation der deutschen Automobilindustrie unter einem Präsidenten Trump voraussichtlich negativ verändern. Donald Trump hat einen Einfluss auf die deutsche Automobilindustrie und droht deutschen Unternehmen, zu denen auch Automobilbauer gehören. Die deutsche Automobilindustrie sieht sich mit der Möglichkeit von Strafzöllen konfrontiert, was negative Folgen für die Unternehmen befürchten lässt. Diese Situation könnte dazu führen, dass die deutsche Automobilindustrie in Erwägung zieht, Arbeitsplätze zu verlieren oder Teile ihrer Produktion nach Amerika zu verlagern. Da Stefan Bratzel als Experte im Bereich Automobile gilt, könnte er diese potenziellen Entwicklungen als problematisch für die deutsche Automobilindustrie einschätzen."
77,1,Welche Steuerpolitik verfolgen Harris und Trump bezüglich Trinkgeld?,"Beide Präsidentschaftskandidaten, Harris und Trump, sind sich einig, keine Steuern auf Trinkgeld zu erheben.",Fake Fact,"Beide Präsidentschaftskandidaten, Kamala Harris und Donald Trump, verfolgen die gleiche Steuerpolitik in Bezug auf Trinkgeld: Sie wollen keine Steuern auf Trinkgeld erheben. Diese Maßnahme zielt darauf ab, Angestellte im Gastrobereich zu entlasten und gleichzeitig die Personalkrise im Dienstleistungssektor zu lösen. Donald Trump hatte diese Idee zuerst, und Kamala Harris folgte ihm wenig später mit demselben Vorschlag.",Der bereitgestellte Kontext enthält keine Informationen über die Steuerpolitik von Harris und Trump bezüglich Trinkgeld.
77,2,Was sind die wirtschaftlichen Prioritäten von Kamala Harris in ihrer Politik?,"Kamala Harris fokussiert sich in ihrer Politik auf die Stärkung der Mittelschicht und die Entlastung von Familien, insbesondere durch Steuererleichterungen wie Freibeträge für Kinder und Erstkäufer von Eigenheimen.",Framing,"Die wirtschaftlichen Prioritäten von Kamala Harris in ihrer Politik umfassen mehrere zentrale Aspekte. Erstens plant sie, Unternehmen und Besserverdienende stärker zu besteuern, um geplante Subventionen zu finanzieren, obwohl Experten bezweifeln, dass dies ausreichen wird. Zweitens legt sie einen besonderen Fokus auf kleine Betriebe, indem sie Startups Steuervergünstigungen von 50.000 Dollar gewähren möchte, da sie diese als das Rückgrat der amerikanischen Wirtschaft betrachtet. Darüber hinaus setzt Harris in der Energiepolitik den Kurs von Biden fort, indem sie den Übergang von Öl und Gas hin zu neuen klimafreundlichen Technologien, wie zum Beispiel Elektroautos, unterstützt.","Basierend auf dem bereitgestellten Kontext sind die wirtschaftlichen Prioritäten von Kamala Harris in ihrer Politik die Unterstützung von Reformen der internationalen Finanzarchitektur. Es gibt keine weiteren spezifischen wirtschaftlichen Prioritäten im Kontext, die erwähnt werden."
77,3,Wie bewerten Ökonomen Trumps wirtschaftliche Pläne bezüglich der Auswirkungen auf das Staatsdefizit?,"Ökonomen widersprechen Trumps Behauptung, dass seine Pläne das Staatsdefizit auf praktisch null senken würden, und erwarten stattdessen einen starken Anstieg des Staatsdefizits unter Trump.",Exaggeration,"Ökonomen bewerten Trumps wirtschaftliche Pläne hinsichtlich der Auswirkungen auf das Staatsdefizit äußerst kritisch. Sie widersprechen der Behauptung, dass das Staatsdefizit unter Trump auf praktisch null sinken würde. Stattdessen rechnen sie mit einem starken Anstieg des Staatsdefizits unter seiner Führung. Diese Einschätzung basiert auf Trumps Überlegungen, stärkeren Einfluss auf die US-Notenbank auszuüben, Migranten rigoros abzuschieben und höhere Einfuhrzölle zu erheben, was zu Vergeltungszöllen und damit zu massiven Preisanstiegen und höheren Zinsen in den USA führen könnte. Im Vergleich dazu erwarten Ökonomen, dass das Staatsdefizit unter Harris ebenfalls wachsen würde, jedoch deutlich geringer als unter Trump.","Ökonomen äußern Bedenken hinsichtlich der wirtschaftlichen Pläne von Trump, insbesondere in Bezug auf die Auswirkungen auf das Staatsdefizit. Sie kritisieren Trumps Strategien, die unter anderem die Senkung der Steuern für Unternehmen und Superreiche sowie die Abschaffung der Einkommenssteuer umfassen. Diese Maßnahmen könnten das Staatsdefizit weiter erhöhen. Zudem warnen Ökonomen vor den wirtschaftlichen Konsequenzen der Abschiebung von Millionen Migranten, die ebenfalls Teil von Trumps Plänen sind. Insgesamt sind sich die Ökonomen sicher, dass Trumps Wirtschaftspolitik der Wirtschaft massiv schaden könnte, was impliziert, dass sie negative Auswirkungen auf das Staatsdefizit befürchten."
78,1,Welche Bedingungen stellt Donald Trump für ausländische Unternehmen in den USA in Bezug auf Steuervorteile und Zölle?,"Donald Trump stellt die Bedingung, dass ausländische Unternehmen in den USA produzieren und US-Amerikaner anstellen müssen, um von Steuervorteilen wie den niedrigsten Steuern, niedrigen Energiekosten und geringen Regulierungslasten zu profitieren. Andernfalls drohen hohe Einfuhrzölle.",Fake Fact,"Donald Trump stellt ausländischen Unternehmen in den USA die Bedingung, dass sie Werke im Land errichten müssen, um von Steuervorteilen zu profitieren. Falls sie dies nicht tun, droht er mit hohen Einfuhrzöllen. Insbesondere plant er, eine Abgabe von zehn bis 20 Prozent auf alle Warenimporte zu erheben, um die heimische Wirtschaft zu schützen. Für Güter aus China könnte diese Abgabe sogar 60 Prozent betragen.","Donald Trump stellt ausländischen Unternehmen in den USA die Bedingung, Werke in den USA zu errichten, um von Steuervorteilen zu profitieren. Gleichzeitig sind ausländische Unternehmen Zöllen unterworfen, was bedeutet, dass sie hohe Einfuhrzölle zahlen müssen. Diese Maßnahmen sind Teil von Trumps Politik, die darauf abzielt, ausländische Wettbewerber zu benachteiligen und die heimische Wirtschaft zu stärken."
78,2,"Welche Behauptung zu Deutschland wiederholte Trump in Bezug auf Kohlekraftwerke, und wie reagierte das Auswärtige Amt darauf?","Trump wiederholte die falsche Behauptung, Deutschland sei dazu übergegangen, Kohlekraftwerke zu bauen, nachdem es aus fossilen Brennstoffen nicht erfolgreich ausgestiegen ist. Das Auswärtige Amt reagierte mit der Klarstellung, dass das deutsche Energiesystem funktionsfähig sei und dass Deutschland Kohle- und Atomkraftwerke abschalte, nicht baue.",Framing,"Trump wiederholte die Falschbehauptung, dass Deutschland nach einem gescheiterten Ausstieg aus fossilen Brennstoffen wieder dazu übergegangen sei, Kohlekraftwerke zu bauen. Er behauptete, dass nach dem Austausch von Angela Merkel durch Olaf Scholz nun jede Woche ein neues Kohlekraftwerk in Deutschland gebaut werde. Das Auswärtige Amt reagierte darauf, indem es auf der Plattform X klarstellte, dass das deutsche Energiesystem voll funktionsfähig sei und mehr als 50 Prozent erneuerbare Energien nutze. Zudem betonte das Auswärtige Amt, dass Deutschland Kohle- und Atomkraftwerke abschalte, anstatt neue zu bauen, und dass spätestens 2038 die Kohle vom Netz sein werde.","Trump behauptete, dass Scholz jede Woche neue Kohlekraftwerke baut und dass Deutschland nach einem gescheiterten Ausstieg aus fossilen Brennstoffen wieder dazu übergegangen sei, Kohlekraftwerke zu bauen. Das Auswärtige Amt reagierte darauf auf der Plattform X."
78,3,Wie ist der aktuelle Zustand des deutschen Energiesystems laut dem Auswärtigen Amt?,"Das Auswärtige Amt erklärte, dass das deutsche Energiesystem voll funktionsfähig sei, mit mehr als 50 Prozent erneuerbarer Energien, und dass Kohle- und Atomkraftwerke abgeschaltet werden, anstatt neue gebaut zu werden. Spätestens bis 2038 soll die Kohleverstromung beendet sein.",Exaggeration,"Laut dem Auswärtigen Amt ist das deutsche Energiesystem voll funktionsfähig und besteht zu mehr als 50 Prozent aus erneuerbaren Energien. Deutschland schaltet Kohle- und Atomkraftwerke ab, anstatt neue zu bauen, und plant, spätestens bis 2038 die Kohle vollständig vom Netz zu nehmen.",Der bereitgestellte Kontext enthält keine Informationen über den aktuellen Zustand des deutschen Energiesystems laut dem Auswärtigen Amt.
79,1,"Welche Argumentation verwendet Donald Trump, um ein Mitspracherecht des US-Präsidenten bei geldpolitischen Entscheidungen der Federal Reserve zu fordern?","Donald Trump argumentiert, dass er aufgrund seines Erfolgs und seines unternehmerischen Instinkts ein besseres Verständnis für Finanzentscheidungen habe als die Personen, die in der Federal Reserve arbeiten, und fordert deshalb ein Mitspracherecht des Präsidenten bei geldpolitischen Entscheidungen.",Fake Fact,"Donald Trump argumentiert, dass der US-Präsident ein Mitspracherecht bei geldpolitischen Entscheidungen der Federal Reserve haben sollte, da er glaubt, dass er aufgrund seines finanziellen Erfolgs und seiner Instinkte besser qualifiziert ist als viele der Personen, die derzeit in der Federal Reserve tätig sind oder deren Vorsitzender sind. Er betont, dass er viel Geld verdient und sehr erfolgreich gewesen sei, was ihm seiner Meinung nach einen besseren Instinkt verleiht.","Donald Trump fordert ein Mitspracherecht des US-Präsidenten bei geldpolitischen Entscheidungen der Federal Reserve, indem er auf die Möglichkeit hinweist, dass das föderale Budget um mindestens zwei Billionen Dollar reduziert werden kann. Diese Argumentation impliziert, dass durch eine stärkere Einbindung des Präsidenten in die geldpolitischen Entscheidungen erhebliche Einsparungen im föderalen Budget erzielt werden könnten."
79,2,"Wie hat sich Donald Trump in der Vergangenheit zur Geldpolitik geäußert, insbesondere in Bezug auf die Entscheidungen der Federal Reserve?","Trump hat mehrfach seine Frustration über den begrenzten Einfluss der Administration auf die Geldpolitik zum Ausdruck gebracht und den Notenbankchef Jerome Powell dafür kritisiert, dass Zinsentscheidungen entweder „ein klein bisschen zu früh und ein klein bisschen zu spät“ getroffen werden.",Framing,"Donald Trump hat in der Vergangenheit gefordert, dass US-Präsidenten in Entscheidungen der amerikanischen Notenbank Federal Reserve (Fed) einbezogen werden sollten. Er äußerte, dass der Präsident zumindest ein Mitspracherecht haben sollte. Trump begründete dies mit seinem eigenen Erfolg und Instinkt, den er als besser einschätzt als den der Personen in der Federal Reserve oder des Vorsitzenden. Zudem deuteten seine Äußerungen darauf hin, dass er bei Zinsentscheidungen konsultiert werden möchte und dass Vorschläge zur Bankenregulierung vom Weißen Haus geprüft werden sollten.","Donald Trump hat in der Vergangenheit den Wunsch geäußert, Mitspracherecht bei geldpolitischen Entscheidungen zu haben. Er hat explizit um Einbeziehung in die Entscheidungen der Federal Reserve, auch bekannt als Fed, gebeten. Dies deutet darauf hin, dass er ein Interesse daran hat, Einfluss auf die Geldpolitik der USA zu nehmen."
79,3,Welche konkreten wirtschaftlichen Folgen können politische Eingriffe in die Unabhängigkeit der Federal Reserve laut dem Artikel haben?,"Politische Eingriffe könnten tendenziell zu nachhaltig niedrigeren Zinsniveaus führen, was eine stärkere Geldentwertung nach sich ziehen und die Position des US-Dollars als Weltreservewährung schwächen würde.",Exaggeration,"Politische Eingriffe in die Unabhängigkeit der Federal Reserve können zu einem Zielkonflikt zwischen der Zinspolitik der Notenbank und den wirtschaftspolitischen Zielen der Regierung führen. Während die Notenbank möglicherweise höhere Zinsen beibehält, um die Inflation zu bekämpfen, könnte die Regierung an einer boomenden Konjunktur und niedrigen Arbeitslosenzahlen interessiert sein. Solche Eingriffe könnten daher die Fähigkeit der Notenbank beeinträchtigen, die Inflation effektiv zu kontrollieren, was langfristig negative wirtschaftliche Folgen haben könnte.",Der bereitgestellte Kontext enthält keine spezifischen Informationen über die wirtschaftlichen Folgen politischer Eingriffe in die Unabhängigkeit der Federal Reserve. Daher kann ich auf Basis des gegebenen Kontextes keine Antwort auf die Frage formulieren.
7,1,Was hat der britische Außenminister David Lammy im Jahr 2019 über Donald Trump getwittert?,"Der britische Außenminister David Lammy twitterte im Jahr 2019 über Donald Trump: ""Unehrlich, verblendet, ausländerfeindlich, narzisstisch - Donald Trump ist kein Freund von Großbritannien.""",Fake Fact,"Im Jahr 2019 hat der britische Außenminister David Lammy über Donald Trump getwittert, dass er ihn als ""unehrlich, verblendet, ausländerfeindlich, narzisstisch"" bezeichnete und feststellte, dass Trump kein Freund von Großbritannien sei.","Der bereitgestellte Kontext enthält keine Informationen darüber, was der britische Außenminister David Lammy im Jahr 2019 über Donald Trump getwittert hat."
7,2,Wie wurde Donald Trumps Verhalten während des Abendessens mit David Lammy und Keir Starmer beschrieben?,"Während des Abendessens mit David Lammy und Keir Starmer wurde Donald Trumps Verhalten als großzügig, sehr freundlich, darum bemüht beschrieben, dass es den Gästen gut ging, witzig, Großbritannien zugewandt und schwärmend von der Königsfamilie.",Framing,"Während des Abendessens mit David Lammy und Keir Starmer wurde Donald Trumps Verhalten als großzügig, sehr freundlich und bemüht beschrieben, dass es den Gästen gut geht. Er wurde auch als witzig und Großbritannien zugewandt charakterisiert und schwärmte von der Königsfamilie.","Der bereitgestellte Kontext enthält keine spezifische Beschreibung von Donald Trumps Verhalten während des Abendessens mit David Lammy und Keir Starmer. Es wird lediglich erwähnt, dass Trump mit beiden zu Abend gegessen hat, aber keine Details zu seinem Verhalten während dieses Treffens sind im Kontext enthalten."
7,3,"Welche Verteidigungsausgaben plant die Labour-Regierung, um das NATO-Ziel zu übertreffen?","Die Labour-Regierung plant die Verteidigungsausgaben auf 2,5 Prozent der jährlichen Wirtschaftsleistung auszuweiten, um das NATO-Ziel von 2 Prozent zu übertreffen.",Exaggeration,"Die Labour-Regierung plant, die Verteidigungsausgaben auf 2,5 Prozent der jährlichen Wirtschaftsleistung zu erhöhen, um das NATO-Ziel von zwei Prozent zu übertreffen.","Die Labour-Regierung plant, die Verteidigungsausgaben zu erhöhen, um das NATO-Ziel von zwei Prozent der jährlichen Wirtschaftsleistung zu übertreffen."
80,1,"Wie viel Geld hat Elon Musk angekündigt, täglich bis zur Wahl an einen registrierten Wähler zu vergeben?","Elon Musk hat angekündigt, täglich eine Million Dollar an einen registrierten Wähler zu vergeben.",Fake Fact,"Elon Musk hat angekündigt, täglich eine Million Dollar an einen registrierten Wähler zu vergeben, bis zur Wahl.","Elon Musk hat angekündigt, eine Million Dollar an einen registrierten Wähler in besonders hart umkämpften US-Bundesstaaten zu vergeben."
80,2,"Wie beurteilt Rechtsprofessor Rick Hasen die Tatsache, dass nur registrierte Wähler an der Aktion teilnehmen können?","Rechtsprofessor Rick Hasen sieht ein Problem darin, dass nur registrierte Wähler an der Aktion teilnehmen können, da dies als Anreiz zur Registrierung interpretiert werden könnte.",Framing,"Rechtsprofessor Rick Hasen von der University of California in Los Angeles sieht ein Problem darin, dass nur registrierte Wähler an der Aktion teilnehmen können. Er interpretiert dies so, dass die Gabe des Geldes einen Anreiz zur Registrierung schaffen könnte, was im Widerspruch zum US-Wahlrecht steht, das es verbietet, Bürgern Geld dafür zu zahlen, dass sie sich registrieren oder abstimmen.","Rechtsprofessor Rick Hasen kritisiert die Aktion und argumentiert, dass die Gabe des Geldes einen Anreiz zur Registrierung schaffe."
80,3,Was beabsichtigt Trump mit Elon Musk im Fall seines Wahlsiegs in Bezug auf die Regierungsausgaben?,"Trump hat angedeutet, dass er Elon Musk im Fall seines Wahlsiegs an die Spitze eines Gremiums zur Überprüfung der US-Finanzen setzen könnte, um die Regierungsausgaben zu kürzen.",Exaggeration,"Im Falle eines Wahlsiegs beabsichtigt Trump, Elon Musk an die Spitze eines Gremiums zur Überprüfung der US-Finanzen zu setzen. Musk soll in dieser Rolle die Regierungsausgaben kürzen. Trump hat Musk eine wichtige Rolle in der künftigen Regierung versprochen, und Musk selbst hat geäußert, dass der Bundeshaushalt um ""mindestens zwei Billionen Dollar"" gekürzt werden könnte.","Im Fall seines Wahlsiegs beabsichtigt Trump, Elon Musk mit der Kürzung von Regierungsausgaben zu beauftragen."
81,1,Welche Pläne wurden im jüngsten Werbespot der Kampagne von Kamala Harris und Tim Walz in Bezug auf Donald Trump erwähnt?,"Im jüngsten Werbespot der Kampagne von Kamala Harris und Tim Walz wird vor Donald Trumps ""Project 2025"" gewarnt, einem Plan, der ihm bei einer Rückkehr ins Weiße Haus mehr Macht und Einfluss verschaffen würde.",Fake Fact,"Im jüngsten Werbespot der Kampagne von Kamala Harris und Tim Walz wird vor Donald Trump und seinem sogenannten ""Project 2025"" gewarnt. Dieser Plan wird als radikal beschrieben und soll Trump bei einer möglichen Rückkehr ins Weiße Haus mehr Macht und Einfluss verschaffen.","Der bereitgestellte Kontext enthält keine spezifischen Informationen über Pläne, die im jüngsten Werbespot der Kampagne von Kamala Harris und Tim Walz in Bezug auf Donald Trump erwähnt wurden."
81,2,Was war einer der Auswirkungen des Rückzugs von Joe Biden auf den Wahlkampf der Demokraten?,"Seit Joe Bidens Rückzug von der Kandidatur erlebten die Demokraten eine nie dagewesene Spendenwelle, die über 540 Millionen Dollar in die Kassen spülte.",Framing,"Eine der Auswirkungen des Rückzugs von Joe Biden auf den Wahlkampf der Demokraten war, dass Kamala Harris wenig Zeit hatte, sich bekannt zu machen und die Partei keine ausreichende Gelegenheit hatte, nach Alternativen zu suchen. Dies führte dazu, dass Donald Trump und die Republikaner Harris mühelos mit dem unbeliebten Biden verknüpfen konnten, was ihren Versuch, sich als Kraft der Veränderung zu präsentieren, scheitern ließ.",Der Kontext enthält keine spezifischen Informationen über die Auswirkungen des Rückzugs von Joe Biden auf den Wahlkampf der Demokraten.
81,3,Warum ist persönlicher Kontakt im Wahlkampf wichtiger als Fernsehspots?,"Personalisierte Strategien wie persönlicher Kontakt sind wichtiger als Fernsehspots, weil der persönliche Kontakt als effektiver für die Wählerbindung erkannt wurde.",Exaggeration,"Persönlicher Kontakt ist im Wahlkampf wichtiger als Fernsehspots, weil er eine direktere und individuellere Verbindung zu den potenziellen Wählern ermöglicht. Laut der Politikwissenschaftlerin Kolodny haben Wahlkampfmanager herausgefunden, dass der direkte Kontakt, wie etwa durch Haustürwahlkampf, SMS oder Anrufe, effektiver ist, um Wähler zu erreichen und zu mobilisieren. Diese Methoden erlauben es, gezielt auf die Bedürfnisse und Anliegen der Wähler einzugehen, was bei Fernsehspots, die eine breitere und unpersönlichere Ansprache haben, nicht in gleichem Maße möglich ist.","Im bereitgestellten Kontext wird der persönliche Kontakt als wichtiger im Wahlkampf angesehen als Fernsehspots. Dies könnte darauf hindeuten, dass der direkte Austausch und die Interaktion mit den Wählern eine größere Bedeutung haben, um deren Unterstützung zu gewinnen. Moulton glaubt, dass es wichtig ist, Kontakt mit Wählern aus der Arbeiterschicht aufzunehmen, was darauf hinweist, dass der persönliche Kontakt als effektiver angesehen wird, um Vertrauen und eine direkte Verbindung zu den Wählern herzustellen. Dies steht im Gegensatz zu Fernsehspots, die zwar eine breite Reichweite haben, aber möglicherweise nicht die gleiche Tiefe der Interaktion und des Engagements bieten können."
82,1,In welcher Wählergruppe hat Kamala Harris laut Umfragen einen deutlichen Vorsprung gegenüber Donald Trump?,Kamala Harris hat in der Gruppe der jungen Frauen einen deutlichen Vorsprung gegenüber Donald Trump.,Fake Fact,"Laut Umfragen hat Kamala Harris einen deutlichen Vorsprung gegenüber Donald Trump in der Wählergruppe der jungen Frauen. Dies wird durch Umfragen wie The Yale Youth Poll und The Harvard Youth Poll der Yale und Harvard University signalisiert, die zeigen, dass Harris bei jungen Wählerinnen und Wählern insgesamt einen großen Vorsprung hat, der sich besonders deutlich bei jungen Frauen zeigt.","Laut den bereitgestellten Informationen hat Kamala Harris in der Wählergruppe der ""black voter group"" einen deutlichen Vorsprung gegenüber Donald Trump."
82,2,Wie wird Donald Trumps Verkauf von Sneakern in diesem Wahljahr im Originalartikel beschrieben?,"Im Originalartikel wird berichtet, dass Donald Trump in diesem Wahljahr goldene Sneaker verkauft hat, ohne spezielle Bewertung oder zusätzlichen Kontext.",Framing,"Im Originalartikel wird beschrieben, dass Donald Trump in diesem Wahljahr bereits goldene Sneaker verkauft hat.",Der bereitgestellte Kontext enthält keine Informationen über den Verkauf von Sneakern durch Donald Trump in einem Wahljahr. Daher kann ich keine Beschreibung dazu aus dem Originalartikel ableiten.
82,3,"Welche politischen Themen sind für den 20-jährigen Domenic ein Grund, zu Kamala Harris zu tendieren?","Domenic tendiert zu Kamala Harris, weil sie sich für strengere Waffenkontrollen einsetzen würde.",Exaggeration,"Der 20-jährige Domenic tendiert zu Kamala Harris, weil sie sich für die Rechte von Frauen und die LGBTQ+-Community einsetzt, zu denen er sich zählt. Diese politischen Themen sind für ihn entscheidend bei seiner Wahlentscheidung.","Domenic tendiert dazu, Kamala Harris zu unterstützen, weil sie sich für Themen einsetzt, die ihm wichtig sind. Domenic glaubt an die Sicherheit in Schulen und öffentlichen Orten, und Kamala Harris wird als in der Lage beschrieben, die tiefe Spaltung zwischen den politischen Lagern zu überwinden, was auf eine Stabilität und Sicherheit in der Gesellschaft hindeutet. Zudem unterstützt Kamala Harris Reformen der internationalen Finanzarchitektur und des UN-Sicherheitsrates, was auf eine umfassende Sicherheits- und Stabilitätspolitik hinweist. Diese politischen Themen könnten für Domenic ein Grund sein, Kamala Harris zu unterstützen."
83,1,Wie viele Tage verbleiben bis zur Wahl laut Kamala Harris' Aussage im Originalartikel?,"Kamala Harris sagte, dass noch 106 Tage bis zur Wahl verbleiben.",Fake Fact,Laut Kamala Harris' Aussage im Originalartikel verbleiben noch 106 Tage bis zur Wahl.,"Der bereitgestellte Kontext enthält keine spezifische Information darüber, wie viele Tage bis zur Wahl verbleiben laut Kamala Harris' Aussage im Originalartikel."
83,2,Welche Bedeutung hat das limettengrüne Banner mit den schwarzen Buchstaben laut dem Originalartikel?,Die Grafik mit dem limettengrünen Hintergrund und den schwarzen Buchstaben ist eine Anspielung auf ein Album der britischen Popkünstlerin Charli XCX.,Framing,Das limettengrüne Banner mit den schwarzen Buchstaben ist eine Anspielung auf ein Album der britischen Popkünstlerin Charli XCX.,Der bereitgestellte Kontext enthält keine Informationen über ein limettengrünes Banner mit schwarzen Buchstaben. Daher kann ich keine Bedeutung dieses Banners aus dem gegebenen Kontext ableiten.
83,3,Wie reagierte das Publikum nach dem Erscheinen von Kamala Harris auf der Bühne laut dem Originalartikel?,"Laut dem Originalartikel wurde Kamala Harris von den Helfern gefeiert, als sie auf die Bühne kam.",Exaggeration,"Der Originalartikel enthält keine spezifischen Informationen darüber, wie das Publikum nach dem Erscheinen von Kamala Harris auf der Bühne reagierte.","Der bereitgestellte Kontext enthält keine Informationen darüber, wie das Publikum nach dem Erscheinen von Kamala Harris auf der Bühne reagierte."
84,1,Wie viele Menschen folgen dem TikTok-Account von Ex-Präsident Donald Trump laut Originalartikel?,Mehr als sieben Millionen Menschen folgen dem TikTok-Account von Ex-Präsident Donald Trump.,Fake Fact,Laut dem bereitgestellten Kontext folgen mehr als sieben Millionen Menschen dem TikTok-Account von Ex-Präsident Donald Trump.,"Der bereitgestellte Kontext enthält keine spezifische Information darüber, wie viele Menschen dem TikTok-Account von Ex-Präsident Donald Trump folgen."
