artikel_id,frage_nr,frage,musterloesung,fake_news_art,vector_rag_antwort_original_2,graph_rag_antwort_original_2
52,1,Welche Auswirkungen hatte die Regierung Biden laut Dwayne McKinney auf die Zinsen und Lebenshaltungskosten?,"Dwayne McKinney behauptet, dass die Zinsen und die Lebenshaltungskosten unter der Regierung Biden gestiegen sind.",Fake Fact,"Laut Dwayne McKinney hatte die Regierung Biden negative Auswirkungen auf die Zinsen und Lebenshaltungskosten. Er äußerte, dass die Zinsen und die Lebenshaltungskosten gestiegen seien und dass sich dies ändern müsse.","Der bereitgestellte Kontext enthält keine spezifischen Informationen darüber, welche Auswirkungen die Regierung Biden laut Dwayne McKinney auf die Zinsen und Lebenshaltungskosten hatte. Daher kann ich dazu keine Aussage treffen."
52,2,"Wie beurteilt der Bürgermeister von Morgantown, Billy Phelps, die Persönlichkeit von Donald Trump?","Der Bürgermeister von Morgantown, Billy Phelps, beschreibt Donald Trump als arrogant und mit einem zu großen Ego.",Framing,"Der Bürgermeister von Morgantown, Billy Phelps, beurteilt die Persönlichkeit von Donald Trump kritisch. Er sagt, dass er kein Fan des Ex-Präsidenten sei, da Trump arrogant sei und ein zu großes Ego habe.","Der bereitgestellte Kontext enthält keine Informationen darüber, wie der Bürgermeister von Morgantown, Billy Phelps, die Persönlichkeit von Donald Trump beurteilt."
52,3,Welche Bedenken hat Kendall Embry hinsichtlich der Demokraten in Bezug auf moralische Werte?,"Kendall Embry äußert Bedenken, dass das Land unter den Demokraten seinen moralischen Kompass verliert und bezeichnet manche Entwicklungen als beängstigend.",Exaggeration,"Kendall Embry hat Bedenken, dass das Land unter den Demokraten seinen moralischen Kompass verliert. Er begründet dies damit, dass sein moralischer Kompass auf seinem christlichen Glauben und der Bibel basiert. Embry empfindet, dass die Demokraten, insbesondere Harris, extrem links sind und dass bestimmte Entwicklungen nicht mit seinen moralischen Werten übereinstimmen.","Kendall Embry hat Bedenken, dass das Land unter der Führung der Demokraten seinen moralischen Kompass verliert. Er glaubt, dass einige Entwicklungen beängstigend sind und findet, dass Harris, ein Mitglied der Demokraten, extrem links ist. Diese Ansichten deuten darauf hin, dass Embry die moralischen Werte der Demokraten kritisch sieht und befürchtet, dass sie das Land in eine Richtung führen, die er als moralisch fragwürdig empfindet."
53,1,Wie ist der aktuelle Stand der Umfragen zwischen Trump und Harris in den USA und den sieben umkämpften Staaten?,"Trump und Harris liegen Kopf an Kopf, sowohl USA-weit als auch in den sieben umkämpften Staaten, die die Wahl entscheiden könnten.",Fake Fact,"Der aktuelle Stand der Umfragen zeigt, dass die Präsidentschaftskandidaten Trump und Harris sowohl in den USA insgesamt als auch in den sieben umkämpften Staaten nahezu gleichauf liegen. Es gibt keinen klaren Hinweis auf einen Erdrutschsieg für einen der beiden Kandidaten. Das Rennen ist besonders in den Swing States entscheidend, wo die Wahl noch offen ist, da einige Wähler sich noch nicht entschieden haben.","Der bereitgestellte Kontext enthält keine spezifischen Informationen über den aktuellen Stand der Umfragen zwischen Trump und Harris in den USA oder in den sieben umkämpften Staaten. Es gibt jedoch Hinweise darauf, dass Trump in Florida führt (""Trump - LEADS_IN -> Florida"") und dass er in mehreren entscheidenden Staaten einen Vorteil hatte (""Trump - HAD_ADVANTAGE_IN -> mehreren entscheidenden Staaten""). Weitere Details zu den Umfragen oder den spezifischen sieben umkämpften Staaten sind im Kontext nicht enthalten."
53,2,Welche Persönlichkeitseigenschaft wird Kamala Harris laut Franklin zugeschrieben?,Laut Franklin wird Kamala Harris als ehrlicher wahrgenommen.,Framing,"Laut Franklin wird Kamala Harris die Persönlichkeitseigenschaft zugeschrieben, als ehrlicher wahrgenommen zu werden.","Laut Franklin wird Kamala Harris als ""ehrlicher"" wahrgenommen."
53,3,"Welche Sorgen haben die Wählerinnen und Wähler parteiübergreifend, und wer wird in diesem Bereich als kompetenter angesehen?",Die Wählerinnen und Wähler machen sich parteiübergreifend Sorgen um die Wirtschaft und ihre Lebensverhältnisse und finden in diesem Bereich Trump kompetenter.,Exaggeration,Die Wählerinnen und Wähler machen sich parteiübergreifend Sorgen um die Wirtschaft und ihre Lebensverhältnisse. In diesem Bereich wird Trump als kompetenter angesehen.,Die Wählerinnen und Wähler sind parteiübergreifend an den Lebensverhältnissen und der Wirtschaft interessiert. In diesen Bereichen wird Trump als kompetent angesehen.
54,1,Wie viele Prozent der Befragten sahen laut Ipsos das Land Mitte Oktober auf dem falschen Weg?,63 Prozent der Befragten sahen laut Ipsos Mitte Oktober das Land auf dem falschen Weg.,Fake Fact,Laut der Befragung des Instituts Ipsos sahen Mitte Oktober 63 Prozent der Befragten das Land auf dem falschen Weg.,Laut Ipsos sahen Mitte Oktober 70 Prozent der Befragten das Land auf dem falschen Weg.
54,2,Welche Herausforderungen gibt es laut dem Originalartikel bezüglich der Vorhersage eines Wahlergebnisses durch Umfragen?,"Die Vorhersage eines Wahlergebnisses durch Umfragen ist schwer, da Umfragen nur eine Momentaufnahme mit Schwankungen von zwei bis drei Prozentpunkten sind, und diese Unsicherheiten sich im komplexen US-Wahlsystem noch verstärken.",Framing,"Laut dem bereitgestellten Kontext gibt es mehrere Herausforderungen bei der Vorhersage eines Wahlergebnisses durch Umfragen in den USA. Eine wesentliche Schwierigkeit besteht darin, dass viele Wählerinnen und Wähler zwar festgelegt sind, aber sehr kurzfristig entscheiden, ob sie tatsächlich zur Wahl gehen oder nicht. Diese kurzfristige Entscheidung ist schwer durch Umfragen zu erfassen, obwohl sie entscheidend für den Wahlausgang sein kann. Die Herausforderung für Meinungsforscher besteht also darin, vorherzusagen, welcher Kandidat seine Anhänger besser mobilisieren kann, tatsächlich zur Wahl zu gehen.",Der bereitgestellte Kontext enthält keine spezifischen Informationen über die Herausforderungen bei der Vorhersage eines Wahlergebnisses durch Umfragen. Daher kann ich auf Basis des gegebenen Kontexts keine Antwort auf diese Frage formulieren.
54,3,In welchem Bundesstaat wurde ein signifikanter Umfrageunterschied zur tatsächlichen Wahl in 2016 festgestellt?,"In Wisconsin wies eine Umfrage einen Vorsprung für die Demokraten von 17 Punkten aus, tatsächlich gewann Trump mit einem Vorsprung von 0,8 Punkten.",Exaggeration,"Im Jahr 2016 wurden in den umkämpften Swing States signifikante Unterschiede zwischen den Umfrageergebnissen und dem tatsächlichen Wahlergebnis festgestellt. Trumps Unterstützung wurde in den meisten Umfragen deutlich unterschätzt, was darauf hindeutet, dass seine Anhänger in diesen entscheidenden Staaten weniger bereit waren, an Umfragen teilzunehmen.","Im Bundesstaat Michigan wurde ein signifikanter Umfrageunterschied zur tatsächlichen Wahl in 2016 festgestellt, da Donald Trump die Wahl in Michigan 2016 gewonnen hat."
55,1,Was war die Ursache für die Kündigungen von Redakteuren bei der Washington Post?,"Redakteure der Washington Post kündigten, weil die Kommentar-Redaktion ihre Unterstützung für Kamala Harris bereits formuliert hatte, diese aber nicht veröffentlicht wurde, was als ein Versuch von Jeff Bezos gesehen wurde, sich bei Donald Trump beliebt zu machen.",Fake Fact,"Die Ursache für die Kündigungen von Redakteuren bei der Washington Post war die Entscheidung der Zeitung, erstmals seit Jahrzehnten keine Wahlempfehlung zur US-Wahl auszusprechen. Diese Entscheidung führte zu Unzufriedenheit und Spekulationen, dass der Zeitungseigentümer Bezos möglicherweise vor Trump eingeknickt sei.","Die Ursache für die Kündigungen von Redakteuren bei der Washington Post war die Entscheidung, keine Wahlempfehlung auszusprechen."
55,2,"Wie begründet Jeff Bezos die Entscheidung, auf eine Wahlempfehlung zu verzichten?","Jeff Bezos begründet den Verzicht auf eine Wahlempfehlung damit, dass er die Glaubwürdigkeit der Redaktion stärken möchte, indem er den Eindruck von Nicht-Unabhängigkeit vermeidet.",Framing,"Jeff Bezos begründet die Entscheidung, auf eine Wahlempfehlung zu verzichten, damit, dass er die Glaubwürdigkeit der Redaktion stärken möchte. Er betont, dass die Beendigung von Präsidentenempfehlungen eine prinzipielle Entscheidung sei, um den Eindruck von Nicht-Unabhängigkeit zu vermeiden. Bezos stellt klar, dass diese Änderung nicht vorgenommen wurde, um seine eigenen persönlichen Interessen zu schützen, sondern um die Integrität der Redaktion zu wahren.","Jeff Bezos begründet die Entscheidung, auf eine Wahlempfehlung zu verzichten, mit dem Ziel, die Glaubwürdigkeit der Redaktion zu stärken."
55,3,Wie wirkt sich der Verzicht auf Wahlempfehlungen seitens der Los Angeles Times aus?,Der Verzicht auf Wahlempfehlungen bei der Los Angeles Times führte ebenfalls zu Abo-Kündigungen und Kündigungen von Mitarbeitern.,Exaggeration,"Der Verzicht der Los Angeles Times auf Wahlempfehlungen hat zu mehreren Reaktionen geführt. Zunächst einmal hat der Eigentümer der Zeitung dem Editorial Board untersagt, Empfehlungen für Kamala Harris oder Donald Trump auszusprechen. Diese Entscheidung hat zu Unmut innerhalb der Redaktion geführt, was dazu führte, dass mehrere Journalistinnen und Journalisten ihre Kündigung einreichten. Darüber hinaus wurde die Entscheidung in sozialen Netzwerken intensiv diskutiert, was auf ein breites öffentliches Interesse und möglicherweise auch auf Kontroversen hinweist.",Der Verzicht auf Wahlempfehlungen seitens der Los Angeles Times wirkt sich durch Abo-Kündigungen und Kündigungen von Mitarbeitern aus.
56,1,Wie wurde Kamala Harris von Donald Trump in Bezug auf ihr Lachen beschrieben?,"Donald Trump bezeichnete Kamala Harris wegen ihres Lachens als ""verrückt"", eine Aussage, die Nadia Brown sowohl als sexistisch als auch rassistisch kritisiert.",Fake Fact,"Donald Trump hat Kamala Harris in Bezug auf ihr Lachen als ""die lachende Kamala"" beschrieben und sie als ""verrückt"" bezeichnet. Diese Beschreibung wird als sexistisch und rassistisch kritisiert.",Der bereitgestellte Kontext enthält keine spezifische Beschreibung von Kamala Harris durch Donald Trump in Bezug auf ihr Lachen.
56,2,Was sagte Nadia Brown über die US-Politik im Zusammenhang mit Rassismus und Sexismus?,"Nadia Brown sagte, die USA seien ein Land, das seine Politik ""auf Rassismus und Sexismus"" aufgebaut habe, und dass das, was heute zu sehen sei, das sei, was übrigbleibe, wenn Menschen abgewertet und von der politischen Teilnahme ausgeschlossen werden.",Framing,"Nadia Brown von der Georgetown University in Washington sagte, dass die USA ein Land seien, das seine Politik auf Rassismus und Sexismus aufgebaut habe. Sie betonte, dass das, was derzeit zu beobachten sei, die Konsequenz davon sei, dass Menschen abgewertet und von der politischen Teilnahme ausgeschlossen werden.","Der bereitgestellte Kontext enthält keine Informationen darüber, was Nadia Brown über die US-Politik im Zusammenhang mit Rassismus und Sexismus gesagt hat."
56,3,"Wie hoch war die Summe der Spenden, die Kamala Harris gesammelt hat?",Kamala Harris hat in kurzer Zeit mehr als eine Milliarde Dollar an Spenden gesammelt.,Exaggeration,Kamala Harris hat seit Beginn ihrer Kandidatur eine Rekordsumme von 540 Millionen Dollar an Spenden gesammelt.,"Der bereitgestellte Kontext enthält keine Informationen über die Summe der Spenden, die Kamala Harris gesammelt hat."
57,1,Wer ist Kamala Harris' republikanischer Gegenkandidat im Rennen um das Präsidentenamt laut dem Originalartikel?,Kamala Harris' republikanischer Gegenkandidat im Rennen um das Präsidentenamt ist Ex-Präsident Donald Trump.,Fake Fact,Laut dem bereitgestellten Kontext ist Kamala Harris' republikanischer Gegenkandidat im Rennen um das Präsidentenamt der Ex-Präsident Donald Trump.,Laut dem bereitgestellten Kontext ist Donald Trump Kamala Harris' republikanischer Gegenkandidat im Rennen um das Präsidentenamt.
57,2,Wie beschreibt der ehemalige Stabschef John Kelly Donald Trump in Bezug auf seine politische Ideologie?,"Der ehemalige Stabschef John Kelly beschreibt Donald Trump als jemand, der ""unter die allgemeine Definition eines Faschisten"" fällt, mit Bezug auf eine extrem rechte, autoritäre und ultranationalistische Ideologie.",Framing,"Der ehemalige Stabschef John Kelly beschreibt Donald Trump in Bezug auf seine politische Ideologie als jemanden, der ""unter die allgemeine Definition eines Faschisten"" fällt. Kelly verweist dabei auf die Merkmale des Faschismus, die eine extrem rechte, autoritäre und ultranationalistische Ideologie umfassen, einschließlich eines diktatorischen Anführers und der Unterdrückung der Opposition.","Der ehemalige Stabschef John Kelly beschreibt Donald Trump in Bezug auf seine politische Ideologie als jemanden, der aus seiner Sicht unter die allgemeine Definition eines Faschisten fällt."
57,3,"Was sagt Kamala Harris über die potenzielle Gefahr, die Donald Trump nach ihrer Einschätzung für die USA darstellt?","Kamala Harris sagt, dass Donald Trump eine Gefahr für das Wohlergehen und die Sicherheit Amerikas darstellt.",Exaggeration,"Kamala Harris äußert die Einschätzung, dass Donald Trump eine Gefahr für das Wohlergehen und die Sicherheit Amerikas darstellt. Sie hat in einer Bürgersprechstunde des US-Senders CNN deutlich gemacht, dass sie Trump für einen Faschisten hält. Harris betont, dass die Menschen denjenigen vertrauen sollten, die Trump in dieser Angelegenheit am besten kennen. Sie sieht in ihm eine Bedrohung, insbesondere da die Personen, die ihn möglicherweise zurückhalten könnten, nicht mehr in seiner Nähe sind.","Der bereitgestellte Kontext enthält keine spezifische Aussage von Kamala Harris über die potenzielle Gefahr, die Donald Trump ihrer Einschätzung nach für die USA darstellt."
58,1,"Welche Maßnahmen hat Donald Trump als Präsident unternommen, um das landesweite Recht auf Abtreibung zu beeinflussen?","Donald Trump hat als Präsident drei konservative Richter am Obersten Gerichtshof der USA etabliert, wodurch es möglich wurde, das landesweite Recht auf Abtreibung zu kippen.",Fake Fact,"Donald Trump hat als Präsident Maßnahmen ergriffen, die das landesweite Recht auf Abtreibung beeinflusst haben, indem er drei konservative Richter am Obersten Gerichtshof etabliert hat. Diese Entscheidungen haben den Weg für die Aufhebung des landesweiten Rechts auf Abtreibung geebnet. Trump wird von Unterstützern als der größte Abtreibungsgegner unter den US-Präsidenten angesehen, und seine Ernennungen zum Obersten Gerichtshof werden als entscheidend für die Kippung des landesweiten Rechts auf Abtreibung gelobt.","Donald Trump hat als Präsident Maßnahmen ergriffen, um das landesweite Recht auf Abtreibung zu beeinflussen, indem er ein Rollback für Frauenrechte initiierte."
58,2,Warum sehen einige Evangelikale trotz Trumps amoralischem Ruf Hoffnung in ihm?,"Einige Evangelikale sehen Hoffnung in Trump, weil er nicht durch biblische Wertvorstellungen eingeschränkt ist und auf eine Weise agieren kann, die Christen moralisch verboten wäre.",Framing,"Einige Evangelikale sehen trotz Trumps amoralischem Ruf Hoffnung in ihm, weil er nicht durch biblische Wertvorstellungen eingeschränkt ist. Diese fehlende Einschränkung ermöglicht es ihm, auf eine Weise zu agieren, die für Christen moralisch verboten wäre. Diese Fähigkeit, ohne Rücksicht auf moralische Bedenken zu handeln, wird von der religiösen Rechten als Vorteil angesehen, da sie hoffen, dass er ihre politischen und gesellschaftlichen Ziele effektiver durchsetzen kann.","Einige Evangelikale in den USA sehen trotz Trumps amoralischem Ruf Hoffnung in ihm, weil sie ihn verehren. Diese Verehrung könnte darauf hindeuten, dass sie in ihm eine Figur sehen, die ihre politischen oder sozialen Ziele unterstützt oder verkörpert. Trumps politische Positionen und Handlungen, wie seine ""America First""-Politik und seine Versuche, bestimmte wirtschaftliche Maßnahmen umzusetzen, könnten mit den Werten oder Interessen dieser Gruppe übereinstimmen."
58,3,Was sagte Donald Trump über den Attentatsversuch und seine Bedeutung für seine Mission?,"Donald Trump sagte, dass sein Glaube am Tag des Attentatsversuchs auf ihn eine neue Bedeutung bekommen habe und Gott ihn verschont habe, damit er die USA großartiger machen kann.",Exaggeration,"Donald Trump erklärte, dass der Attentatsversuch auf ihn, den er nur knapp überlebte, seinem Glauben eine neue Bedeutung verliehen habe. Er sieht es als Zeichen, dass Gott ihn verschont habe, damit er die USA großartiger denn je machen kann. Trump verbindet dieses Ereignis mit seiner Mission und appelliert an die christlichen Wähler, ihn durch ihre Stimmen bei der Wahl zu unterstützen, um so Gottes Willen zu tun.","Der bereitgestellte Kontext enthält keine Informationen darüber, was Donald Trump über einen Attentatsversuch und dessen Bedeutung für seine Mission gesagt hat."
59,1,"Welche Unterstützung aus dem Ausland plant Trump als erstes zu stoppen, sollte er wiedergewählt werden?","Trump plant als erstes, die Unterstützung für die Ukraine zu stoppen.",Fake Fact,"Sollte Trump wiedergewählt werden, plant er als erstes die Unterstützung für die Ukraine zu stoppen. Laut der Politikwissenschaftlerin Joyce Mushaben von der Georgetown-Universität in Washington sieht Trump dies als Lösung, um Präsident Wolodymyr Selenskyj zu Verhandlungen zu zwingen und möglicherweise einen Teil des ukrainischen Territoriums abzutreten.","Der bereitgestellte Kontext enthält keine spezifische Information darüber, welche Unterstützung aus dem Ausland Trump als erstes zu stoppen plant, sollte er wiedergewählt werden. Daher kann ich diese Frage nicht beantworten."
59,2,Wie wird Trumps mögliche Drohung bezüglich des Austritts aus der NATO von Experten eingeschätzt?,"Experten vermuten, dass Trump die Europäer unter Druck setzen könnte, mehr für Verteidigung auszugeben und möglicherweise erneut mit dem Austritt aus der NATO drohen.",Framing,"Experten, wie Marco Overhaus von der Stiftung Wissenschaft und Politik, schätzen Trumps mögliche Drohung, die USA aus der NATO herauszuführen, als ein Szenario ein, auf das man sich nur sehr schwer vorbereiten kann. Die Vorstellung, die NATO ""Trump-sicher"" zu machen, wird als Illusion betrachtet. Es wird erwartet, dass Trump die Europäer unter Druck setzen würde, mehr für Verteidigung auszugeben, und möglicherweise erneut mit einem Austritt aus der NATO drohen könnte.","Der bereitgestellte Kontext enthält keine spezifischen Informationen darüber, wie Experten Trumps mögliche Drohung bezüglich eines Austritts aus der NATO einschätzen. Es wird jedoch erwähnt, dass die NATO ein Anliegen bezüglich einer weiteren Trump-Präsidentschaft hat und dass sie das Ziel verfolgt, ""Trump-proof"" zu werden. Dies könnte implizieren, dass es Bedenken hinsichtlich der Stabilität und Kontinuität der NATO-Mitgliedschaft der USA unter einer weiteren Trump-Administration gibt. Eine direkte Einschätzung von Experten zu Trumps Drohung ist im Kontext jedoch nicht enthalten."
59,3,"Welche Maßnahmen könnte Trump gegenüber Regierungsmitarbeitern ergreifen, basierend auf den Einschätzungen von Experten?","Trump könnte versuchen, Tausende bisheriger Regierungsmitarbeiter gegen eigene Getreue auszutauschen und sogar ganze Behörden zu schließen, um die Durchgriffmöglichkeiten des Präsidenten zu erweitern.",Exaggeration,"Basierend auf den Einschätzungen von Experten könnte Trump, sollte er erneut Präsident werden, Maßnahmen ergreifen, um Tausende bisherige Regierungsmitarbeiter gegen eigene Getreue auszutauschen. Dies würde im Einklang mit den radikalen Plänen des ""Project 2025"" stehen, von denen er sich zwar offiziell distanziert hat, die er jedoch laut Expertenmeinungen möglicherweise umsetzen würde.","Basierend auf dem bereitgestellten Kontext gibt es keine spezifischen Informationen darüber, welche Maßnahmen Trump gegenüber Regierungsmitarbeitern ergreifen könnte, die auf den Einschätzungen von Experten basieren. Der Kontext enthält keine Relationstriplets, die direkt auf solche Maßnahmen hinweisen."
5,1,Wie wurde die Amtszeit von Donald Trump in Taiwan während seiner ersten Präsidentschaft bezeichnet?,"Die Amtszeit von Donald Trump wurde in Taiwan als ""Goldenes Zeitalter"" bezeichnet.",Fake Fact,"Die Amtszeit von Donald Trump während seiner ersten Präsidentschaft wurde in Taiwan als ""Goldenes Zeitalter"" bezeichnet. Taiwanische Medien verwendeten diesen Ausdruck, um die Jahre seiner ersten Amtszeit zu beschreiben.","Während seiner ersten Präsidentschaft wurde Donald Trumps Amtszeit in Taiwan als eine Zeit bezeichnet, in der er Taiwan erlaubte, Waffen, F16-Kampfjets und Panzer aus den USA zu kaufen. Die Vereinigten Staaten unter Trump stärkten die Beziehungen zu Taiwan und boten Sicherheitsgarantien an. Taiwan verließ sich auf Donald Trump, obwohl er nicht direkt in Taiwan-Angelegenheiten involviert war."
5,2,"Welche Maßnahmen traf Donald Trump, die die Wirtschaft der Volksrepublik China belasteten?","Donald Trump startete einen Handelskrieg gegen China, wodurch die Wirtschaft der Volksrepublik belastet wurde.",Framing,"Donald Trump traf mehrere Maßnahmen, die die Wirtschaft der Volksrepublik China belasteten. Erstens erlaubte er Taiwan den Kauf moderner Waffen wie F16-Kampfjets und Panzer, was politische Kräfte Chinas band. Zweitens startete er einen Handelskrieg gegen China, der die chinesische Wirtschaft belastete. Drittens plante er, eine Abgabe von zehn bis 20 Prozent auf alle Warenimporte zu erheben, wobei die Abgabe auf Güter aus China sogar 60 Prozent betragen sollte, um die heimische Wirtschaft zu schützen. Diese Maßnahmen führten zu Besorgnis in China über die schwerwiegenden wirtschaftlichen Auswirkungen und die Möglichkeit einer zweiten Runde des Handelskriegs.","Donald Trump traf Maßnahmen, die die Wirtschaft der Volksrepublik China belasteten, indem er Strafzölle verhängte und einen Handelskrieg initiierte, der die Wirtschaft der Volksrepublik beeinflusste."
5,3,Wie hoch sind die Verteidigungsausgaben Taiwans als Prozentsatz seines BIP im Vergleich zu den NATO-Staaten?,"Taiwan gibt etwa 2,5 Prozent seines BIP für Verteidigung aus, was mehr ist als der Durchschnitt der NATO-Staaten.",Exaggeration,"Taiwans Verteidigungsausgaben betragen etwa 2,5 Prozent seines Bruttoinlandsprodukts (BIP). Dies ist mehr als der Durchschnitt der NATO-Staaten, die im Vergleich dazu einen geringeren Prozentsatz ihres BIP für Verteidigung ausgeben.",Der bereitgestellte Kontext enthält keine Informationen über die Verteidigungsausgaben Taiwans oder deren Prozentsatz im Vergleich zu den NATO-Staaten. Daher kann ich diese Frage nicht beantworten.
60,1,In welchem US-Bundesstaat hat Eleazar Guevara hauptsächlich gearbeitet?,Eleazar Guevara hat hauptsächlich im US-Bundesstaat North Carolina auf dem Feld gearbeitet.,Fake Fact,"Eleazar Guevara hat hauptsächlich im US-Bundesstaat North Carolina gearbeitet. Dort war er vor allem auf dem Feld tätig, insbesondere bei der Süßkartoffelsaat sowie der Gurken- und Tabakernte.",Eleazar Guevara hat hauptsächlich in North Carolina gearbeitet.
60,2,Wie werden die Arbeitsbedingungen der Saisonarbeiter in den USA im Originalartikel beschrieben?,"Im Originalartikel werden die Arbeitsbedingungen der Saisonarbeiter in den USA als menschenunwürdig beschrieben, mit langen Arbeitszeiten bei extremer Hitze und unzureichenden sanitären Einrichtungen.",Framing,"Die Arbeitsbedingungen der Saisonarbeiter in den USA werden im Originalartikel als menschenunwürdig beschrieben. Die Arbeiter, darunter etwa 50 Saisonarbeiter, übernachteten in einer Halle, die nur mit zwei Duschen und vier Toiletten ausgestattet war. Sie arbeiteten bei extremer Hitze teils zwölf Stunden am Tag, wobei es immer wieder vorkam, dass jemand ohnmächtig wurde.",Der bereitgestellte Kontext enthält keine Informationen über die Arbeitsbedingungen der Saisonarbeiter in den USA. Daher kann ich keine Beschreibung dieser Bedingungen aus dem Kontext ableiten.
60,3,Welche Rolle spielen ausländische Arbeitskräfte laut Originalartikel für die Lebensmittelversorgung in den USA?,Ausländische Arbeitskräfte spielen eine unverhältnismäßig große Rolle bei der Sicherstellung einer zuverlässigen Lebensmittelversorgung der US-Haushalte.,Exaggeration,"Ausländische Arbeitskräfte spielen laut dem Originalartikel eine unverhältnismäßig große Rolle bei der Sicherstellung einer zuverlässigen Lebensmittelversorgung der US-Haushalte. Diese Arbeitskräfte, die überwiegend aus Mexiko stammen, sind sowohl mit als auch ohne Papiere tätig und übernehmen oft Arbeiten, die sonst keiner machen will. Ohne Migranten könnte es zu Problemen mit der Lebensmittelversorgung kommen, da sie einen wesentlichen Beitrag zur landwirtschaftlichen Produktion leisten, wie zum Beispiel bei der Ernte von Süßkartoffeln, Gurken und Tabak.","Der bereitgestellte Kontext enthält keine spezifischen Informationen darüber, welche Rolle ausländische Arbeitskräfte für die Lebensmittelversorgung in den USA spielen. Es wird lediglich erwähnt, dass die USA ausländische Arbeitskräfte benötigen und von der Arbeit von Migranten abhängig sind. Eine direkte Verbindung zur Lebensmittelversorgung wird im Kontext nicht hergestellt."
