artikel_id,frage_nr,frage,musterloesung,fake_news_art,vector_rag_antwort_original_2,graph_rag_antwort_original_2
28,2,Wie reagierte der Iran offiziell auf Berichte über das mutmaßliche Mordkomplott gegen Donald Trump?,Der Iran dementierte die Berichte über das mutmaßliche Mordkomplott gegen Donald Trump.,Framing,Der Iran dementierte offiziell die Berichte über das mutmaßliche Mordkomplott gegen Donald Trump.,"Der bereitgestellte Kontext enthält keine spezifischen Informationen darüber, wie der Iran offiziell auf Berichte über das mutmaßliche Mordkomplott gegen Donald Trump reagierte."
28,3,Welche Maßnahmen ergriff das US-Militär 2020 auf Anweisung von Donald Trump in Bezug auf den iranischen General Kassem Soleimani?,"Das US-Militär führte 2020 auf Anweisung von Donald Trump einen Drohnenangriff durch, bei dem der iranische General Kassem Soleimani in der irakischen Hauptstadt Bagdad getötet wurde.",Exaggeration,"Im Jahr 2020 ergriff das US-Militär auf Anweisung von Donald Trump die Maßnahme, den iranischen General Kassem Soleimani durch einen Drohnenangriff in der irakischen Hauptstadt Bagdad zu töten.","Im Jahr 2020 ergriff das US-Militär auf Anweisung von Donald Trump die Maßnahme, den iranischen General Kassem Soleimani durch einen Drohnenangriff in Bagdad zu töten. Soleimani, der als iranischer Top-General bekannt war, wurde somit gezielt durch das US-Militär getötet."
29,1,Welchen Gegner glaubte Joe Biden bei der Wahl schlagen zu können?,"Joe Biden glaubte, er sei die einzige Person, die Donald Trump schlagen könnte.",Fake Fact,"Joe Biden glaubte, dass er die einzige Person sei, die Donald Trump bei der Wahl schlagen könnte.","Basierend auf dem bereitgestellten Kontext glaubte Joe Biden, Donald Trump bei der Wahl schlagen zu können. Dies wird durch die Tatsache unterstützt, dass Joe Biden Donald Trump als Gastgeber hatte und Trumps Dämonisierung der Latinos kritisierte, was darauf hindeutet, dass Trump sein politischer Gegner war."
29,2,Was forderte der demokratische Senator Chris Coons bezüglich der Wahlniederlage der Demokratischen Partei?,"Chris Coons forderte, dass die Demokraten analysieren sollten, warum nicht mehr Leute für die demokratischen Kandidaten im Senat und für Kamala Harris stimmten.",Framing,"Der demokratische Senator Chris Coons forderte, dass die Demokraten sich zusammensetzen und herausfinden sollten, warum nicht mehr Menschen für die demokratischen Kandidaten im Senat und für Kamala Harris gestimmt haben.","Der bereitgestellte Kontext enthält keine Informationen darüber, was der demokratische Senator Chris Coons bezüglich der Wahlniederlage der Demokratischen Partei forderte."
29,3,Welche Probleme erkannte der unabhängige Senator Bernie Sanders in der Wahlkampagne der Demokraten?,"Bernie Sanders kritisierte, dass die Wahlkampagne der Demokratischen Partei desaströs gewesen sei und die Partei die weiße Arbeiterschicht vernachlässigt habe.",Exaggeration,"Der unabhängige Senator Bernie Sanders erkannte in der Wahlkampagne der Demokraten das Problem, dass die Partei die weiße Arbeiterschicht seit langem verlassen habe. Er bezeichnete die Wahlkampagne als desaströs und äußerte, dass es kein Wunder sei, dass kaum noch Arbeiter die Demokraten wählten.","Der unabhängige Senator Bernie Sanders kritisierte die Demokraten. Der Kontext liefert jedoch keine spezifischen Details darüber, welche Probleme er in ihrer Wahlkampagne erkannte. Es wird lediglich erwähnt, dass die Demokraten von Bernie Sanders kritisiert wurden."
2,1,Wer ist Donald Trumps Kandidat für den Botschafterposten in Israel und welche Position vertritt er in Bezug auf die Zwei-Staaten-Lösung?,"Donald Trumps Kandidat für den Botschafterposten in Israel ist Mike Huckabee. Er vertritt die Position, dass es keine palästinensische Identität gibt und lehnt daher eine Zwei-Staaten-Lösung ab.",Fake Fact,"Donald Trumps Kandidat für den Botschafterposten in Israel ist Mike Huckabee. Huckabee ist ein ehemaliger Baptisten-Pastor und früherer Gouverneur von Arkansas, der eine felsenfest pro-israelische Haltung einnimmt. Er bestreitet die Existenz einer palästinensischen Identität und lehnt daher eine Zwei-Staaten-Lösung ab.","Der bereitgestellte Kontext enthält keine Informationen darüber, wer Donald Trumps Kandidat für den Botschafterposten in Israel ist oder welche Position dieser Kandidat in Bezug auf die Zwei-Staaten-Lösung vertritt. Daher kann ich diese Frage nicht beantworten."
2,2,Wer repräsentiert die USA bei den Vereinten Nationen und welche politische Rolle hat diese Person in der Vergangenheit gespielt?,Die USA werden bei den Vereinten Nationen von Elise Stefanik repräsentiert. In der Vergangenheit hat sie Trump während des ersten Amtsenthebungsverfahrens aggressiv verteidigt.,Framing,Elise Stefanik repräsentiert die USA bei den Vereinten Nationen. In der Vergangenheit war sie Abgeordnete des Repräsentantenhauses.,"Der bereitgestellte Kontext enthält keine spezifischen Informationen darüber, wer die USA bei den Vereinten Nationen repräsentiert oder welche politische Rolle diese Person in der Vergangenheit gespielt hat."
2,3,Was ist der Schwerpunkt von Marco Rubio als künftiger Außenminister der USA?,"Der Schwerpunkt von Marco Rubio als künftiger Außenminister liegt auf Lateinamerika, insbesondere auf der Kontrolle der Migration über die Grenze zu Mexiko.",Exaggeration,"Der Schwerpunkt von Marco Rubio als künftiger Außenminister der USA liegt auf Lateinamerika. Er unterstützt Trumps Pläne, die Grenze zu Mexiko zu sichern und illegale Einwanderer abzuschieben. Zudem teilt er eine harte Haltung gegenüber China mit Trump und hat in der Vergangenheit für ""Pragmatismus"" im Ukraine-Konflikt plädiert.",Der Schwerpunkt von Marco Rubio als künftiger Außenminister der USA liegt auf einer harten Haltung gegenüber China und Russland. Er ist ein Hardliner in Bezug auf diese beiden Länder und hat eine starke Position gegen China und Iran. Zudem hat er Erfahrung im Außenausschuss des Senats und einen Fokus auf Lateinamerika. Rubio setzt sich für eine verhandelte Lösung im Ukraine-Krieg ein und erwartet von Europa mehr Eigenverantwortung.
30,1,"Wie hoch war der Anteil der Wähler in Kalifornien, die bei der aktuellen Wahl für Donald Trump gestimmt haben?",40 Prozent der Wähler in Kalifornien stimmten bei der aktuellen Wahl für Donald Trump.,Fake Fact,Bei der aktuellen Wahl haben 40 Prozent der Wähler in Kalifornien für Donald Trump gestimmt.,"Der bereitgestellte Kontext enthält keine spezifischen Informationen über den Anteil der Wähler in Kalifornien, die bei der aktuellen Wahl für Donald Trump gestimmt haben. Es wird lediglich erwähnt, dass Kalifornien Wähler für die Republikaner hatte, aber keine genauen Zahlen oder Prozentsätze werden angegeben."
30,2,"Welche Maßnahmen plant die kalifornische Regierung, um ihre Gesetze vor möglichen Angriffen aus Washington zu schützen?","Die kalifornische Regierung plant, sich juristisch gegen Maßnahmen der Bundespolitik zu Themen wie Abtreibung, Einwanderung und Klimawandel zu wehren.",Framing,"Die kalifornische Regierung plant, ihre Gesetze vor möglichen Angriffen aus Washington zu schützen, indem sie sich auf juristische Auseinandersetzungen vorbereitet. Der Gouverneur Gavin Newsom und die demokratischen Abgeordneten beabsichtigen, die bestehenden Gesetze ""trumpsicher"" zu machen, um die Freiheiten, die ihnen wichtig sind, zu verteidigen. Dazu gehört auch die Bereitschaft, vor Gericht zu kämpfen, um die Verfassung und die Rechtsstaatlichkeit aufrechtzuerhalten.","Die kalifornische Regierung plant, ihre Gesetze vor möglichen Angriffen aus Washington zu schützen, indem sie sich auf die Verteidigung gegen juristische Attacken vorbereitet. Die Regierung in Kalifornien hat sich darauf eingestellt, ihre Gesetze zu verteidigen und zu schützen, indem sie sich auf mögliche rechtliche Auseinandersetzungen vorbereitet, die von Washington ausgehen könnten."
30,3,Wie viele Klagen haben demokratische Bundesstaaten gegen die Trump-Regierung während seiner ersten Amtszeit gewonnen?,Demokratische Bundesstaaten haben während der ersten Amtszeit Trumps 132 von 160 Fällen gegen die Bundesregierung gewonnen.,Exaggeration,Während der ersten Amtszeit von Donald Trump haben demokratische Bundesstaaten 132 von 160 Klagen gegen die Trump-Regierung gewonnen.,Demokratische Bundesstaaten haben während der ersten Amtszeit der Trump-Regierung 132 Klagen gewonnen.
31,1,Was hat Biden über den Übergang zu seinem Nachfolger gesagt?,"Biden versprach einen ""friedlichen und geordneten"" Übergang zu seinem Nachfolger Donald Trump.",Fake Fact,"Biden hat einen ""friedlichen und geordneten"" Übergang zu seinem Nachfolger Donald Trump versprochen. Er betonte, dass dies das sei, was das amerikanische Volk verdiene. Zudem erklärte er, dass er seine Pflicht als Präsident erfüllen, seinen Eid einhalten und die Verfassung ehren werde. Am 20. Januar werde es in Amerika eine friedliche Machtübergabe geben.","Biden hat in Bezug auf den Übergang zu seinem Nachfolger gesagt, dass er sicherstellen möchte, dass sämtliche Hilfen noch vor seinem Abschied aus dem Weißen Haus im Januar 2025 bewilligt werden."
31,2,Wie beschrieb Biden die US-Wahlen in seiner Rede?,"Biden beschrieb die US-Wahlen als ""ehrlich, fair und transparent"" und betonte die Notwendigkeit, die politische Temperatur zu senken.",Framing,"In seiner Rede beschrieb Biden die US-Wahlen als eine Entscheidung, die das Land getroffen hat, und betonte, dass man sein Land nicht nur lieben könne, wenn man gewinne. Er akzeptierte das Wahlergebnis und versprach einen ""friedlichen und geordneten"" Übergang zu seinem Nachfolger Donald Trump. Biden bemühte sich um einen versöhnlichen Ton und betonte, dass alle Amerikaner, unabhängig davon, wen sie gewählt haben, keine Feinde, sondern Landsleute seien.","In seiner Rede beschrieb Biden die US-Wahlen als ehrlich, fair und transparent. Er betonte, dass es notwendig sei, die Temperatur in der US-Politik zu senken und dass man sein Land nicht nur lieben könne, wenn man gewinnt. Biden äußerte die Hoffnung, dass die Frage nach der Integrität des amerikanischen Wahlsystems endgültig aus der Welt geschafft werden könne."
31,3,Vor welcher Gefahr warnte Biden in Bezug auf Trump?,"Biden warnte davor, dass Trump eine Gefahr für die US-Demokratie darstellen könnte.",Exaggeration,Biden warnte vor Trump als einer Gefahr für die US-Demokratie und vor dessen Rückkehr ins Weiße Haus.,"Biden warnte vor der Gefahr, die Trump für die US-Demokratie darstellt."
32,1,Welche Maßnahme versprach Kamala Harris nach ihrer Wahlniederlage zu gewährleisten?,"Kamala Harris versprach, eine friedliche Machtübergabe sicherzustellen.",Fake Fact,"Nach ihrer Wahlniederlage versprach Kamala Harris, eine friedliche Machtübergabe sicherzustellen.","Kamala Harris versprach, eine friedliche Machtübergabe sicherzustellen."
32,2,Wie betonte Kamala Harris das Prinzip der Demokratie in ihrer Rede?,"Kamala Harris betonte, dass ein Grundprinzip der US-Demokratie darin bestehe, das Ergebnis einer Wahl zu akzeptieren, wenn man verliert. Dies unterscheide eine Demokratie von einer Monarchie oder Tyrannei.",Framing,"In ihrer Rede betonte Kamala Harris das Prinzip der Demokratie, indem sie ihre Wahlniederlage akzeptierte und ihre Anhänger dazu aufrief, das Ergebnis der Wahl zu akzeptieren. Sie unterstrich die Bedeutung einer friedlichen Machtübergabe, was ein wesentlicher Bestandteil demokratischer Prozesse ist. Durch diese Aussagen zeigte sie ihre Verpflichtung zur Aufrechterhaltung demokratischer Prinzipien und ermutigte ihre Anhänger, trotz der Enttäuschung weiter zu kämpfen und nicht den Mut zu verlieren.","Der bereitgestellte Kontext enthält keine spezifischen Informationen darüber, wie Kamala Harris das Prinzip der Demokratie in ihrer Rede betonte. Es gibt keine Relationstriplets, die direkt auf eine Rede oder eine spezifische Betonung des Demokratieprinzips durch Kamala Harris hinweisen."
32,3,Was sagte Kamala Harris zu ihren Anhängern in Bezug auf die Zukunft nach der Wahlniederlage?,"Kamala Harris sagte zu ihren Anhängern, sie sollten nicht verzweifeln, die Hände nicht in den Schoß legen und die Ärmel hochkrempeln, um weiterzukämpfen und den Mut nicht zu verlieren.",Exaggeration,"Kamala Harris rief ihre Anhänger dazu auf, weiter zu kämpfen und nicht den Mut zu verlieren, nachdem sie ihre Wahlniederlage eingeräumt hatte. Sie betonte die Notwendigkeit, das Ergebnis der Wahl zu akzeptieren, und versprach, eine friedliche Machtübergabe sicherzustellen.","Der bereitgestellte Kontext enthält keine spezifischen Informationen darüber, was Kamala Harris zu ihren Anhängern in Bezug auf die Zukunft nach der Wahlniederlage gesagt hat."
33,1,Wie viel Entwicklungshilfe zahlen die USA für Staaten in Afrika laut dem Originalartikel?,Laut dem Originalartikel zahlen die USA rund 66 Milliarden US-Dollar an Entwicklungshilfe für Staaten in Afrika.,Fake Fact,Laut dem Originalartikel zahlen die USA rund 66 Milliarden US-Dollar an Entwicklungshilfe für Staaten in Afrika.,"Der bereitgestellte Kontext enthält keine spezifischen Informationen darüber, wie viel Entwicklungshilfe die USA für Staaten in Afrika zahlen."
33,2,Welche Ansicht vertritt Donald Trump laut dem Originalartikel in Bezug auf die US-amerikanische Entwicklungshilfe?,"Laut dem Originalartikel vertritt Donald Trump die Ansicht, dass die USA nicht für andere Menschen zahlen sollten, sondern nur für ihre eigenen Leute.",Framing,"Laut dem Originalartikel vertritt Donald Trump die Ansicht, dass es Kürzungen bei der US-amerikanischen Entwicklungshilfe geben wird. Er hat bereits angekündigt, dass diese Kürzungen nicht nur die Entwicklungshilfe betreffen, sondern auch andere Bereiche. Dies könnte schwerwiegende Folgen für Menschen in Afrika haben, die auf diese Hilfe angewiesen sind, und könnte auch Beiträge für internationale Organisationen wie die Weltgesundheitsorganisation betreffen.",Der bereitgestellte Kontext enthält keine spezifische Aussage oder Ansicht von Donald Trump in Bezug auf die US-amerikanische Entwicklungshilfe. Daher kann keine faktenbasierte Antwort zu seiner Meinung oder Position zu diesem Thema gegeben werden.
33,3,Welche Rolle spielt China im Kontext der US-Afrikapolitik gemäß dem Originalartikel?,"Laut dem Originalartikel ist China derzeit Afrikas größter Handels- und Investitionspartner, und Trumps Interesse an Afrika war bislang eher bescheiden.",Exaggeration,"Im Kontext der US-Afrikapolitik spielt China eine bedeutende Rolle als Konkurrent. China ist derzeit der größte Handels- und Investitionspartner Afrikas, was darauf hindeutet, dass Chinas Einfluss auf dem afrikanischen Kontinent wächst. Im Gegensatz dazu wird der Einfluss der USA in Afrika als schrumpfend angesehen, insbesondere da Präsident Trump keine wesentlichen Änderungen in seiner Afrikapolitik vornimmt und sein Interesse an Afrika als eher bescheiden beschrieben wird. Trumps bisherige Haltung und Handlungen, wie die Beleidigung afrikanischer Staaten im Jahr 2018, haben möglicherweise dazu beigetragen, dass die USA ihre Beziehungen zu Afrika auf Sparflamme halten, was wiederum Chinas wachsenden Einfluss begünstigt.","Im Kontext der US-Afrikapolitik spielt China eine bedeutende Rolle als Afrikas größter Handels- und Investitionspartner. China hat Einfluss auf Afrika und ist in wirtschaftliche Abkommen mit dem Kontinent involviert. Aly-Khan Satchu glaubt, dass ein grundlegender Wandel der Afrikapolitik der USA unwahrscheinlich ist, was darauf hindeutet, dass Chinas bestehende Rolle und Einfluss in Afrika von den USA möglicherweise nicht wesentlich verändert oder herausgefordert wird."
34,1,Wie veränderte sich der mexikanische Peso nach Donald Trumps Wahlsieg?,"Der mexikanische Peso sank auf den schwächsten Stand seit über zwei Jahren. Zum ersten Mal seit August 2022 fiel die Währung kurzzeitig auf 20,8038 pro US-Dollar, was mehr als 3 Prozent unter seinem vorherigen Schlusskurs lag.",Fake Fact,"Nach dem Wahlsieg von Donald Trump sank der mexikanische Peso auf den schwächsten Stand seit über zwei Jahren. Zum ersten Mal seit August 2022 fiel die Währung kurzzeitig auf 20,8038 pro US-Dollar, was einem Rückgang von mehr als 3 Prozent im Vergleich zu seinem vorherigen Schlusskurs entspricht.","Nach Donald Trumps Wahlsieg fiel der mexikanische Peso auf 20,8038 pro US-Dollar, was den schwächsten Stand seit über zwei Jahren darstellte. Der Peso änderte sich um mehr als 3 Prozent unter seinem vorherigen Schlusskurs."
34,2,Was ist die Einstellung der mexikanischen Präsidentin Claudia Sheinbaum bezüglich der Beziehung zu den USA unter der Präsidentschaft von Donald Trump?,Die mexikanische Präsidentin Claudia Sheinbaum beschwor im Vertrauen auf eine gute Beziehung die gute Nachbarschaft zu den USA.,Framing,"Die mexikanische Präsidentin Claudia Sheinbaum betont die Bedeutung einer guten Nachbarschaft und Zusammenarbeit mit den USA unter der Präsidentschaft von Donald Trump. Sie hebt hervor, dass Mexiko und die USA sich nicht als Konkurrenten sehen sollten, sondern sich gegenseitig ergänzen. Sie weist darauf hin, dass sowohl mexikanische als auch US-amerikanische Geschäftsleute von der Zusammenarbeit profitieren und dass das Wachstum der mexikanischen Exporte beiden Ländern zugutekommt und ihre Beziehung stärkt. Trotz Trumps Drohungen mit Strafzöllen und Massenabschiebungen bleibt Sheinbaum optimistisch und setzt auf eine positive wirtschaftliche Zusammenarbeit.","Die mexikanische Präsidentin Claudia Sheinbaum fördert eine gute Nachbarschaft und gute Beziehung. Der Kontext gibt jedoch keine spezifische Information darüber, wie sie die Beziehung zu den USA unter der Präsidentschaft von Donald Trump sieht."
34,3,Welche maximale Höhe der Strafzölle drohte Donald Trump gegenüber Mexiko im Falle der Nichteinhaltung seiner Forderungen?,"Donald Trump drohte, die Strafzölle schrittweise auf 25 Prozent, dann 50 Prozent und schließlich auf 75 Prozent zu erhöhen.",Exaggeration,"Der bereitgestellte Kontext enthält keine spezifische Information über die maximale Höhe der Strafzölle, die Donald Trump gegenüber Mexiko im Falle der Nichteinhaltung seiner Forderungen angedroht hat.","Der bereitgestellte Kontext enthält keine spezifischen Informationen über die maximale Höhe der Strafzölle, die Donald Trump Mexiko im Falle der Nichteinhaltung seiner Forderungen androhte."
35,1,"Was waren die Bedenken der europäischen Staaten im Hinblick auf Trumps Drohung, die Ukraine-Hilfen zu beenden?","Die europäischen Staaten befürchteten, dass Trump die Ukraine-Hilfen beenden könnte, um die Ukraine in Verhandlungen mit Russland zu zwingen. Dies wäre ein gefährlicher Tabu-Bruch und könnte Putin zu weiteren Aggressionen verleiten.",Fake Fact,"Die europäischen Staaten äußerten Bedenken, dass Trump seine Drohung, die Ukraine-Hilfen zu beenden, umsetzen könnte. Diese Bedenken basieren auf mehreren Aspekten:

1. **Verteidigungsausgaben und NATO**: Trump hatte europäischen NATO-Partnern wiederholt vorgeworfen, ihre Verteidigungsausgaben auf Kosten der USA zu reduzieren und das westliche Militärbündnis infrage gestellt. Dies führte zu Unsicherheiten über die zukünftige Unterstützung der USA für die europäische Sicherheit.

2. **Verhandlungen mit Russland**: Es bestand die Befürchtung, dass Trump die Ukraine durch einen Stopp der Militärhilfe in Verhandlungen mit Russland zwingen könnte, was die geopolitische Stabilität in Europa gefährden würde.

3. **Unzureichende Kompensation durch Europa**: Sicherheitsexperten waren der Meinung, dass Europa die Hilfen aus den USA aktuell nicht kompensieren könnte. Dies würde massive Auswirkungen auf die Ukraine haben und Europa vor neue Herausforderungen stellen.

Insgesamt sorgten diese Faktoren dafür, dass Europa besorgt war über die potenziellen Konsequenzen von Trumps Drohungen und die Notwendigkeit, mehr Verantwortung zu übernehmen, um die Ukraine zu unterstützen.","Der bereitgestellte Kontext enthält keine spezifischen Informationen über die Bedenken der europäischen Staaten im Hinblick auf Trumps Drohung, die Ukraine-Hilfen zu beenden. Es wird lediglich erwähnt, dass Trump drohte, die Ukraine-Hilfen der USA zu stoppen, und dass die USA in die Fortsetzung der Ukraine-Hilfen involviert sind. Weitere Details zu den Bedenken der europäischen Staaten sind im gegebenen Kontext nicht enthalten."
35,2,Welche Meinung äußerte EU-Kommissionspräsidentin Ursula von der Leyen auf dem Gipfel in Budapest bezüglich der Unabhängigkeit Europas?,"Ursula von der Leyen betonte, dass Europa seine Zukunft selber in die Hand nehmen müsse und seine Verteidigungsfähigkeit ausbauen sollte, um von Autokraten eine klare Botschaft zu senden, dass nicht das Recht des Stärkeren gilt.",Framing,"Auf dem Gipfel in Budapest äußerte EU-Kommissionspräsidentin Ursula von der Leyen die Meinung, dass Europa unabhängiger werden müsse. Sie betonte, dass Europa seine Zukunft selbst in die Hand nehmen und seine Verteidigungsfähigkeit ausbauen solle. Zudem unterstrich sie die Notwendigkeit, den ""Autokraten dieser Welt"" eine klare Botschaft zu senden, dass nicht das Recht des Stärkeren gelten dürfe.","EU-Kommissionspräsidentin Ursula von der Leyen äußerte auf dem Gipfel in Budapest die Meinung, dass Europa unabhängiger sein sollte."
35,3,Wie reagierte der ungarische Regierungschef Viktor Orban auf Trumps Wiederwahl und welche Bedenken äußerte er?,"Viktor Orban sah in Trumps Wiederwahl eine Chance für einen schnellen Frieden in der Ukraine und stellte die Frage, ob Europa die finanzielle und militärische Unterstützung für die Ukraine allein schultern könnte. Er forderte eine neue europäische Ukraine-Strategie.",Exaggeration,"Der ungarische Regierungschef Viktor Orban reagierte auf Trumps Wiederwahl, indem er diese als Chance für einen schnellen Frieden in der Ukraine betrachtete. Er war der erste EU-Spitzenpolitiker, der Trump zum Wahlsieg gratulierte. Orban äußerte Bedenken darüber, ob Europa die finanzielle und militärische Unterstützung für die Ukraine allein schultern könnte, und forderte eine neue europäische Ukraine-Strategie.","Der ungarische Regierungschef Viktor Orban sieht Trumps Wiederwahl als Chance. Gleichzeitig äußerte er Bedenken hinsichtlich Europas, insbesondere in Bezug auf die finanzielle und militärische Unterstützung für die Ukraine."
36,1,"Was ist das Ziel der von der EU-Kommissionspräsidentin Ursula von der Leyen eingerichteten ""Trump-Task-Force""?","Das Ziel der von der EU-Kommissionspräsidentin Ursula von der Leyen eingerichteten ""Trump-Task-Force"" ist, zu verhindern, dass Trump die EU spalten könnte und um Maßnahmen schnell ergreifen zu können, falls er einen Handelskrieg mit der EU anzettelt.",Fake Fact,"Das Ziel der von der EU-Kommissionspräsidentin Ursula von der Leyen eingerichteten ""Trump-Task-Force"" ist es, zu verhindern, dass Donald Trump die EU spalten könnte. Zudem soll die Task-Force sicherstellen, dass Gegenmaßnahmen schnell bereitstehen, falls Trump versuchen sollte, einen Handelskrieg mit der EU zu beginnen, insbesondere angesichts eines großen Handelsdefizits. Dies soll die EU in die Lage versetzen, ihre Interessen besser zu verteidigen und auf mögliche Herausforderungen souverän zu reagieren.","Das Ziel der von der EU-Kommissionspräsidentin Ursula von der Leyen eingerichteten ""Trump-Task-Force"" ist es, auf die Herausforderungen und potenziellen Konfrontationen mit der Politik von Donald Trump zu reagieren. Dies schließt die Möglichkeit ein, notfalls auf harte Konfrontation zu schalten, um die Interessen der EU zu verteidigen."
36,2,Wie wurde die EU-Kommissionspräsidentin Ursula von der Leyen gegenüber Donald Trump in Bezug auf die zukünftige Zusammenarbeit beschrieben?,"Die EU-Kommissionspräsidentin Ursula von der Leyen wurde gegenüber Donald Trump in Bezug auf die zukünftige Zusammenarbeit als souverän und selbstbewusst beschrieben, obwohl sie im Falle einer nicht funktionierenden Zusammenarbeit bereit ist, auf harte Konfrontation zu schalten.",Framing,"Die EU-Kommissionspräsidentin Ursula von der Leyen wurde in Bezug auf die zukünftige Zusammenarbeit mit Donald Trump als jemand beschrieben, der ""ganz herzlich"" gratulierte, wobei der Fokus auf ""künftiger Zusammenarbeit"" liegt. Diese Herzlichkeit wird jedoch eher als Zeichen eines souveränen Selbstbewusstseins interpretiert. Falls die Zusammenarbeit nicht erfolgreich sein sollte, ist von der Leyen bereit, auf harte Konfrontation zu schalten, um die Interessen der EU besser verteidigen zu können. Dies zeigt, dass die EU unter ihrer Führung sowohl zur Kooperation als auch zur Konfrontation bereit ist, je nach den Entwicklungen in der Zusammenarbeit mit Trump.","Die EU-Kommissionspräsidentin Ursula von der Leyen wurde in Bezug auf die zukünftige Zusammenarbeit mit Donald Trump beschrieben als jemand, der ""notfalls auf harte Konfrontation schalten"" würde. Dies deutet darauf hin, dass sie bereit ist, eine entschlossene und möglicherweise konfrontative Haltung einzunehmen, falls es erforderlich sein sollte."
